2016;Nordeste;2;Paraíba;PB;25;Cajazeiras;2503704;0;Sertão Paraibano;1;Cajazeiras;2;3;4;LACERDA & GOLDFARB LTDA - EPP;1421;2158;FACULDADE SANTA MARIA;FSM;Br 230 Km;S/N;Sítio Serrote;Cristo Rei;58900000;70;6;9;3;8;15;13;11;4;0;1;0;0;0;0;0;1;0;0;1;1;1;0;1400;0;175;175;99;76;0;0;93;64;18;47;32;15;104;24;30;46;46;25;12;4;7;5;49;1;67;6;0;52;174;1;0
2016;Sul;4;Paraná;PR;41;Ponta Grossa;4119905;0;Centro Oriental Paranaense;5;Ponta Grossa;21;3;5;ASSOCIACAO MISSIONARIA DE BENEFICENCIA;1420;2160;FACULDADE SANT'ANA;IESSA;Rua Senador Pinheiro Machado;189;;Centro;84010310;137;0;0;4;5;0;0;4;6;4;6;45;60;1;2;0;0;0;1;1;1;1;1;40;0;41;41;19;22;0;0;12;27;2;6;4;2;31;4;1;4;7;11;8;6;3;1;29;0;0;0;0;12;41;0;1
2016;Nordeste;2;Bahia;BA;29;Ipirá;2914000;0;Centro Norte Baiano;3;Feira de Santana;12;3;5;FUNDAL FUNDACAO ANTONIO ALMEIDA E SILVA;1423;2163;FACULDADE EUGÊNIO GOMES;;Rua Manoel Oliveira e Silva;127;;Campus Universitário;44600000;10;0;0;0;0;2;1;3;2;0;0;0;2;0;0;1;1;0;1;1;1;1;1;320;2140;11;11;8;3;0;0;2;9;0;2;0;2;6;3;3;3;2;1;1;0;0;1;1;0;0;0;0;10;11;0;0
2016;Sul;4;Paraná;PR;41;Foz do Iguaçu;4108304;0;Oeste Paranaense;6;Foz do Iguaçu;24;3;5;ASSOCIACAO UNIFICADA PAULISTA DE ENSINO RENOVADO OBJETIVO-ASSUPERO;2415;2165;FACULDADE FOZ DO IGUAÇU;FAFIG;Avenida Paraná;3695;;Jardim Central;85863720;2;0;0;0;0;1;1;0;0;0;0;0;0;0;0;1;1;0;0;1;1;0;1;0;1500;17;16;9;7;0;0;10;5;1;1;0;1;10;5;0;4;3;3;2;2;2;0;13;0;2;0;0;1;16;0;0
2016;Centro-Oeste;5;Mato Grosso do Sul;MS;50;Campo Grande;5002704;1;Centro Norte de Mato Grosso do Sul;2;Campo Grande;4;3;5;ASSOCIACAO DE ENSINO SUPERIOR DE MATO GROSSO DO SUL;1308;2168;FACULDADE CAMPO GRANDE;FCG;Rua Afonso Pena;275;;Amambai;79005000;48;1;0;1;0;32;0;10;4;0;0;0;0;0;0;0;0;0;0;1;1;0;1;350;9145;80;79;46;33;0;0;31;43;5;10;9;1;34;35;14;15;16;9;12;11;1;1;53;2;16;0;0;8;79;0;0
2016;Sudeste;3;Minas Gerais;MG;31;Belo Horizonte;3106200;1;Metropolitana de Belo Horizonte;7;Belo Horizonte;30;3;5;ASSOCIACAO UNIFICADA PAULISTA DE ENSINO RENOVADO OBJETIVO-ASSUPERO;2415;2171;INSTITUTO BELO HORIZONTE DE ENSINO SUPERIOR;IBHES;Rua Albita;131;;Cruzeiro;30310160;47;0;0;11;3;11;13;7;1;0;1;0;0;0;0;0;0;0;1;1;1;0;1;720;9145;43;35;19;16;0;0;15;20;0;8;0;8;13;14;2;9;6;7;8;1;1;1;12;0;3;0;0;20;35;0;0
2016;Sudeste;3;São Paulo;SP;35;São Paulo;3550308;1;Metropolitana de São Paulo;15;São Paulo;61;3;4;SOCIEDADE DE ENSINO GUAIANAS S/S LTDA;1396;2173;FACULDADE GUAIANÁS;FAG;Rua Otelo Augusto Ribeiro;411;;Guaianases;8412000;16;0;0;2;0;4;6;2;2;0;0;0;0;0;0;0;0;0;0;1;1;1;1;842;8659;33;33;12;21;0;0;22;7;4;2;0;2;17;14;0;1;3;7;4;8;6;4;18;2;10;0;0;3;32;1;0
2016;Sul;4;Santa Catarina;SC;42;São José;4216602;0;Grande Florianópolis;5;Florianópolis;16;3;5;ASSOCIACAO UNIFICADA PAULISTA DE ENSINO RENOVADO OBJETIVO-ASSUPERO;2415;2174;FACULDADE DE SANTA CATARINA;FASC;Rua Salvador Di Bernardi;503;;Campinas;88101201;20;0;0;0;0;9;2;4;1;3;1;0;0;0;0;0;0;0;0;1;1;0;0;250;9874;55;39;23;16;0;0;15;20;4;17;0;17;19;3;4;6;6;13;4;3;0;3;39;0;0;0;0;0;39;0;0
2016;Sul;4;Santa Catarina;SC;42;Blumenau;4202404;0;Vale do Itajaí;4;Blumenau;12;3;4;SOCIEDADE EDUCACIONAL LEONARDO DA VINCI S/S LTDA;821;2175;FACULDADE METROPOLITANA DE BLUMENAU;FAMEBLU;Rua Doutor Pedro Zimmermann;385;;Salto do Norte;89065000;88;4;6;13;11;19;15;10;1;5;4;0;0;0;0;0;1;0;0;1;1;0;1;12397;13543;208;206;93;113;0;0;95;96;15;16;0;16;167;23;14;41;50;45;23;16;11;6;195;0;11;0;0;0;204;2;0
2016;Sudeste;3;São Paulo;SP;35;Osasco;3534401;0;Metropolitana de São Paulo;15;Osasco;57;3;4;FASE EDUCACAO E CULTURA LTDA;1429;2177;INSTITUTO PAULISTA DE ENSINO;FIPEN;Rua Euclides da Cunha;390;;Centro;6016030;17;0;1;0;1;4;5;3;2;1;0;0;0;0;0;0;1;0;0;0;1;1;1;414;515;24;24;9;15;0;0;7;10;7;5;1;4;10;9;0;0;3;4;6;6;1;4;18;0;2;2;0;2;24;0;0
2016;Nordeste;2;Ceará;CE;23;Fortaleza;2304400;1;Metropolitana de Fortaleza;3;Fortaleza;16;3;4;CENTRO DE ENSINO SUPERIOR RATIO LTDA - EPP;1431;2180;RATIO - FACULDADE TEOLÓGICA E FILOSÓFICA;RATIO;Avenida Visconde do Rio Branco;2.801;;Joaquim Távora;60055171;107;3;2;1;14;15;12;7;4;11;12;14;7;4;1;0;0;0;0;0;0;0;0;13;0;45;18;10;8;0;0;6;9;3;4;0;4;13;1;1;2;1;5;3;3;2;1;4;2;5;0;0;7;18;0;0
2016;Sudeste;3;São Paulo;SP;35;Santo André;3547809;0;Metropolitana de São Paulo;15;São Paulo;61;2;5;FUNDACAO SANTO ANDRE;149;2183;CENTRO UNIVERSITÁRIO FUNDAÇÃO SANTO ANDRÉ;CUFSA;Avenida Príncipe de Gales;821;;PRÍNCIPE DE GALES;9060650;166;0;3;1;3;27;17;64;31;13;4;0;2;1;0;0;0;0;1;0;1;0;1;18;8626;320;306;93;213;0;4;40;153;109;39;0;39;128;139;6;28;23;26;40;48;52;83;273;5;12;5;1;10;300;6;2
2016;Sul;4;Rio Grande do Sul;RS;43;Gravataí;4309209;0;Metropolitana de Porto Alegre;5;Porto Alegre;26;3;5;CAMPANHA NACIONAL DE ESCOLAS DA COMUNIDADE;407;2184;FACULDADE CNEC GRAVATAÍ;;Avenida Dr. José Loureiro da Silva;1991;;Centro;94010001;39;6;2;1;2;11;5;7;2;2;1;0;0;0;0;1;0;0;0;1;1;0;1;25;0;52;41;14;27;0;0;6;30;5;7;0;7;21;13;1;9;7;9;4;5;3;3;38;0;0;0;0;3;41;0;1
2016;Norte;1;Amazonas;AM;13;Manaus;1302603;1;Centro Amazonense;3;Manaus;7;3;5;INSPETORIA SALESIANA MISSIONARIA DA AMAZONIA;1433;2186;FACULDADE SALESIANA DOM BOSCO;FSDB;Avenida Epaminondas;57;;Centro;69010090;60;0;0;3;5;15;12;14;4;6;1;0;0;0;0;0;0;0;0;0;1;1;0;400;0;58;58;28;30;0;0;19;34;5;8;0;8;22;28;3;6;5;6;13;12;10;3;16;5;32;0;1;4;58;0;1
2016;Sul;4;Paraná;PR;41;Curitiba;4106902;1;Metropolitana de Curitiba;10;Curitiba;37;3;5;ASSOCIACAO DO COLEGIO NOSSA SENHORA DE SION;1435;2188;INSTITUTO SUPERIOR DE EDUCAÇÃO NOSSA SENHORA DE SION;ISE - SION;Alameda Presidente Taunay;260;;Batel;80420180;6;0;0;0;0;1;0;0;0;2;1;1;0;1;0;0;0;0;0;0;1;0;0;0;0;19;19;17;2;0;0;7;9;3;0;0;0;3;16;0;2;1;5;4;5;1;1;18;0;1;0;0;0;19;0;1
2016;Nordeste;2;Maranhão;MA;21;São Luís;2111300;1;Norte Maranhense;1;Aglomeração Urbana de São Luís;2;3;4;SOMAR - SOCIEDADE MARANHENSE DE ENSINO SUPERIOR LTDA - ME;1306;2189;FACULDADE DO MARANHÃO;FACAM-MA;Rua Trinta e Oito;Lote 03;;Bequimão;65062340;127;1;9;4;10;40;38;19;2;3;0;1;0;0;0;0;0;0;1;0;0;1;0;2378;1563;152;152;80;72;0;0;63;72;17;71;1;70;51;30;5;23;31;25;25;16;12;15;77;4;44;4;1;22;152;0;1
2016;Sul;4;Rio Grande do Sul;RS;43;Pelotas;4314407;0;Sudeste Rio-grandense;7;Pelotas;33;3;4;ANHANGUERA EDUCACIONAL LTDA;2600;2191;FACULDADE ANHANGUERA DE PELOTAS;;Avenida Fernando Osório;2.301;;Três Vendas;96055000;64;0;0;1;1;13;10;10;5;13;3;4;3;1;0;0;1;0;1;1;1;0;1;24951;7250;112;110;66;44;0;0;61;41;8;11;0;11;63;36;10;15;22;18;13;16;9;7;100;3;3;0;0;4;110;0;4
2016;Sul;4;Rio Grande do Sul;RS;43;Ivoti;4310801;0;Metropolitana de Porto Alegre;5;Gramado-Canela;24;3;5;ASSOCIACAO EVANGELICA DE ENSINO;1439;2192;INSTITUTO SUPERIOR DE EDUCAÇÃO IVOTI;ISEI;Rua Júlio Hauser;171;;Sete de Setembro;93900000;10;0;0;0;0;3;2;3;0;1;0;1;0;0;0;0;0;0;1;1;1;1;1;15;287;46;46;32;14;1;3;9;22;11;4;4;0;5;37;2;10;4;9;8;6;2;5;40;1;0;0;0;5;46;0;0
2016;Sul;4;Rio Grande do Sul;RS;43;Rio Grande;4315602;0;Sudeste Rio-grandense;7;Litoral Lagunar;35;3;4;ANHANGUERA EDUCACIONAL LTDA;2600;2194;FACULDADE ANHANGUERA DO RIO GRANDE;;Avenida Rheingantz;91;;Parque Residencial Coelho;96200480;54;0;2;1;2;9;7;9;1;13;4;6;0;0;0;0;1;0;1;1;1;0;1;24951;7250;99;96;52;44;0;0;54;31;11;13;0;13;54;29;8;19;19;16;9;10;10;5;75;5;5;0;0;11;96;0;3
2016;Sudeste;3;São Paulo;SP;35;São Paulo;3550308;1;Metropolitana de São Paulo;15;São Paulo;61;3;4;COSTA BRASILEIRA EDUCACIONAL LTDA;15863;2197;Faculdade Villas Boas;FVB;Avenida Conde de Frontin;1154;;Penha;3501000;19;0;0;1;1;3;5;4;2;1;0;0;1;0;1;0;0;0;0;0;1;1;0;2000;4000;28;24;14;10;0;0;10;11;3;2;0;2;9;13;0;3;3;2;4;7;4;1;13;2;7;0;0;2;24;0;0
2016;Sul;4;Rio Grande do Sul;RS;43;Porto Alegre;4314902;1;Metropolitana de Porto Alegre;5;Porto Alegre;26;3;5;SOCIEDADE EDUCACIONAL MONTEIRO LOBATO;1443;2198;FACULDADE MONTEIRO LOBATO;FATO;Rua dos Andradas;1180;;Centro;90020007;31;1;0;2;0;11;3;8;4;1;0;1;0;0;0;0;0;0;1;1;1;1;1;12;7072;43;42;17;25;0;0;15;24;3;1;0;1;9;32;0;4;7;10;11;4;3;3;35;1;0;0;0;6;42;0;0
2016;Sudeste;3;Minas Gerais;MG;31;Nova Porteirinha;3145059;0;Norte de Minas;2;Janaúba;4;3;4;ASSOCIACAO DE ENSINO VALE DO GORUTUBA S/S LTDA;1444;2200;FACULDADE VALE DO GORUTUBA;FAVAG;Avenida Tancredo  de Almeida Neves;302;;Centro;39525000;64;0;0;6;3;16;8;9;4;8;6;1;3;0;0;0;1;0;0;1;1;1;1;11;1900;83;83;41;42;0;0;50;28;5;6;0;6;29;48;15;12;16;12;15;10;1;2;40;3;29;0;0;11;83;0;1
2016;Sul;4;Paraná;PR;41;Guaratuba;4109609;0;Metropolitana de Curitiba;10;Paranaguá;38;3;4;INSTITUTO CAICARA DE PESQUISA E ENSINO SUPERIOR LTDA.;15680;2202;INSTITUTO SUPERIOR DE EDUCAÇÃO DE GUARATUBA;ISEPE Guaratuba;Rua Joaquim Menelau de Almeida Torres;101;;Piçarras;83280000;32;0;0;2;1;6;1;4;3;4;3;1;5;2;0;1;0;0;1;1;1;1;1;139;139;16;16;11;5;0;0;6;7;3;2;0;2;11;3;1;2;3;1;4;2;3;0;10;0;1;0;0;5;16;0;0
2016;Sudeste;3;São Paulo;SP;35;Tupi Paulista;3555109;0;Presidente Prudente;8;Dracena;34;3;5;CENTRO DE ENSINO SUPERIOR DE TUPI PAULISTA (CESTUPI);1449;2205;FACULDADE DE TUPI PAULISTA;-;Rua Arcebispo Lemieux;250;;Centro;17930000;5;1;1;0;0;1;0;2;0;0;0;0;0;0;0;0;1;0;0;0;1;0;1;0;0;17;17;9;8;0;0;0;14;3;0;0;0;17;0;1;4;3;4;2;1;0;2;15;1;1;0;0;0;17;0;0
2016;Sul;4;Paraná;PR;41;São José dos Pinhais;4125506;0;Metropolitana de Curitiba;10;Curitiba;37;3;5;ASSOCIACAO FRANCISCANA DE ENSINO SENHOR BOM JESUS;478;2206;FACULDADE FAE SÃO JOSÉ DOS PINHAIS;;Rua Paulino Siqueira Cortes;1.450;;Centro;83030730;39;4;0;5;5;12;8;4;0;0;0;1;0;0;0;1;1;0;1;0;1;0;1;31;8656;71;70;25;45;0;0;10;44;16;6;0;6;29;35;2;10;14;17;13;8;5;1;54;1;0;1;0;14;70;0;0
2016;Sudeste;3;Minas Gerais;MG;31;Juiz de Fora;3136702;0;Zona da Mata;12;Juiz de Fora;65;3;5;INSTITUTO ENSINAR BRASIL;218;2220;Faculdade Doctum de Juiz de Fora;DOCTUM;Estrada Dom Orione;s/n;;Dom Bosco;36025660;72;0;0;6;2;26;11;9;13;2;2;0;1;0;0;0;0;0;0;0;1;1;1;0;0;92;92;38;54;0;0;20;56;16;1;0;1;91;0;10;23;25;12;4;9;3;6;61;2;3;0;0;26;92;0;1
2016;Nordeste;2;Bahia;BA;29;Paulo Afonso;2924009;0;Vale São-Franciscano da Bahia;2;Paulo Afonso;5;3;4;ORGANIZACAO SETE DE SETEMBRO DE CULTURA E ENSINO LTDA;1457;2222;FACULDADE SETE DE SETEMBRO;FASETE;Avenida Vereador José Moreira;1000;;Centro;48601180;138;5;9;1;14;14;31;29;17;13;4;0;1;0;0;1;1;0;1;0;1;0;1;670;2280;85;84;30;54;0;0;27;48;9;19;17;2;64;1;11;22;22;11;9;4;2;3;16;7;54;0;0;7;83;1;0
2016;Sudeste;3;Minas Gerais;MG;31;São Lourenço;3163706;0;Sul/Sudoeste de Minas;10;São Lourenço;54;3;4;SOCIEDADE EDUCACIONAL ALEF LTDA - EPP;1459;2229;FACULDADE VICTOR HUGO;FVH;Avenida Dom Pedro II;135;;Centro;37470000;6;0;0;0;0;0;0;3;1;2;0;0;0;0;0;0;1;0;0;1;1;1;1;6;2;23;23;11;12;0;0;4;17;2;1;0;1;16;6;0;2;4;7;3;3;2;2;20;1;0;0;0;2;23;0;0
2016;Sudeste;3;Minas Gerais;MG;31;Belo Horizonte;3106200;1;Metropolitana de Belo Horizonte;7;Belo Horizonte;30;3;4;BAIAO CONSULTORIA & CONTABILIDADE LTDA;1461;2233;FACULDADE DE CIÊNCIAS SOCIAIS APLICADAS DE BELO HORIZONTE;FACISABH;Avenida  Antônio Carlos;521;1º ao 4º andar;Lagoinha;31210010;28;0;0;0;0;6;5;5;12;0;0;0;0;0;0;1;1;0;1;1;1;1;1;390;25;81;81;34;47;0;0;18;56;7;22;13;9;28;31;7;10;22;15;12;4;3;8;58;1;17;0;0;5;81;0;1
2016;Norte;1;Pará;PA;15;Belém;1501402;1;Metropolitana de Belém;3;Belém;7;3;5;SEMINARIO TEOLOGICO BATISTA EQUATORIAL;1463;2237;FACULDADE TEOLÓGICA BATISTA EQUATORIAL;FATEBE;Br 316 Km 01;6241;Ao lado do Castanhei;Castanheira;66645003;19;0;0;0;0;6;5;3;4;0;0;0;0;0;1;0;0;0;0;0;0;0;0;0;0;15;14;5;9;0;0;4;8;2;1;0;1;4;9;0;0;4;1;3;4;1;1;4;1;8;0;1;0;14;0;0
2016;Nordeste;2;Ceará;CE;23;Fortaleza;2304400;1;Metropolitana de Fortaleza;3;Fortaleza;16;3;5;ASSOCIACAO UNIFICADA PAULISTA DE ENSINO RENOVADO OBJETIVO-ASSUPERO;2415;2240;FACULDADE DE FORTALEZA;FAFOR;Rua Caetano Ximenes Aragão;110;;Água Fria;60813620;70;0;1;6;1;27;23;7;2;0;1;2;0;0;0;0;0;0;0;1;1;0;1;250;9412;73;61;28;33;0;0;24;34;3;6;0;6;49;6;5;8;15;7;9;7;6;4;13;0;44;0;0;4;61;0;1
2016;Sudeste;3;Minas Gerais;MG;31;Juiz de Fora;3136702;0;Zona da Mata;12;Juiz de Fora;65;3;5;ASSOCIACAO UNIFICADA PAULISTA DE ENSINO RENOVADO OBJETIVO-ASSUPERO;2415;2241;FACULDADE DO SUDESTE MINEIRO;FACSUM;Av Barão do Rio Branco;2872;;Centro;36016311;78;9;3;2;0;23;21;18;2;0;0;0;0;0;0;0;0;0;0;1;1;0;1;529;9452;112;112;70;42;0;0;54;54;4;11;0;11;28;73;9;29;29;15;14;10;4;2;100;4;7;0;0;1;112;0;0
2016;Nordeste;2;Pernambuco;PE;26;Recife;2611606;1;Metropolitana de Recife;5;Recife;17;3;5;ASSOCIACAO UNIFICADA PAULISTA DE ENSINO RENOVADO OBJETIVO-ASSUPERO;2415;2242;FACULDADE DO RECIFE;FAREC;Rua Dom Bosco;1.329;;Boa Vista;50070070;79;0;0;0;1;18;10;24;11;12;3;0;0;0;0;0;0;0;0;1;1;0;1;250;9874;85;74;45;29;0;0;27;43;4;9;0;9;48;17;2;16;17;11;7;10;8;3;29;0;38;1;0;6;74;0;0
2016;Nordeste;2;Paraíba;PB;25;João Pessoa;2507507;1;Mata Paraibana;4;João Pessoa;22;3;5;ASSOCIACAO UNIFICADA PAULISTA DE ENSINO RENOVADO OBJETIVO-ASSUPERO;2415;2243;FACULDADE PARAÍBANA;FAP;Rua Manoel Gualberto;255;;Miramar;58043150;22;0;0;1;0;11;4;3;1;1;1;0;0;0;0;0;0;0;0;1;1;0;1;254;9542;27;27;8;19;0;0;13;12;2;2;0;2;2;23;3;3;3;3;2;8;3;2;19;0;5;0;0;3;27;0;0
2016;Nordeste;2;Alagoas;AL;27;Maceió;2704302;1;Leste Alagoano;3;Maceió;11;3;5;ASSOCIACAO UNIFICADA PAULISTA DE ENSINO RENOVADO OBJETIVO-ASSUPERO;2415;2244;FACULDADE DA CIDADE DE MACEIÓ;FACIMA;Av. Durval de Góes Monteiro;4354;;Tabuleiro do Martins;57081285;75;0;3;7;3;29;14;7;6;4;2;0;0;0;0;0;0;0;0;1;1;1;1;250;9874;104;93;47;46;0;0;50;42;1;15;0;15;32;46;4;14;24;18;16;9;6;2;25;4;33;0;0;31;93;0;0
2016;Sudeste;3;Espírito Santo;ES;32;Vitória;3205309;1;Central Espírito-santense;3;Vitória;9;3;5;ASSOCIACAO UNIFICADA PAULISTA DE ENSINO RENOVADO OBJETIVO-ASSUPERO;2415;2245;FACULDADE DO ESPÍRITO SANTO;FACES;Avenida Nossa Senhora da Penha;1800;;Vermelho;29045400;40;3;1;4;2;9;11;9;1;0;0;0;0;0;0;0;0;0;1;1;1;1;1;108;15311;21;21;15;6;0;0;12;8;1;4;0;4;13;4;4;6;6;3;2;0;0;0;16;0;5;0;0;0;21;0;0
2016;Nordeste;2;Rio Grande do Norte;RN;24;Parnamirim;2403251;0;Leste Potiguar;4;Natal;18;3;4;SOCIEDADE EDUCACIONAL SERIDO LTDA - ME;15823;2246;FACULDADE METROPOLITANA DE CIENCIAS E TECNOLOGIA;FAMEC;Rua Massaranduba;130;;Nova Parnamirim;59150000;9;0;0;1;0;3;0;3;0;2;0;0;0;0;0;0;1;0;1;1;1;0;1;8;34;1;1;1;0;0;0;1;0;0;0;0;0;1;0;0;0;0;0;0;0;0;1;1;0;0;0;0;0;1;0;0
2016;Sudeste;3;São Paulo;SP;35;São Paulo;3550308;1;Metropolitana de São Paulo;15;São Paulo;61;3;5;INSTITUTO PAULISTA SAO JOSE DE ENSINO SUPERIOR LTDA;13474;2247;Faculdade Paulista São José;;Rua Atuaí;691;;Vila Esperança;3646000;14;0;0;1;0;6;2;2;0;3;0;0;0;0;0;1;1;0;1;1;1;1;1;3;0;18;13;7;6;0;0;0;12;1;11;0;11;2;0;0;1;2;1;0;4;2;3;11;2;0;0;0;0;13;0;0
2016;Nordeste;2;Sergipe;SE;28;Aracaju;2800308;1;Leste Sergipano;3;Aracaju;11;3;5;ASSOCIACAO UNIFICADA PAULISTA DE ENSINO RENOVADO OBJETIVO-ASSUPERO;2415;2248;FACULDADE SERGIPANA;FASER;Rua Oscar Valois Galvão;355;;Grangeru;49027220;22;0;0;1;0;5;7;3;3;3;0;0;0;0;0;0;0;0;0;1;1;0;1;378;9159;40;39;21;18;0;1;27;11;0;9;0;9;12;18;7;6;6;9;5;6;0;0;18;0;19;0;0;2;39;0;0
2016;Nordeste;2;Ceará;CE;23;Fortaleza;2304400;1;Metropolitana de Fortaleza;3;Fortaleza;16;3;4;CIA EDUCACIONAL RANCHO ALEGRE;3094;2256;Faculdade Stella Maris - FSM;FSM;Avenida Antônio Justa;3.180;;Meireles;60165090;8;0;0;0;1;1;2;1;1;1;1;0;0;0;0;0;0;0;0;0;1;1;0;0;0;15;14;5;9;0;0;9;5;0;0;0;0;2;12;0;3;1;0;2;4;2;2;8;0;6;0;0;0;14;0;0
2016;Sudeste;3;São Paulo;SP;35;Diadema;3513801;0;Metropolitana de São Paulo;15;São Paulo;61;3;4;DIADEMA ESCOLA SUPERIOR DE ENSINO S/S LTDA;888;2257;FACULDADE DIADEMA;FAD;Avenida Alda;831;;Parque 7 de Setembro;9910170;29;0;0;3;1;9;6;6;3;0;0;0;1;0;0;0;0;0;1;1;1;1;1;3000;3061;34;33;11;22;0;0;6;24;3;2;0;2;15;16;0;3;8;6;2;5;5;4;14;2;2;0;0;15;33;0;0
2016;Sudeste;3;Espírito Santo;ES;32;Guarapari;3202405;0;Central Espírito-santense;3;Guarapari;10;3;4;EDITORA E DISTRIBUIDORA EDUCACIONAL S/A;14514;2264;FACULDADE DE COMUNICAÇÃO PITÁGORAS UNIDADE GUARAPARI;PIT GUARAPARI;Rodovia Jones dos Santos Neves;1000;;Lagoa Funda;29214005;64;7;0;1;2;19;4;11;0;8;7;1;1;3;0;0;1;0;1;1;0;0;1;24951;7250;7;7;3;4;0;0;1;6;0;1;0;1;4;2;0;2;1;2;2;0;0;0;3;1;3;0;0;0;7;0;0
2016;Centro-Oeste;5;Goiás;GO;52;Formosa;5208004;0;Leste Goiano;4;Entorno de Brasília;12;3;4;FACULDADE CAMBURY FORMOSA LTDA;15817;2266;FACULDADE CAMBURY DE FORMOSA;CAMBURY;Rua Manoel Alves Ferreira;404;Bloco 01;Centro;73800000;17;0;0;1;1;6;2;4;1;1;0;1;0;0;0;0;0;0;1;1;1;0;1;304;0;34;34;16;18;0;0;17;12;5;9;0;9;14;11;2;9;3;4;6;4;2;4;11;0;22;0;0;1;34;0;0
2016;Sudeste;3;Minas Gerais;MG;31;Extrema;3125101;0;Sul/Sudoeste de Minas;10;Pouso Alegre;52;3;5;SOCIEDADE UNIFICADA DE EDUCACAO DE EXTREMA;1477;2270;FACULDADE DE CIÊNCIAS SOCIAIS APLICADAS DE EXTREMA;FAEX;Estrada Municipal Pedro Rosa da Silva;s/n;;Vila Rica;37640000;56;7;4;0;3;15;4;11;1;6;5;0;0;0;0;0;0;0;0;1;1;0;1;1;0;46;46;13;33;0;0;0;42;4;9;0;9;30;7;2;5;10;11;5;6;2;5;42;0;0;0;0;4;46;0;0
2016;Sudeste;3;Minas Gerais;MG;31;Ipatinga;3131307;0;Vale do Rio Doce;8;Ipatinga;39;3;4;PITAGORAS - SISTEMA DE EDUCACAO SUPERIOR SOCIEDADE LTDA;1204;2271;FACULDADE PITÁGORAS DE IPATINGA;FPI;Rua Jequitibá;401;;Horto;35160036;85;0;0;2;2;27;14;10;0;14;5;6;4;1;0;0;1;0;1;1;1;1;1;24951;7250;239;234;92;142;0;0;147;72;15;18;0;18;116;100;18;55;53;31;28;29;14;6;146;12;68;3;1;4;234;0;5
2016;Sudeste;3;Minas Gerais;MG;31;Montes Claros;3143302;0;Norte de Minas;2;Montes Claros;7;3;4;INSTITUTO EDUCACIONAL SANTO AGOSTINHO LTDA;1264;2275;FACULDADE DE DIREITO SANTO AGOSTINHO;FADISA;Avenida Donato Quintino;90;;Cidade Nova;39404006;70;0;0;1;0;10;13;21;10;7;2;4;2;0;0;0;1;0;0;1;1;0;1;5958;0;59;58;22;36;0;0;23;23;12;8;0;8;30;20;5;12;13;11;6;5;4;2;40;2;16;0;0;0;58;0;0
2016;Sudeste;3;São Paulo;SP;35;Campinas;3509502;0;Campinas;7;Campinas;32;3;4;GRUPO IBMEC EDUCACIONAL S.A;1223;2279;FACULDADE INTEGRADA METROPOLITANA DE CAMPINAS;METROCAMP;Rua Doutor Salles de Oliveira;1.661;;Vila Industrial;13035270;192;9;5;26;22;37;25;40;17;2;2;4;3;0;0;1;1;0;0;1;1;1;1;30000;0;245;245;100;145;0;0;73;116;56;29;0;29;58;158;9;31;52;54;31;34;17;17;236;1;3;1;0;4;244;1;0
2016;Sul;4;Paraná;PR;41;Cafelândia;4103453;0;Oeste Paranaense;6;Cascavel;23;3;4;UNICA UNIAO DE ENSINO SUPERIOR DE CAFELANDIA S/S LTDA - EPP;1483;2282;FACULDADE DE CAFELÂNDIA;FAC;Rodovia Pr 574 Km 03;S/N;Saída para Cascavel;Parque São Paulo;85415000;14;0;0;0;0;5;2;2;0;4;1;0;0;0;0;0;0;0;0;1;1;0;0;0;0;17;16;6;10;0;0;13;2;1;0;0;0;0;16;7;3;1;2;1;0;1;1;11;0;1;0;0;4;16;0;0
2016;Sul;4;Rio Grande do Sul;RS;43;Porto Alegre;4314902;1;Metropolitana de Porto Alegre;5;Porto Alegre;26;3;5;FUNDACAO SAO LOURENCO DE BRINDISI;3337;2287;ESCOLA SUPERIOR DE TEOLOGIA E ESPIRITUALIDADE FRANCISCANA;ESTEF;Rua Tomas Edison;212;;Santo Antônio;90640100;5;0;0;0;0;3;1;0;0;1;0;0;0;0;0;0;0;0;0;1;1;0;1;0;0;16;16;2;14;0;0;1;9;6;1;0;1;3;12;0;0;1;0;5;4;1;5;15;0;1;0;0;0;15;1;0
2016;Centro-Oeste;5;Goiás;GO;52;Rio Verde;5218805;0;Sul Goiano;5;Sudoeste de Goiás;13;3;4;CENTRO DE ENSINO SUPERIOR ALMEIDA RODRIGUES LTDA - EPP;1495;2288;FACULDADE ALMEIDA RODRIGUES;FAR;Rua Quinca Honório leão;1030;;Morada do Sol;75909030;27;3;1;1;0;3;7;5;1;5;0;0;1;0;0;1;1;0;1;1;0;1;0;143;0;42;38;20;18;0;0;11;23;4;24;23;1;13;1;7;6;11;5;6;2;1;0;25;0;9;1;0;3;38;0;0
2016;Sudeste;3;São Paulo;SP;35;Araçatuba;3502804;0;Araçatuba;3;Araçatuba;17;3;5;UNIAO CULTURAL E EDUCACIONAL DE ANGELES;1488;2289;FACULDADE UNIÃO CULTURAL DO ESTADO DE SÃO PAULO;UCESP;Avenida da Saudade;757;;Vila Estádio;16020070;12;0;0;1;0;2;1;4;2;2;0;0;0;0;0;0;0;0;1;0;1;1;1;21;48;17;17;7;10;0;0;8;6;3;1;1;0;8;8;2;4;2;4;2;3;0;0;13;1;1;1;0;1;16;1;0
2016;Sul;4;Rio Grande do Sul;RS;43;Santa Maria;4316907;0;Centro Ocidental Rio-grandense;3;Santa Maria;18;3;4;PRO-ENSINO SOCIEDADE CIVIL LTDA - ME;1493;2297;FACULDADE DE DIREITO DE SANTA MARIA;FADISMA;Rua Duque de Caxias;2319;;Medianeira;97060210;36;0;2;1;2;12;6;9;0;3;1;0;0;0;0;0;0;0;0;0;1;0;1;0;8656;62;62;26;36;0;0;16;41;5;6;0;6;10;46;9;16;7;13;12;3;1;1;48;0;1;0;0;13;62;0;0
2016;Sul;4;Paraná;PR;41;Curitiba;4106902;1;Metropolitana de Curitiba;10;Curitiba;37;3;5;FUNDACAO EDUCACIONAL MENONITA;1498;2301;FACULDADE FIDELIS;FF;Rua Doutor Danilo Gomes;834;;Boqueirão;81670250;18;0;0;1;2;5;2;2;0;2;0;1;1;2;0;0;0;0;1;1;1;1;1;15;0;23;23;9;14;0;0;6;12;5;4;0;4;19;0;0;5;1;2;5;4;2;4;20;1;1;0;0;1;23;0;0
2016;Sudeste;3;Minas Gerais;MG;31;Belo Horizonte;3106200;1;Metropolitana de Belo Horizonte;7;Belo Horizonte;30;3;5;ASSOCIACAO EDUCATIVA DO BRASIL - SOEBRAS;1509;2311;FACULDADE KENNEDY DE MINAS GERAIS - FKMG;FKMG;Rua José Dias Vieira;46;;Visconde do Rio Branco;31535040;95;8;12;4;3;30;16;12;6;0;1;0;2;0;1;0;0;0;0;1;1;1;0;5;5;23;23;10;13;0;0;2;16;5;9;0;9;12;2;0;5;6;2;3;2;0;5;13;0;5;0;0;5;23;0;0
2016;Sul;4;Paraná;PR;41;Marechal Cândido Rondon;4114609;0;Oeste Paranaense;6;Toledo;22;3;5;ASSOC DO INSTITUTO VOCACIONAL E ASSIST RUI BARBOSA;1506;2312;FACULDADE LUTERANA RUI BARBOSA;FALURB;Rua D Pedro;1151;;Centro;85960000;7;0;0;0;0;3;0;2;0;2;0;0;0;0;0;0;0;0;0;0;1;0;0;0;0;27;27;8;19;0;0;14;12;1;1;1;0;16;10;5;7;3;4;3;3;1;1;27;0;0;0;0;0;27;0;0
2016;Sul;4;Santa Catarina;SC;42;São José;4216602;0;Grande Florianópolis;5;Florianópolis;16;3;4;ANHANGUERA EDUCACIONAL LTDA;2600;2319;ESCOLA SUPERIOR DE EDUCAÇÃO CORPORATIVA;ESEC;Rua João Grumiche;2069;;Roçado;88108100;38;0;0;0;0;9;9;1;4;2;3;5;4;1;0;0;1;0;1;1;1;0;1;24951;7250;7;7;4;3;0;0;1;6;0;1;0;1;3;3;1;0;0;2;1;1;2;0;7;0;0;0;0;0;7;0;0
2016;Sudeste;3;Espírito Santo;ES;32;Vila Velha;3205200;0;Central Espírito-santense;3;Vitória;9;3;4;ATENEU INSTITUICOES DE ENSINO E PESQUISA LTDA - EPP;1501;2320;INSTITUTO SUPERIOR DE EDUCAÇÃO ATENEU;ISEAT;Rua Professor Annor Silva;106;;Coqueiral de Itaparica;29102160;11;0;1;0;0;2;3;2;2;0;0;1;0;0;0;0;1;0;0;1;1;1;1;8;0;10;10;3;7;0;0;3;6;1;2;0;2;0;8;0;2;0;1;2;3;1;1;7;2;0;0;0;1;10;0;0
2016;Norte;1;Rondônia;RO;11;Vilhena;1100304;0;Leste Rondoniense;2;Vilhena;7;3;4;IESA INSTITUTO DE ENSINO SUPERIOR DA AMAZONIA S/C LTDA - ME;1513;2323;FACULDADE DA AMAZÔNIA;FAMA;Rua 743;2043;;Cristo Rei;78995000;18;0;0;6;5;3;1;0;0;3;0;0;0;0;0;0;1;0;1;1;1;1;0;0;0;35;35;24;11;0;1;15;12;7;18;18;0;16;1;10;9;6;2;4;0;1;3;8;0;16;0;0;11;35;0;0
2016;Sul;4;Santa Catarina;SC;42;São José;4216602;0;Grande Florianópolis;5;Florianópolis;16;3;4;ANHANGUERA EDUCACIONAL LTDA;2600;2324;FACULDADE UNIÃO BANDEIRANTE;FUBSJ;Rua Luiz Fagundes;1.680;;Picadas do Sul;88106000;38;0;0;0;0;9;9;1;4;2;3;5;4;1;0;0;1;0;1;1;1;0;1;24951;7250;89;86;42;44;0;0;44;36;6;6;0;6;39;41;4;11;25;16;16;8;4;2;73;3;5;1;0;4;85;1;3
2016;Sudeste;3;São Paulo;SP;35;Botucatu;3507506;0;Bauru;4;Botucatu;23;3;5;INSTITUICAO TOLEDO DE ENSINO;700;2328;FACULDADE ITEANA DE BOTUCATU;FITB;Avenida Alcides Cagliari;2.601;;Jardim Evelyn;18606855;16;0;0;0;0;3;2;3;0;2;1;1;3;0;1;1;0;0;1;1;1;0;1;146;37;42;42;15;27;0;0;12;22;8;6;0;6;16;20;2;7;7;11;5;3;3;4;41;0;0;0;0;1;42;0;0
2016;Centro-Oeste;5;Mato Grosso;MT;51;Cuiabá;5103403;1;Centro-Sul Mato-grossense;4;Cuiabá;17;3;5;FCR EDUCACIONAL LTDA;16064;2330;Faculdade Cândido Rondon;FCR;Avenida Beira Rio;3.045;;Jardim Europa;78065780;15;1;1;1;0;5;4;3;0;0;0;0;0;0;0;1;0;0;0;1;1;0;1;22;500;28;28;13;15;0;0;19;8;1;6;0;6;13;9;3;5;10;5;1;2;1;1;8;0;6;0;0;14;28;0;0
2016;Sudeste;3;São Paulo;SP;35;Piraju;3538808;0;Assis;10;Ourinhos;40;3;4;UNIAO DE ENSINO SUPERIOR DE PIRAJU LTDA;1521;2332;FACULDADE CORPORATIVA CESPI;FACESPI;Rua Joaquim Franco da Silva,;140;;Distrito Industrial;18800000;10;0;1;0;0;2;0;3;2;1;1;0;0;0;0;0;1;0;0;1;1;1;0;0;0;29;27;13;14;0;0;16;9;2;3;0;3;6;18;1;5;5;7;3;3;1;2;24;2;1;0;0;0;27;0;0
2016;Sudeste;3;Rio de Janeiro;RJ;33;Rio das Ostras;3304524;0;Baixadas;4;Bacia de São João;9;3;5;CAMPANHA NACIONAL DE ESCOLAS DA COMUNIDADE;407;2334;FACULDADE CENECISTA DE RIO DAS OSTRAS;FCRO;Rua Renascer da Terceira Idade;s/n;;Jardim Campomar;28890000;27;3;3;3;0;5;5;5;2;0;0;0;0;1;0;0;0;0;1;1;1;0;1;0;42;60;60;30;30;0;0;18;34;8;6;0;6;20;34;5;14;15;8;6;5;6;1;22;1;4;0;0;33;60;0;0
2016;Centro-Oeste;5;Goiás;GO;52;São Luís de Montes Belos;5220108;0;Centro Goiano;3;Anicuns;9;3;4;CENTRO EDUCACIONAL MONTES BELOS LTDA;1526;2336;FACULDADE MONTES BELOS;FMB;Avenida Hermógenes Coelho;340;;Setor Universitário;76100000;95;12;7;12;10;19;17;12;2;4;0;0;0;0;0;0;0;0;0;1;1;0;1;178;0;67;67;38;29;0;0;7;40;20;32;0;32;35;0;10;15;16;8;6;8;3;1;37;1;10;0;0;19;67;0;0
2016;Sudeste;3;São Paulo;SP;35;Carapicuíba;3510609;0;Metropolitana de São Paulo;15;Osasco;57;3;4;CEALCA-CENTRO DE ENSINO ALDEIA DE CARAPICUIBA LTDA - EPP;1532;2341;FACULDADE DA ALDEIA DE CARAPICUÍBA;FALC;Estrada da Aldeinha;245;;Jardim Marilu;6343320;25;1;2;1;2;2;1;13;2;0;1;0;0;0;0;0;0;0;0;1;1;1;0;420;6345;87;85;29;56;0;0;26;44;15;52;0;52;33;0;0;7;21;17;11;7;9;13;53;5;5;2;0;20;84;1;0
2016;Sudeste;3;São Paulo;SP;35;São José do Rio Preto;3549805;0;São José do Rio Preto;1;São José do Rio Preto;4;3;4;ANBAR ENSINO TECNICO E SUPERIOR LTDA;1533;2342;INSTITUTO SUPERIOR DE EDUCAÇÃO CERES;ISE-CERES;Avenida Anísio Haddad;6751;;Jardim Morumbi;15093000;46;0;0;0;0;14;11;6;3;9;2;1;0;0;0;1;1;0;0;0;1;0;1;2500;8000;1;1;0;1;0;0;1;0;0;0;0;0;1;0;0;0;1;0;0;0;0;0;1;0;0;0;0;0;1;0;0
2016;Norte;1;Acre;AC;12;Rio Branco;1200401;1;Vale do Acre;2;Rio Branco;4;3;4;SOCIEDADE ACREANA DE EDUCACAO E CULTURA LTDA;1534;2343;FACULDADE DA AMAZÔNIA OCIDENTAL;FAAO;Estrada Dias Martins;894;;Jardim Primavera;69911845;32;0;0;0;0;14;7;5;2;3;1;0;0;0;0;1;1;0;1;1;1;1;1;150;3500;91;86;39;47;0;0;59;23;4;13;1;12;42;31;18;18;15;14;10;4;3;4;26;1;29;1;0;29;85;1;1
2016;Sul;4;Rio Grande do Sul;RS;43;Passo Fundo;4314100;0;Noroeste Rio-grandense;1;Passo Fundo;10;3;5;INSTITUTO DA SAGRADA FAMILIA;1536;2346;INSTITUTO SUPERIOR DE FILOSOFIA BERTHIER;IFIBE;Rua Senador Pinheiro;350;;Vila Rodrigues;99070220;14;0;0;0;0;2;3;3;4;0;0;0;2;0;0;0;0;0;0;0;1;1;1;1;0;8;8;1;7;0;0;0;2;6;3;0;3;0;5;0;1;1;2;1;2;1;0;7;1;0;0;0;0;8;0;0
2016;Sudeste;3;São Paulo;SP;35;Mogi Guaçu;3530706;0;Campinas;7;Mogi Mirim;31;3;4;COLEGIO INTEGRADO SAO FRANCISCO S/S LTDA - EPP;1538;2348;INSTITUIÇÃO DE ENSINO SÃO FRANCISCO;IESF;Rua Luiz Martini;601;;Guaçu Parque Real;13845000;9;0;0;0;0;1;1;4;2;0;1;0;0;0;0;0;0;0;0;0;0;0;0;0;0;40;40;21;19;0;0;14;21;5;4;0;4;17;19;3;4;8;8;4;8;4;1;38;0;0;0;0;2;40;0;1
2016;Norte;1;Pará;PA;15;Ananindeua;1500800;0;Metropolitana de Belém;3;Belém;7;3;4;SOCIEDADE CIVIL INTEGRADA MADRE CELESTE LTDA;1539;2350;ESCOLA SUPERIOR MADRE CELESTE;ESMAC;Estrada da Providência;10;Cidade Nova VIII;Coqueiro;67110000;108;4;1;6;3;42;33;16;3;0;0;0;0;0;0;0;0;0;0;1;1;1;1;0;0;96;95;42;53;0;0;22;62;11;15;0;15;63;17;7;21;20;11;12;12;6;6;22;6;32;0;0;35;95;0;0
