2014;Sul;4;Rio Grande do Sul;RS;43;Porto Alegre;4314902;1;Metropolitana de Porto Alegre;5;Porto Alegre;26;2;5;INSTITUTO PORTO ALEGRE DA IGREJA METODISTA;304;4010;CENTRO UNIVERSITÁRIO METODISTA;IPA;Rua Coronel Joaquim Pedro Salgado;80;Terreo;Rio Branco;90420060;547;37;30;12;17;125;83;127;96;7;7;3;3;0;0;1;1;0;0;0;0;0;0;0;0;338;334;201;133;0;0;22;225;87;68;0;68;87;179;13;58;77;64;53;37;19;13;301;1;3;0;0;15;334;0;6
2014;Sudeste;3;São Paulo;SP;35;Rio Claro;3543907;0;Piracicaba;6;Rio Claro;26;3;4;ANHANGUERA EDUCACIONAL LTDA;2600;4013;FACULDADE ANHANGUERA DE RIO CLARO;;Rua 22 Be;668;;Chácara Luza;13501388;50;0;0;0;0;9;6;7;4;11;8;4;1;0;0;1;1;0;0;0;0;0;0;0;0;52;52;21;31;0;0;31;11;10;5;0;5;44;3;3;14;15;5;5;5;4;1;47;2;2;1;0;0;52;0;0
2014;Sudeste;3;Rio de Janeiro;RJ;33;Rio de Janeiro;3304557;1;Metropolitana do Rio de Janeiro;6;Rio de Janeiro;18;3;1;MINISTERIO DA EDUCACAO;391;4016;INSTITUTO NACIONAL DE EDUCAÇÃO DE SURDOS;INES;Rua das Laranjeiras;232;;Laranjeiras;22240001;218;0;0;0;3;35;40;36;27;50;12;11;4;0;0;1;0;0;0;0;0;0;0;0;0;45;43;35;8;0;0;5;7;31;42;36;6;1;0;1;7;9;7;4;4;6;5;14;2;1;0;0;11;43;0;6
2014;Sudeste;3;São Paulo;SP;35;Jundiaí;3525904;0;Macro Metropolitana Paulista;12;Jundiaí;47;2;4;SOCIEDADE PADRE ANCHIETA DE ENSINO LTDA;265;4017;CENTRO UNIVERSITÁRIO PADRE ANCHIETA;UNIANCHIETA;Avenida Dr. Adoniro Ladeira;94;;Vila Jundiainopolis;13210800;376;37;57;11;10;75;39;86;38;18;3;1;0;1;0;0;1;0;0;0;0;0;0;0;0;437;437;189;248;0;0;152;199;86;107;0;107;26;304;20;70;108;62;68;57;25;27;393;3;4;3;0;11;436;1;1
2014;Sudeste;3;São Paulo;SP;35;Botucatu;3507506;0;Bauru;4;Botucatu;23;3;2;CENTRO ESTADUAL DE EDUCACAO TECNOLOGICA PAULA SOUZA;33;4020;FACULDADE DE TECNOLOGIA DE BOTUCATU;FATEC BT;Avenida José Ítalo Bachi;s/n;;Jardim Aeroporto;18606855;18;0;0;0;0;3;3;6;5;1;0;0;0;0;0;0;0;0;0;0;0;0;0;0;0;68;68;20;48;0;1;14;28;25;27;10;17;18;23;6;13;15;11;7;6;4;6;66;0;0;0;0;1;67;1;0
2014;Sudeste;3;São Paulo;SP;35;Garça;3516705;0;Marília;9;Marília;38;3;2;CENTRO ESTADUAL DE EDUCACAO TECNOLOGICA PAULA SOUZA;33;4021;FACULDADE DE TECNOLOGIA DE GARÇA;FATECGA;Av. Presidente Vargas;2331;;Vila José Ribeiro;17400000;18;0;0;0;0;1;1;7;6;1;1;0;0;1;0;0;0;0;0;0;0;0;0;0;0;50;49;21;28;0;4;8;29;8;6;3;3;42;1;0;6;5;9;8;6;7;8;39;0;3;3;0;4;49;0;1
2014;Sudeste;3;São Paulo;SP;35;Jundiaí;3525904;0;Macro Metropolitana Paulista;12;Jundiaí;47;3;2;CENTRO ESTADUAL DE EDUCACAO TECNOLOGICA PAULA SOUZA;33;4022;FACULDADE DE TECNOLOGIA DE JUNDIAÍ;FATEC/JD;Avenida União dos Ferroviários;1760;;Centro;13201160;16;0;0;0;0;3;1;4;4;3;0;0;0;1;0;0;0;0;0;0;0;0;0;0;0;63;63;24;39;0;0;12;36;15;12;7;5;26;25;0;8;5;10;14;13;8;5;33;0;1;0;0;5;62;1;0
2014;Sudeste;3;São Paulo;SP;35;Mauá;3529401;0;Metropolitana de São Paulo;15;São Paulo;61;3;2;CENTRO ESTADUAL DE EDUCACAO TECNOLOGICA PAULA SOUZA;33;4023;FACULDADE DE TECNOLOGIA DE MAUÁ;FATEC MAUÁ;Av.Antonia Rosa Fioravante;804;;Vila Fausto Morelli;9390120;18;0;0;0;1;2;3;4;6;0;2;0;0;0;0;0;0;0;0;0;0;0;0;0;0;59;58;17;41;0;0;14;26;18;7;0;7;44;7;0;5;8;12;10;7;11;5;45;0;2;0;0;5;58;0;0
2014;Sudeste;3;São Paulo;SP;35;Mococa;3530508;0;Campinas;7;São João da Boa Vista;30;3;2;CENTRO ESTADUAL DE EDUCACAO TECNOLOGICA PAULA SOUZA;33;4024;FACULDADE DE TECNOLOGIA DE MOCOCA;FATEC;Avenida Américo Pereira Lima;S/N;;Jardim Lavínia;13736260;11;0;0;0;0;0;3;3;4;1;0;0;0;0;0;0;0;0;0;0;0;0;0;0;0;54;54;12;42;0;2;10;27;15;19;10;9;35;0;3;9;13;12;6;6;1;4;35;1;1;0;0;3;53;1;1
2014;Sudeste;3;São Paulo;SP;35;São José do Rio Preto;3549805;0;São José do Rio Preto;1;São José do Rio Preto;4;3;2;CENTRO ESTADUAL DE EDUCACAO TECNOLOGICA PAULA SOUZA;33;4025;FACULDADE DE TECNOLOGIA DE SÃO JOSÉ DO RIO PRETO;FATECRP;Rua Fernandópolis;2510;;Eldorado;15043020;14;0;0;0;0;1;0;3;4;5;1;0;0;0;0;1;1;0;0;0;0;0;0;0;0;46;45;20;25;0;0;4;25;16;11;8;3;0;34;2;7;8;8;9;8;2;1;38;0;1;0;0;1;45;0;0
2014;Sudeste;3;São Paulo;SP;35;São Paulo;3550308;1;Metropolitana de São Paulo;15;São Paulo;61;3;2;CENTRO ESTADUAL DE EDUCACAO TECNOLOGICA PAULA SOUZA;33;4026;FACULDADE DE TECNOLOGIA ZONA LESTE;FATEC-ZL;Rua Sonho Gaúcho;641;;Cidade AE Carvalho;3685000;21;0;2;2;0;4;3;5;4;1;0;0;0;0;0;0;1;0;0;0;0;0;0;0;0;84;81;25;56;0;2;13;49;17;14;1;13;59;8;2;4;9;12;17;18;13;6;59;0;6;3;0;6;80;1;0
2014;Sudeste;3;São Paulo;SP;35;Itapecerica da Serra;3522208;0;Metropolitana de São Paulo;15;Itapecerica da Serra;60;3;4;CETRO CONSULTORIA EDUCACIONAL E PARTICIPACOES LTDA;2529;4028;FACULDADE DE ITAPECERICA DA SERRA;FIT;Estrada dos Maciéis;210;;Embu Mirim;6854120;15;0;0;3;1;2;2;2;1;0;1;1;0;1;1;0;1;0;0;0;0;0;0;0;0;30;28;11;17;0;0;8;12;8;4;0;4;11;13;1;4;2;6;3;5;2;5;19;2;4;1;0;2;28;0;0
2014;Sudeste;3;São Paulo;SP;35;Santa Bárbara d'Oeste;3545803;0;Campinas;7;Campinas;32;3;4;FACULDADES INTEGRADAS POLITEC LTDA - ME;2530;4029;FACULDADE POLITEC;FAP;Rua da Agricultura;4.000;;Gerivá;13450000;31;3;1;0;1;6;8;6;4;0;0;1;1;0;0;0;1;0;0;0;0;0;0;0;0;80;72;35;37;0;0;24;41;7;14;0;14;37;21;4;17;18;10;10;6;6;1;63;0;2;0;0;5;72;0;0
2014;Sudeste;3;Rio de Janeiro;RJ;33;Campos dos Goytacazes;3301009;0;Norte Fluminense;2;Campos dos Goytacazes;3;2;5;FUNDACAO CULTURAL DE CAMPOS;347;4030;CENTRO UNIVERSITÁRIO FLUMINENSE;UNIFLU;Rua Tenente Coronel Cardoso;349;;Centro;28013460;80;1;7;3;4;22;17;10;8;6;2;0;0;0;0;0;1;0;0;0;0;0;0;0;0;113;113;52;61;0;0;40;62;11;16;0;16;69;28;5;12;14;14;11;15;12;30;90;4;5;3;0;1;113;0;0
2014;Centro-Oeste;5;Goiás;GO;52;Catalão;5205109;0;Sul Goiano;5;Catalão;17;3;4;SOCIEDADE CATALANA DE EDUCACAO S/C LTDA - EPP;2095;4036;FACULDADE DE TECNOLOGIA DE CATALÃO;FATECA;Avenida Presidente Médici;s/n;;Santa Cruz;75706420;86;0;1;13;4;26;5;12;7;2;5;3;7;0;1;1;1;0;0;0;0;0;0;0;0;10;10;1;9;0;0;2;7;1;4;0;4;2;4;0;2;6;1;0;0;0;1;6;0;3;0;0;1;10;0;0
2014;Nordeste;2;Ceará;CE;23;Fortaleza;2304400;1;Metropolitana de Fortaleza;3;Fortaleza;16;3;4;CLAUDER CIARLINI FILHO & CIA;2535;4037;FACULDADE DE TECNOLOGIA INTENSIVA;FATECI;Rua Barão de Aratanha;51;;Centro;60050070;38;0;2;2;2;15;14;3;0;0;0;0;0;0;0;1;1;0;0;0;0;0;0;0;0;75;75;43;32;0;0;31;33;11;14;9;5;35;26;15;18;13;13;8;3;3;2;35;0;26;0;0;5;75;0;0
2014;Centro-Oeste;5;Distrito Federal;DF;53;Brasília;5300108;1;Distrito Federal;1;Brasília;1;3;4;IESMAT - INSTITUTO DE ENSINO SUPERIOR DO MEIO AMBIENTE E TECNOLOGIA LTDA - EPP;2538;4042;FACULDADE DO MEIO AMBIENTE E DE TECNOLOGIA DE NEGOCIOS;FAMATEC;Sia/Sul, Trecho 02, Lotes 1.510 / 1.540;s/n;Região Administrativ;Guará;71200020;12;0;0;0;2;5;3;1;0;1;0;0;0;0;0;1;1;0;0;0;0;0;0;0;0;18;18;4;14;0;0;8;7;3;2;0;2;15;1;3;2;2;3;4;3;0;1;11;1;4;1;0;1;18;0;0
2014;Sudeste;3;São Paulo;SP;35;Avaré;3504503;0;Bauru;4;Avaré;22;3;5;ASSOCIACAO EDUCACIONAL DO VALE DA JURUMIRIM;882;4043;FACULDADE TECNOLOGIA EDUVALE - AVARÉ;FATEC EDUVALE;Avenida  Prefeito  Misael  Euphrasio Leal;347;;Jardim América;18705050;50;0;0;7;1;11;10;10;6;3;2;0;0;0;0;1;0;0;0;0;0;0;0;0;0;11;11;1;10;0;0;6;3;2;0;0;0;5;6;1;1;2;4;1;1;1;0;10;0;0;0;0;1;11;0;0
2014;Sul;4;Paraná;PR;41;Curitiba;4106902;1;Metropolitana de Curitiba;10;Curitiba;37;3;5;SOCIEDADE EDUCACIONAL DE SANTA CATARINA;902;4045;Faculdade SOCIESC de Curitiba;SOCIESC;BR 116 - Km 106,5;18.805;;Pinheirinho;81690300;25;0;0;0;0;8;5;8;0;3;0;0;1;0;0;1;0;0;0;0;0;0;0;0;0;75;75;20;55;0;0;31;35;9;18;0;18;19;38;6;11;17;11;7;13;7;3;63;1;2;2;0;4;75;0;0
2014;Sudeste;3;Minas Gerais;MG;31;Belo Horizonte;3106200;1;Metropolitana de Belo Horizonte;7;Belo Horizonte;30;3;5;INSTITUTO PADRE MACHADO;2545;4053;CENTRO DE EDUCAÇÃO SUPERIOR BARNABITA;CESB;Avenida Contorno;6.475;;São Pedro;30110039;1;0;0;0;0;0;0;0;0;0;1;0;0;0;0;0;0;0;0;0;0;0;0;0;0;1;1;1;0;0;0;1;0;0;0;0;0;0;1;0;0;0;1;0;0;0;0;0;0;0;0;0;1;1;0;0
2014;Sudeste;3;São Paulo;SP;35;São Joaquim da Barra;3549409;0;Ribeirão Preto;2;São Joaquim da Barra;10;3;4;UNISIG - UNIDADE EDUCACIONAL DE ENSINO SUPERIOR LTDA - ME;2550;4059;FACULDADE DE CIÊNCIAS GERENCIAIS;;Rua Maria Rosa da Silva;151;;Jardim Paraíso;14600000;11;0;0;1;0;3;2;2;1;1;0;0;0;0;1;0;1;0;0;0;0;0;0;0;0;25;22;9;13;0;0;12;10;0;7;2;5;5;10;1;8;4;6;2;1;0;0;15;2;5;0;0;0;22;0;0
2014;Nordeste;2;Pernambuco;PE;26;Recife;2611606;1;Metropolitana de Recife;5;Recife;17;3;5;SOCIEDADE RECIFENSE DE ESTUDOS DE CIENCIAS HUMANAS;864;4064;FACULDADE DE TECNOLOGIA FAMA;FAMA;Avenida Engº. Abdias de Carvalho;794;;Bongi;50720635;19;0;5;0;0;2;1;7;1;3;0;0;0;0;0;0;1;0;0;0;0;0;0;0;0;20;20;10;10;0;0;8;9;3;5;0;5;9;6;1;3;5;3;1;5;2;0;6;1;7;0;0;6;20;0;0
2014;Centro-Oeste;5;Distrito Federal;DF;53;Brasília;5300108;1;Distrito Federal;1;Brasília;1;3;5;ASSOCIACAO EDUCATIVA DO BRASIL - SOEBRAS;1509;4068;FACULDADE ICESP;ICESP;Qe 11 Área Especial C/D/E;s/n;Região Administrativ;Guará;71020621;205;0;0;25;20;39;30;50;24;7;3;3;2;1;1;1;0;0;0;0;0;0;0;0;0;33;31;20;11;0;0;4;16;11;7;0;7;18;6;3;2;5;2;3;4;6;6;13;0;6;0;0;6;30;1;0
2014;Sul;4;Rio Grande do Sul;RS;43;Gravataí;4309209;0;Metropolitana de Porto Alegre;5;Porto Alegre;26;3;4;QI ESCOLAS E FACULDADES LTDA;2164;4077;FACULDADE DE TECNOLOGIA DE GRAVATAÍ;FAQI;Avenida Dorival Cândido Luz de Oliveira;2595;;São Geraldo;94030001;17;0;0;0;0;11;3;3;0;0;0;0;0;0;0;1;1;0;0;0;0;0;0;0;0;16;16;4;12;0;0;2;11;3;1;0;1;11;4;0;4;3;1;3;1;2;2;15;0;1;0;0;0;15;1;0
2014;Sudeste;3;Minas Gerais;MG;31;Belo Horizonte;3106200;1;Metropolitana de Belo Horizonte;7;Belo Horizonte;30;3;4;CENTRO DE ENSINO SUPERIOR INAP LTDA - ME;2561;4079;FACULDADE TECNOLÓGICA INAP;FAT- INAP;Avenida Carandaí;507;;Funcionários;30130060;9;0;1;0;0;2;3;3;0;0;0;0;0;0;0;0;0;0;0;0;0;0;0;0;0;50;50;27;23;0;0;31;18;1;4;2;2;2;44;1;9;6;6;9;7;5;7;31;0;10;0;0;7;50;0;0
2014;Sudeste;3;São Paulo;SP;35;Santo André;3547809;0;Metropolitana de São Paulo;15;São Paulo;61;3;4;A.B. - CURSOS PREVIDENCIARIOS LTDA - ME;2567;4086;FACULDADE DE TECNOLOGIA JARDIM;FATEJ;Rua Almirante Protógenes;68;;Bairro Jardim;9090760;16;2;1;3;4;1;4;1;0;0;0;0;0;0;0;1;1;0;0;0;0;0;0;0;0;36;33;12;21;0;0;16;13;4;2;2;0;3;28;2;6;4;5;8;6;1;1;24;1;1;0;0;3;33;0;0
2014;Sudeste;3;São Paulo;SP;35;Roseira;3544301;0;Vale do Paraíba Paulista;13;Guaratinguetá;51;3;4;CENTRO DE ESTUDOS AMBIENTAIS DO VALE DO PARAIBA - CEAVAP - ME;14933;4090;FACULDADE DE ROSEIRA;FARO;Rodovia Presidente Dutra - Km 77;s/n;;Roseira Velha;12580000;8;0;0;0;0;0;1;3;2;2;0;0;0;0;0;0;1;0;0;0;0;0;0;0;0;33;33;13;20;0;0;4;21;8;10;1;9;12;11;3;9;4;6;7;0;2;2;28;0;2;0;0;3;32;1;0
2014;Sul;4;Santa Catarina;SC;42;Concórdia;4204301;0;Oeste Catarinense;1;Concórdia;5;3;5;FUNDACAO ADOLPHO BOSIO DE EDUCACAO NO TRANSPORTE;2572;4092;FACULDADE DE TECNOLOGIA PEDRO ROGÉRIO GARCIA;FATTEP;Rodovia Sct 283, Km 17;8100;;Vila Fragosos;89700000;60;2;1;1;1;7;3;3;5;20;12;1;3;0;1;0;0;0;0;0;0;0;0;0;0;28;28;12;16;0;0;24;3;1;1;1;0;5;22;1;12;5;5;0;2;3;0;26;0;0;0;0;2;28;0;0
2014;Sul;4;Paraná;PR;41;Curitiba;4106902;1;Metropolitana de Curitiba;10;Curitiba;37;3;4;ESCOLA TECNOLOGICA DE CURITIBA LTDA - EPP;2573;4093;FACULDADE DE TECNOLOGIA DE CURITIBA;FATEC-PR;Rua Itacolomi;450;;Portão;81070150;19;0;0;3;1;4;1;2;0;2;1;0;3;0;2;1;1;0;0;0;0;0;0;0;0;32;32;8;24;0;0;14;12;6;5;0;5;21;6;4;6;4;5;2;5;4;2;25;1;3;2;0;0;31;1;0
2014;Nordeste;2;Paraíba;PB;25;João Pessoa;2507507;1;Mata Paraibana;4;João Pessoa;22;3;4;IDEZ EMPREENDIMENTOS EDUCACIONAIS LTDA.;3547;4094;Faculdade Estácio da Paraíba;ESTÁCIO PARAÍBA;Avenida Governador Flávio Ribeiro Coutinho;115;;Manaíra;58037000;8;0;0;7;0;0;0;0;1;0;0;0;0;0;0;1;1;0;0;0;0;0;0;0;0;29;29;10;19;0;0;13;12;4;5;0;5;8;16;2;7;7;8;2;0;2;1;21;0;5;0;0;2;29;0;0
2014;Centro-Oeste;5;Distrito Federal;DF;53;Brasília;5300108;1;Distrito Federal;1;Brasília;1;3;5;ASSOCIACAO DARWIN DE EDUCACAO E PESQUISA;2575;4095;FACULDADE DE TECNOLOGIA EQUIPE DARWIN;FTED;QS 07, Rua 400, Lote 1;s/n;;-;71968720;16;1;0;0;0;4;2;3;2;2;1;0;0;0;1;0;0;0;0;0;0;0;0;0;0;10;10;3;7;0;1;8;1;0;0;0;0;1;9;2;2;3;1;1;1;0;0;1;0;0;0;0;9;10;0;0
2014;Sul;4;Rio Grande do Sul;RS;43;Porto Alegre;4314902;1;Metropolitana de Porto Alegre;5;Porto Alegre;26;3;4;SOCIEDADE EDUCACIONAL RIOGRANDENSE LTDA.;3488;4096;FACULDADE DE TECNOLOGIA TECBRASIL - UNIDADE PORTO ALEGRE;Ftec Porto Alegre;Rua Comendador Manuel Pereira;249;;Centro;9003030;84;0;0;1;1;38;13;6;6;3;3;6;4;0;3;1;1;0;0;0;0;0;0;0;0;155;131;44;87;0;0;43;82;6;5;0;5;12;114;12;29;31;23;14;8;6;8;83;1;31;2;0;8;129;2;1
2014;Sul;4;Rio Grande do Sul;RS;43;Bento Gonçalves;4302105;0;Nordeste Rio-grandense;2;Caxias do Sul;16;3;4;CENTRO SUPERIOR DE TECNOLOGIA TECBRASIL LTDA;2107;4097;FACULDADE DE TECNOLOGIA TECBRASIL - UNIDADE BENTO GONÇALVES;Ftec Bento Gonçalves;Rua  Osvaldo Aranha;419;;Centro;95700000;35;0;0;5;0;7;4;5;1;2;3;3;3;1;1;0;0;0;0;0;0;0;0;0;0;72;64;31;33;0;0;40;22;2;3;0;3;12;49;7;19;18;9;4;3;3;1;60;1;0;0;0;2;64;0;0
2014;Sul;4;Rio Grande do Sul;RS;43;Santa Maria;4316907;0;Centro Ocidental Rio-grandense;3;Santa Maria;18;4;1;INSTITUTO FEDERAL DE EDUCACAO, CIENCIA E TECNOLOGIA FARROUPILHA;8338;4098;INSTITUTO FEDERAL DE EDUCAÇÃO, CIÊNCIA E TECNOLOGIA FARROUPILHA;IFFarroupilha;Rua Esmeralda;430;Faixa Nova;Camobi;97110767;603;0;0;1;8;81;114;141;97;71;41;33;12;0;4;1;0;0;0;0;0;0;0;0;0;395;370;192;178;0;0;14;230;126;368;316;52;2;0;63;111;87;56;22;16;13;2;225;2;9;0;1;86;367;3;1
2014;Centro-Oeste;5;Goiás;GO;52;Goiânia;5208707;1;Centro Goiano;3;Goiânia;10;3;5;SERVICO NACIONAL DE APRENDIZAGEM INDUSTRIAL SENAI;2476;4100;FACULDADE DE TECNOLOGIA SENAI ÍTALO BOLOGNA;FATECIB;Armogaste J. Silveira;612;;Setor Centro Oeste;74560020;40;0;1;0;1;4;4;12;5;10;1;2;0;0;0;0;1;0;0;0;0;0;0;0;0;18;18;3;15;0;0;0;18;0;4;0;4;10;4;1;7;3;2;2;0;2;1;8;1;2;1;0;6;18;0;0
2014;Centro-Oeste;5;Goiás;GO;52;Goiânia;5208707;1;Centro Goiano;3;Goiânia;10;3;5;SERVICO NACIONAL DE APRENDIZAGEM INDUSTRIAL SENAI;2476;4101;FACULDADE DE TECNOLOGIA SENAI DE DESENVOLVIMENTO GERENCIAL;FATESG;Rua 227-A;95;;Setor Leste Universitário;74610060;53;0;2;1;1;5;6;19;7;6;4;1;1;0;0;0;1;0;0;0;0;0;0;0;0;22;22;5;17;0;0;5;16;1;2;0;2;18;2;1;2;10;5;3;1;0;0;12;1;2;0;0;7;22;0;0
2014;Sudeste;3;São Paulo;SP;35;São Paulo;3550308;1;Metropolitana de São Paulo;15;São Paulo;61;3;4;ETAPA EDUCACIONAL LTDA;2577;4104;ESCOLA SUPERIOR DE ENGENHARIA E GESTÃO DE SÃO PAULO - ESEG;ESEG;Rua Vergueiro;1951;;Vila Mariana;4101000;22;0;0;0;0;9;3;6;1;2;0;1;0;0;0;0;1;0;0;0;0;0;0;0;0;38;35;4;31;0;0;2;15;18;4;0;4;13;18;2;5;5;7;6;3;4;3;27;0;2;3;0;2;35;0;0
2014;Sul;4;Rio Grande do Sul;RS;43;Porto Alegre;4314902;1;Metropolitana de Porto Alegre;5;Porto Alegre;26;3;5;SERVICO NACIONAL DE APRENDIZAGEM INDUSTRIAL-SENAI;2579;4107;FACULDADE DE TECNOLOGIA SENAI PORTO ALEGRE;FATEC SENAI;Avenida Assis Brasil;8450;;Sarandi;91140000;26;1;0;0;0;6;3;7;3;3;1;1;0;1;0;0;0;0;0;0;0;0;0;0;0;34;33;4;29;0;0;2;26;5;15;0;15;18;0;0;6;5;8;2;7;2;3;29;1;0;0;0;2;31;2;0
2014;Nordeste;2;Piauí;PI;22;Teresina;2211001;1;Centro-Norte Piauiense;2;Teresina;3;3;5;ASSOCIACAO PIAUIENSE DE CULTURA SUPERIOR (SOCULTURAS);2580;4108;INSTITUTO CATÓLICO DE ESTUDOS SUPERIORES DO PIAUÍ;ICESPI;Rodovia Palmeirais (Pi 130);s.n.;Caixa Postal 496;Km 8;64001970;5;0;0;0;0;2;2;0;0;0;1;0;0;0;0;1;0;0;0;0;0;0;0;0;0;13;12;2;10;0;0;2;8;2;1;0;1;4;7;0;0;1;3;3;3;1;1;4;1;5;1;0;1;12;0;0
2014;Centro-Oeste;5;Goiás;GO;52;Ceres;5205406;0;Centro Goiano;3;Ceres;6;3;4;CESUR - CENTRO DE ENSINO SUPERIOR DE RUBIATABA LTDA;689;4113;FACULDADE DE CERES;FACER;Avenida Brasil, Quadra 13;s/n;;Setor Morada Verde;76300000;18;0;0;2;0;7;2;2;0;3;2;0;0;0;0;0;1;0;0;0;0;0;0;0;0;33;33;15;18;0;0;10;14;9;6;0;6;22;5;6;8;8;5;1;1;0;4;11;0;4;0;0;17;33;0;0
2014;Nordeste;2;Pernambuco;PE;26;Paulista;2610707;0;Metropolitana de Recife;5;Recife;17;3;4;SER EDUCACIONAL S.A.;1847;4118;FACULDADE JOAQUIM NABUCO - PAULISTA;FJN;Avenida Senador Salgado Filho;s/n;;Centro;53401440;198;2;0;4;6;60;65;21;6;9;10;10;3;1;1;1;0;0;0;0;0;0;0;0;0;213;213;100;113;0;2;124;68;19;43;0;43;25;145;24;57;36;39;21;17;15;4;8;0;200;0;0;1;213;0;0
2014;Nordeste;2;Sergipe;SE;28;Aracaju;2800308;1;Leste Sergipano;3;Aracaju;11;3;4;SOCIEDADE DE ENSINO SUPERIOR E DE PESQUISA DE SERGIPE LTDA - SESPS;2587;4121;FACULDADE TOBIAS BARRETO;FTB;Rua de Riachuelo;1071;;São José;49015160;33;1;0;2;2;14;6;2;1;1;1;3;0;0;0;1;0;0;0;0;0;0;0;0;0;2;2;1;1;0;0;0;1;1;0;0;0;2;0;0;1;0;0;0;0;1;0;0;0;2;0;0;0;2;0;0
2014;Centro-Oeste;5;Goiás;GO;52;Jataí;5211909;0;Sul Goiano;5;Sudoeste de Goiás;13;3;4;SOCIEDADE MANTENEDORA DAS FACULDADES DE JATAI LTDA - ME;2589;4123;FACULDADE JATAIENSE;FAJA;Avenida Perimetral;1075;;Centro;75800001;6;0;1;2;0;2;0;0;0;1;0;0;0;0;0;0;0;0;0;0;0;0;0;0;0;18;17;8;9;0;0;14;3;0;0;0;0;0;17;1;3;3;5;4;1;0;0;10;0;5;0;0;2;17;0;0
2014;Centro-Oeste;5;Mato Grosso;MT;51;Água Boa;5100201;0;Nordeste Mato-grossense;2;Canarana;10;3;4;FACULDADES CATHEDRAL DE ENSINO SUPERIOR DO ARAGUAIA;2592;4126;FACULDADE DE CIÊNCIAS SOCIAIS APLICADAS E DE TECNOLOGIAS DE AGUA BOA;FACESA;Avenida Planalto;s/n;Esquina com a Avenid;Cidade Universitária;78365000;15;0;0;5;0;3;0;4;0;2;0;1;0;0;0;1;0;0;0;0;0;0;0;0;0;11;11;9;2;0;0;5;6;0;1;0;1;4;6;1;1;1;4;0;4;0;0;9;0;2;0;0;0;11;0;0
2014;Norte;1;Amazonas;AM;13;Manaus;1302603;1;Centro Amazonense;3;Manaus;7;3;5;SER EDUCACIONAL S.A.;1847;4135;Faculdade Maurício de Nassau Manaus;;Av. Joaquim Nabuco;1.097;;CENTRO;69020030;64;0;0;0;0;19;16;9;6;6;5;1;1;1;0;1;0;0;0;0;0;0;0;0;0;13;13;7;6;0;0;3;5;5;2;0;2;2;9;1;1;3;3;4;1;0;0;1;1;6;0;0;3;13;0;0
2014;Sudeste;3;São Paulo;SP;35;Santa Bárbara d'Oeste;3545803;0;Campinas;7;Campinas;32;3;4;ANHANGUERA EDUCACIONAL LTDA;2600;4138;FACULDADE ANHANGUERA DE SANTA BÁRBARA;;Rua Juscelino Kubitschek de Oliveira;1450;;2º Distrito Industrial;13450401;144;0;2;0;1;32;11;39;16;21;12;5;4;0;1;0;1;0;0;0;0;0;0;0;0;203;203;82;121;0;1;141;37;24;19;0;19;178;6;18;46;53;24;16;24;13;9;188;3;10;1;0;0;202;1;0
2014;Sudeste;3;São Paulo;SP;35;Taubaté;3554102;0;Vale do Paraíba Paulista;13;São José dos Campos;50;3;4;ANHANGUERA EDUCACIONAL LTDA;2600;4141;FACULDADE ANHANGUERA DE TAUBATÉ;;Avenida José Olegário de Barros;46/58;;Vila Nossa Senhora das Graças;12060400;120;1;1;0;4;28;16;31;7;15;10;3;2;2;0;1;1;0;0;0;0;0;0;0;0;201;201;78;123;0;0;146;36;19;8;0;8;188;5;11;28;48;30;31;24;15;14;191;1;3;1;0;0;199;2;0
2014;Sul;4;Santa Catarina;SC;42;São José;4216602;0;Grande Florianópolis;5;Florianópolis;16;3;5;SERVICO NACIONAL DE APRENDIZAGEM INDUSTRIAL;822;4148;FACULDADE DE TECNOLOGIA SENAI SÃO JOSÉ;SENAISC;Br 101 Km211;7235;;Aréa Industrial;88104800;44;0;0;0;0;11;3;19;7;4;0;0;0;0;0;1;0;0;0;0;0;0;0;0;0;9;9;4;5;0;0;4;4;1;2;0;2;0;7;1;0;1;3;0;1;2;1;7;0;0;1;0;1;9;0;0
2014;Sul;4;Santa Catarina;SC;42;Itajaí;4208203;0;Vale do Itajaí;4;Itajaí;13;3;5;SERVICO NACIONAL DE APRENDIZAGEM INDUSTRIAL;822;4149;FACULDADE DE TECNOLOGIA SENAI ITAJAÍ;FATEC SENAI ITAJAÍ;Rua Henrique Vigarani;163;Prédio;Barra do Rio;88305555;3;0;0;0;0;0;0;3;0;0;0;0;0;0;0;0;0;0;0;0;0;0;0;0;0;6;6;1;5;0;0;6;0;0;5;5;0;0;1;0;2;0;3;1;0;0;0;5;1;0;0;0;0;6;0;0
2014;Sudeste;3;São Paulo;SP;35;Piracicaba;3538709;0;Piracicaba;6;Piracicaba;28;3;4;INSTITUTO DE DESENVOLVIMENTO TECNOLOGICO E EDUCACIONAL DE PIRACICABA LTDA;2605;4150;FACULDADE DE TECNOLOGIA DE PIRACICABA;FATEP;Rua Silva Jardim;1.763;;Cidade Alta;13419140;12;0;0;0;0;0;0;7;2;1;0;0;2;0;0;1;0;0;0;0;0;0;0;0;0;41;38;8;30;0;0;22;12;4;5;0;5;16;17;0;4;5;17;5;4;2;1;36;0;0;0;0;1;38;0;0
2014;Nordeste;2;Pernambuco;PE;26;Recife;2611606;1;Metropolitana de Recife;5;Recife;17;3;4;SER EDUCACIONAL S.A.;1847;4153;FACULDADE JOAQUIM NABUCO RECIFE;FJN;Rua João Fernandes Vieira;130;;Boa Vista;50005200;187;3;4;10;5;69;50;7;19;6;6;4;3;0;1;1;1;0;0;0;0;0;0;0;0;276;276;113;163;0;2;140;100;34;103;0;103;39;134;43;67;65;41;30;16;7;7;13;3;250;0;0;4;276;0;1
2014;Sul;4;Santa Catarina;SC;42;Rio do Sul;4214805;0;Vale do Itajaí;4;Rio do Sul;11;3;4;INSTITUTO EDUCACIONAL DO ALTO VALE DO ITAJAI LTDA;2608;4157;FACULDADE METROPOLITANA DE RIO DO SUL;FAMESUL;Rodovia Br 470 Km 140;5.253;;Itoupava;89160000;24;0;1;3;0;4;4;4;1;5;0;1;1;0;0;1;1;0;0;0;0;0;0;0;0;97;97;35;62;0;3;45;25;24;17;0;17;76;4;15;17;17;17;14;9;2;6;91;0;5;1;0;0;97;0;0
2014;Centro-Oeste;5;Goiás;GO;52;Goiânia;5208707;1;Centro Goiano;3;Goiânia;10;3;5;SERVICO NACIONAL DE APRENDIZAGEM COMERCIAL - SENAC;2612;4162;FACULDADE DE TECNOLOGIA SENAC GOIÁS;;Avenida Independência;1.002;Qd. 942 Lt.25;Setor Leste Vila Nova;74645010;17;0;0;0;0;5;1;6;3;1;1;0;0;0;0;1;0;0;0;0;0;0;0;0;0;48;48;18;30;0;0;13;32;3;5;0;5;41;2;2;5;17;11;8;4;0;1;12;1;2;0;0;30;48;0;0
2014;Sul;4;Santa Catarina;SC;42;Orleans;4211702;0;Sul Catarinense;6;Tubarão;18;2;7;FUNDACAO EDUCACIONAL BARRIGA VERDE;1124;4163;CENTRO UNIVERSITÁRIO BARRIGA VERDE;UNIBAVE;Rua Miguel Couto;313;;Centro;88870000;202;16;7;13;4;30;16;43;15;23;10;8;11;5;1;0;0;0;0;0;0;0;0;0;0;310;293;118;175;0;0;137;125;31;40;31;9;66;187;28;73;64;41;36;29;12;10;265;1;3;0;0;5;292;1;0
2014;Sudeste;3;Minas Gerais;MG;31;Uberaba;3170107;0;Triângulo Mineiro/Alto Paranaíba;5;Uberaba;22;3;5;ASSOCIACAO COMERCIAL, INDUSTRIAL E DE SERVICOS DE UBERABA - ACIU;99;4166;CENTRO DE ENSINO SUPERIOR DE UBERABA;CESUBE;Avenida Randolfo Borges Junior;1250;;Univerdecidade;38066005;36;0;0;5;2;9;4;7;3;2;1;2;1;0;0;0;0;0;0;0;0;0;0;0;0;42;41;21;20;0;0;5;21;15;0;0;0;37;4;1;3;8;5;10;5;2;7;26;0;1;0;0;12;41;0;0
2014;Sudeste;3;São Paulo;SP;35;Carapicuíba;3510609;0;Metropolitana de São Paulo;15;Osasco;57;3;4;CENTRO EDUCACIONAL NOSSA CIDADE LTDA.;2617;4169;FACULDADE NOSSA CIDADE;FNC;Avenida Inocêncio Seráfico;3450;1 andar;Vila Dirce;6380021;153;9;11;6;5;40;34;16;7;3;4;5;9;0;4;1;1;0;0;0;0;0;0;0;0;273;270;99;171;0;0;134;104;32;37;0;37;231;2;12;44;53;50;43;29;22;17;185;8;15;1;0;25;269;1;0
2014;Centro-Oeste;5;Distrito Federal;DF;53;Brasília;5300108;1;Distrito Federal;1;Brasília;1;3;5;AESJK - ASSOCIACAO DE ENSINO SUPERIOR JUSCELINO KUBITSCHEK;13385;4173;FACULDADE JK DE TECNOLOGIA;FACJK;Shin Ca2;21;Lote 21;Lago Norte;71503502;21;1;1;3;1;6;2;2;1;2;2;0;0;0;0;0;1;0;0;0;0;0;0;0;0;39;39;5;34;0;0;26;11;2;9;0;9;4;26;2;6;9;9;5;3;2;3;12;1;12;0;0;13;39;0;0
2014;Sudeste;3;São Paulo;SP;35;Campinas;3509502;0;Campinas;7;Campinas;32;3;5;ASSOCIACAO NAZARENA EDUCACIONAL DE CAMPINAS.;2626;4179;FACULDADE NAZARENA DO BRASIL;FNB;Estrada da Rhodia, Km 15;s/n;;Distrito Barão Geraldo;13085000;7;0;0;0;1;1;1;4;0;0;0;0;0;0;0;0;0;0;0;0;0;0;0;0;0;16;16;6;10;0;0;5;7;4;3;0;3;4;9;1;3;2;2;4;2;1;1;8;0;2;0;0;4;15;1;1
2014;Sudeste;3;São Paulo;SP;35;Peruíbe;3537602;0;Litoral Sul Paulista;14;Itanhaém;56;3;4;UNISEPE UNIAO DAS INSTITUICOES DE SERVICO, ENSINO E PESQUISA LTDA;715;4185;FACULDADE PERUIBE;FPBE;Avenida Darcy Fonseca;530;;Jardim dos Prados;11750000;6;0;0;0;0;2;1;2;1;0;0;0;0;0;0;1;1;0;0;0;0;0;0;0;0;41;41;18;23;0;0;14;25;2;4;0;4;8;29;1;4;11;7;6;2;5;5;18;2;1;0;0;13;41;0;0
2014;Nordeste;2;Piauí;PI;22;Teresina;2211001;1;Centro-Norte Piauiense;2;Teresina;3;3;4;CIESPI-CENTRO INTEGRADO DE EDUCACAO SUPERIOR DO PIAUI LTDA;2637;4197;FACULDADE ALIANÇA;FACE;Rua São Pedro;965;;Centro;64001260;56;1;0;6;3;23;8;12;2;0;0;0;1;0;0;1;0;0;0;0;0;0;0;0;0;66;66;41;25;0;4;15;42;5;31;0;31;6;29;17;19;12;9;6;2;1;0;8;0;46;1;0;11;66;0;0
2014;Centro-Oeste;5;Goiás;GO;52;Mineiros;5213103;0;Sul Goiano;5;Sudoeste de Goiás;13;3;4;CENTRO DE ENSINO SUPERIOR REZENDE & POTRICH LTDA - ME;2638;4198;FACULDADE MINEIRENSE;FAMA;Praça Deputado José Alves de Assis;58;;Centro;75830000;48;0;0;12;5;12;8;4;3;2;2;0;0;0;0;0;1;0;0;0;0;0;0;0;0;83;83;45;38;0;0;35;40;8;57;29;28;26;0;26;24;14;9;4;1;2;3;58;1;10;2;0;5;83;0;1
2014;Centro-Oeste;5;Distrito Federal;DF;53;Brasília;5300108;1;Distrito Federal;1;Brasília;1;3;5;ASSOCIACAO ROGACIONISTA DE EDUCACAO E ASSISTENCIA SOCIAL (AREAS);2639;4199;FACULDADE DE TECNOLOGIA ROGACIONISTA;ROGA;Ae 08 Módulo B;s/n;;Guará II;71065325;12;0;0;0;2;5;3;2;0;0;0;0;0;0;0;1;1;0;0;0;0;0;0;0;0;20;20;3;17;0;0;10;6;4;3;0;3;11;6;3;4;6;0;6;0;0;1;7;1;7;1;0;2;20;0;0
2014;Nordeste;2;Paraíba;PB;25;João Pessoa;2507507;1;Mata Paraibana;4;João Pessoa;22;3;4;ENSINE - ESCOLAS SUPERIORES INTEGRADAS DO NORDESTE LTDA - EPP;2640;4201;FACULDADE DE ENSINO SUPERIOR DO NORDESTE;FAESNE;Avenida Odon Bezerra;184;Loja 256 2º andar  -;Tambiá;58020500;13;0;0;0;0;1;6;2;1;0;3;0;0;0;0;1;1;0;0;0;0;0;0;0;0;19;19;6;13;0;0;8;10;1;3;3;0;5;11;1;6;4;4;3;1;0;0;13;0;1;0;0;5;19;0;0
2014;Sudeste;3;São Paulo;SP;35;Itu;3523909;0;Macro Metropolitana Paulista;12;Sorocaba;46;3;4;SOCIEDADE DE EDUCACAO, CIENCIA E TECNOLOGIA DE ITU LTDA - ME;2646;4209;FACULDADE DE TECNOLOGIA CÉSAR LATTES;;Rua Marco Aurélio Gatti;59;;Vila Santa Terezinha;13310343;15;1;0;1;1;4;3;3;0;2;0;0;0;0;0;0;0;0;0;0;0;0;0;0;0;36;36;12;24;0;0;21;11;4;2;0;2;14;20;3;5;9;7;4;3;4;1;31;0;1;0;0;3;36;0;1
2014;Sudeste;3;São Paulo;SP;35;São Paulo;3550308;1;Metropolitana de São Paulo;15;São Paulo;61;3;4;CENTRO DE ESTUDOS DE ADMINISTRACAO E MARKETING CEAM LTDA;918;4211;ESCOLA SUPERIOR DE ADMINISTRAÇÃO, MARKETING E COMUNICAÇÃO DE PERDIZES;ESAMC PERDIZES;Rua Caiubi;127;;Perdizes;5010000;13;0;0;0;0;1;1;5;5;0;0;0;1;0;0;0;0;0;0;0;0;0;0;0;0;8;8;1;7;0;0;4;4;0;1;0;1;0;7;0;0;1;3;1;1;1;1;6;0;0;0;0;1;8;0;0
2014;Sudeste;3;Minas Gerais;MG;31;Pedro Leopoldo;3149309;0;Metropolitana de Belo Horizonte;7;Belo Horizonte;30;3;5;FUNDACAO CULTURAL DR PEDRO LEOPOLDO;450;4218;FACULDADE PEDRO LEOPOLDO;FPL;Avenida Lincoln Viana;830;;Doutor Lund;33600000;81;0;0;11;5;23;16;10;9;0;0;2;3;1;1;1;1;0;0;0;0;0;0;0;0;91;91;32;59;0;0;14;54;23;12;0;12;22;57;2;10;17;11;10;17;10;14;40;0;10;0;0;35;91;0;0
2014;Sudeste;3;Minas Gerais;MG;31;Além Paraíba;3101508;0;Zona da Mata;12;Cataguases;66;3;5;FUNDACAO EDUCACIONAL DE ALEM PARAIBA;401;4219;INSTITUTO SUPERIOR DE EDUCAÇÃO PROFESSORA NAIR FORTES ABU-MERHY;ISEFOR;Rua Isabel Herdy Alves;305;PRÉDIO DO CAP;SAO JOSÉ;36660000;6;0;0;1;0;0;2;0;0;3;0;0;0;0;0;0;1;0;0;0;0;0;0;0;0;32;32;10;22;0;0;21;10;1;2;0;2;0;30;6;4;5;2;7;4;4;0;20;0;1;0;0;11;32;0;0
2014;Sudeste;3;Minas Gerais;MG;31;Belo Horizonte;3106200;1;Metropolitana de Belo Horizonte;7;Belo Horizonte;30;3;4;ORME SERVICOS EDUCACIONAIS LTDA;3167;4251;FACULDADE PITÁGORAS DE TECNOLOGIA DE BELO HORIZONTE;PIT-FATEC;Avenida Afonso Pena;271;;Centro;30130000;41;0;0;0;0;13;9;4;2;2;1;3;7;0;0;1;1;0;0;0;0;0;0;0;0;72;72;25;47;0;0;30;35;7;0;0;0;69;3;4;9;20;24;7;4;1;3;14;0;56;2;0;0;72;0;0
2014;Norte;1;Rondônia;RO;11;Cacoal;1100049;0;Leste Rondoniense;2;Cacoal;6;3;5;ASSOCIACAO EDUCACIONAL DE RONDONIA;525;4255;FACULDADES INTEGRADAS DE CACOAL;UNESC;Rua dos Esportes;1038;;Incra;78976215;83;10;6;6;0;9;24;13;12;1;1;0;1;0;0;1;0;0;0;0;0;0;0;0;0;132;130;52;78;0;0;67;52;11;52;0;52;18;60;28;26;29;15;18;8;3;3;58;2;30;0;0;37;129;1;0
