2014;Sudeste;3;Minas Gerais;MG;31;Barbacena;3105608;0;Campo das Vertentes;11;Barbacena;59;3;4;CENTRO EDUCACIONAL APRENDIZ LTDA - ME;1296;1977;CENTRO DE ESTUDOS SUPERIORES APRENDIZ;CESA;Avenida Bias Fortes;2;;Centro;36200068;62;2;0;4;1;27;9;11;3;3;2;0;0;0;0;1;1;0;0;0;0;0;0;0;0;26;26;8;18;0;0;11;12;3;5;1;4;10;11;1;4;10;3;6;1;1;0;23;1;2;0;0;0;26;0;0
2014;Nordeste;2;Ceará;CE;23;Fortaleza;2304400;1;Metropolitana de Fortaleza;3;Fortaleza;16;3;4;EMPREENDIMENTO EDUCACIONAL MARACANAU LTDA.;1297;1978;FACULDADE METROPOLITANA DA GRANDE FORTALEZA;FAMETRO;Rua Conselheiro Estelita;500;;Centro;60010260;113;1;6;4;7;50;33;6;3;2;0;1;0;0;0;0;0;0;0;0;0;0;0;0;0;224;224;108;116;0;0;45;142;37;50;0;50;98;76;22;62;42;39;29;16;9;5;51;5;57;1;0;89;224;0;0
2014;Sul;4;Santa Catarina;SC;42;Navegantes;4211306;0;Vale do Itajaí;4;Itajaí;13;3;4;SINERGIA SISTEMA DE ENSINO LTDA - EPP;1298;1980;FACULDADE SINERGIA;SINERGIA;Avenida Prefeito Cirino Adolfo Cabral;199;Beira Mar;São Pedro;88375000;23;0;0;0;0;4;3;4;0;2;4;4;1;1;0;0;0;0;0;0;0;0;0;0;0;43;41;20;21;0;0;7;29;5;2;2;0;12;27;3;9;5;5;11;2;1;5;40;1;0;0;0;0;41;0;0
2014;Sudeste;3;Minas Gerais;MG;31;Manhuaçu;3139409;0;Zona da Mata;12;Manhuaçu;61;3;4;CENTRO SUPERIOR DE ESTUDOS DE MANHUACU LTDA;1301;1984;FACULDADE DE CIÊNCIAS GERENCIAIS DE MANHUAÇU;FACIG;Avenida Getúlio Vargas;733;;Coqueiro;36900000;31;6;1;0;4;9;3;3;3;2;0;0;0;0;0;1;0;0;0;0;0;0;0;0;0;65;65;34;31;0;0;9;48;8;34;13;21;23;8;7;17;16;13;4;4;2;2;37;2;21;0;0;2;65;0;0
2014;Sudeste;3;Minas Gerais;MG;31;Juiz de Fora;3136702;0;Zona da Mata;12;Juiz de Fora;65;3;4;SOCIEDADE DE ENSINO SUPERIOR ESTACIO DE SA LTDA;119;1986;FACULDADE ESTÁCIO DE SÁ DE JUIZ DE FORA;FESJF;Avenida Presidente João Goulart;600;;Cruzeiro do Sul;36030900;45;0;0;0;2;11;10;6;3;5;5;1;2;0;0;1;1;0;0;0;0;0;0;0;0;140;131;60;71;0;0;44;67;20;34;0;34;37;60;5;29;35;28;16;10;6;2;127;3;0;0;0;0;131;0;0
2014;Sul;4;Santa Catarina;SC;42;Balneário Camboriú;4202008;0;Vale do Itajaí;4;Itajaí;13;3;4;SOCIEDADE CIVIL AVANTIS DE ENSINO LTDA;1303;1988;FACULDADE AVANTIS;AVANTIS;Avenida Marginal Leste;3600;Km 132;Dos Estados;88330116;60;2;3;1;1;15;12;10;7;5;1;3;0;0;0;1;1;0;0;0;0;0;0;0;0;149;143;70;73;0;0;24;99;20;48;0;48;93;2;17;39;30;19;14;12;6;6;128;0;9;1;0;3;143;0;1
2014;Nordeste;2;Pernambuco;PE;26;Jaboatão dos Guararapes;2607901;0;Metropolitana de Recife;5;Recife;17;3;5;ASSOCIACAO PERNAMBUCANA DE ENSINO SUPERIOR - APESU;1125;1992;INSTITUTO DE ENSINO SUPERIOR DE PIEDADE;IESP;Rua José Braz Moscow;252;;Piedade;54410390;9;0;0;0;0;4;2;0;3;0;0;0;0;0;0;0;0;0;0;0;0;0;0;0;0;9;9;3;6;0;0;3;6;0;1;0;1;0;8;0;0;2;1;4;2;0;0;3;0;2;0;0;3;9;0;1
2014;Sudeste;3;Minas Gerais;MG;31;Patos de Minas;3148004;0;Triângulo Mineiro/Alto Paranaíba;5;Patos de Minas;20;3;4;SOCIEDADE DE ENSINO SUPERIOR DE PATOS DE MINAS LTDA - EPP;1307;1993;FACULDADE DE CIÊNCIAS HUMANAS E DA SAÚDE;SESPA;Br 365 - Km 407;S/N;;Industrial;38700000;6;0;0;1;0;2;0;3;0;0;0;0;0;0;0;0;1;0;0;0;0;0;0;0;0;21;21;13;8;0;0;18;3;0;0;0;0;0;21;4;5;7;2;1;1;0;1;0;0;20;0;0;1;21;0;0
2014;Nordeste;2;Paraíba;PB;25;João Pessoa;2507507;1;Mata Paraibana;4;João Pessoa;22;3;4;ESCOLA DE ENFERMAGEM NOVA ESPERANCA LTDA;1158;1995;FACULDADE DE MEDICINA NOVA ESPERANÇA;FAMENE;Av. Frei Galvão;12;;Gramame;58067695;123;1;1;5;15;28;32;13;6;8;2;5;1;3;3;0;1;0;0;0;0;0;0;0;0;140;140;83;57;0;0;6;70;64;69;0;69;71;0;3;24;38;21;32;11;1;10;90;0;34;1;0;14;140;0;0
2014;Centro-Oeste;5;Mato Grosso;MT;51;Cuiabá;5103403;1;Centro-Sul Mato-grossense;4;Cuiabá;17;3;5;ASSOCIACAO UNIFICADA PAULISTA DE ENSINO RENOVADO OBJETIVO-ASSUPERO;2415;1996;INSTITUTO CUIABÁ DE ENSINO E CULTURA;ICEC;Rua Oswaldo da Silva Corrêa;621;;Bairro Santa Marta;78048005;53;5;0;5;0;21;6;5;3;7;1;0;0;0;0;0;0;0;0;0;0;0;0;0;0;108;106;44;62;0;2;79;24;1;0;0;0;29;77;7;17;36;15;10;11;6;4;63;2;29;6;0;5;105;1;0
2014;Sudeste;3;Minas Gerais;MG;31;Virginópolis;3171808;0;Vale do Rio Doce;8;Guanhães;35;3;4;SOCIEDADE DE ENSINO ELVIRA DAYRELL - SOED - EPP;1310;1998;INSTITUTO SUPERIOR DE EDUCAÇÃO ELVIRA DAYRELL;ISEED;Rodovia de Ligação da Br 120a Br 256;S/N;Trevo de Correntinho;Centro;39730000;21;5;4;0;0;2;2;3;5;0;0;0;0;0;0;1;1;0;0;0;0;0;0;0;0;26;26;9;17;0;0;15;7;4;14;6;8;12;0;0;6;5;4;2;4;1;4;12;0;5;0;0;9;24;2;0
2014;Nordeste;2;Bahia;BA;29;Cachoeira;2904902;0;Metropolitana de Salvador;5;Santo Antônio de Jesus;20;3;5;UNIAO NORDESTE BRASILEIRA DA IGREJA ADVENTISTA DO S DIA;1313;2001;SEMINÁRIO ADVENTISTA LATINO-AMERICANO DE TEOLOGIA;SALT;Rua Principal;s/n;SALT IAENE - BR 101,;Povoado de Capoeiruçu;44300000;69;0;0;0;1;9;8;29;15;1;3;0;1;0;2;0;1;0;0;0;0;0;0;0;0;23;23;2;21;0;0;9;7;7;9;7;2;6;8;0;2;4;2;4;3;6;2;11;2;6;0;0;2;23;0;0
2014;Centro-Oeste;5;Mato Grosso;MT;51;Sinop;5107909;0;Norte Mato-grossense;1;Sinop;7;3;4;UNIC EDUCACIONAL LTDA;15801;2005;FACULDADE DE CIÊNCIAS SOCIAIS APLICADAS DE SINOP;FACISAS;Estrada Nanci;900;Km 1;Eunice;78550000;37;3;1;7;2;13;4;4;1;2;0;0;0;0;0;1;1;0;0;0;0;0;0;0;0;170;170;87;83;0;3;87;35;45;35;0;35;125;10;33;38;32;27;24;7;4;5;86;2;72;4;0;5;170;0;2
2014;Sudeste;3;São Paulo;SP;35;Taquaritinga;3553708;0;Ribeirão Preto;2;Jaboticabal;13;3;5;INSTITUTO EDUCACIONAL DO ESTADO DE SAO PAULO - IESP;289;2009;FACULDADE DE TAQUARITINGA;FTGA;Fazenda Contendas;s/n;;Zona Rural;15900000;28;0;1;2;2;5;7;8;3;0;0;0;0;0;0;1;0;0;0;0;0;0;0;0;0;61;60;38;22;0;0;20;28;12;4;0;4;22;34;8;25;4;8;8;3;3;1;47;0;1;0;0;8;60;0;0
2014;Sudeste;3;São Paulo;SP;35;Sorocaba;3552205;0;Macro Metropolitana Paulista;12;Sorocaba;46;3;4;ESCOLA SUPERIOR DE GESTAO DE NEGOCIOS LTDA;1025;2010;FACULDADE ESAMC SOROCABA;ESAMC;Rua Romeu do Nascimento;777;;Jardim Portal da Colina;18047410;6;0;0;0;0;4;0;2;0;0;0;0;0;0;0;0;0;0;0;0;0;0;0;0;0;59;57;17;40;0;0;28;23;6;4;0;4;33;20;2;8;11;8;8;8;7;5;42;0;1;0;0;7;57;0;0
2014;Nordeste;2;Pernambuco;PE;26;Pesqueira;2610905;0;Agreste Pernambucano;3;Vale do Ipojuca;8;3;4;SOCIEDADE DE EDUCACAO CULTURA E ESPORTES DE PESQUEIRA LTDA - ME;1321;2012;INSTITUTO SUPERIOR DE EDUCAÇÃO DE PESQUEIRA;ISEP;Rua José Nepomuceno das Neves;47, 51 e 5;;Centro;55200000;21;0;0;0;0;0;9;5;1;5;0;0;0;0;1;0;0;0;0;0;0;0;0;0;0;31;31;19;12;0;0;20;7;4;0;0;0;0;31;1;5;6;5;7;4;2;1;12;0;19;0;0;0;31;0;0
2014;Sudeste;3;Minas Gerais;MG;31;Sete Lagoas;3167202;0;Metropolitana de Belo Horizonte;7;Sete Lagoas;27;3;5;ASSOCIACAO EDUCATIVA DO BRASIL - SOEBRAS;1509;2014;FACULDADE SETELAGOANA DE CIÊNCIAS GERENCIAIS;FASCIG;Avenida Marechal Castelo Branco;3870;;Jardim Universitário;35702134;59;1;0;3;3;17;8;11;5;6;3;0;2;0;0;0;0;0;0;0;0;0;0;0;0;7;7;2;5;0;0;0;5;2;0;0;0;4;3;0;0;3;2;2;0;0;0;5;0;0;0;0;1;7;0;0
2014;Sudeste;3;Minas Gerais;MG;31;Belo Horizonte;3106200;1;Metropolitana de Belo Horizonte;7;Belo Horizonte;30;3;5;INSPETORIA SAO JOAO BOSCO;978;2015;INSTITUTO SANTO TOMÁS DE AQUINO;ISTA;Rua Itutinga;300;;Minas Brasil;30535640;25;0;1;2;0;3;6;4;1;3;1;0;2;0;2;1;1;0;0;0;0;0;0;0;0;32;31;7;24;0;0;2;13;16;3;2;1;7;21;0;1;2;1;2;12;6;7;20;0;3;0;0;8;29;2;0
2014;Nordeste;2;Pernambuco;PE;26;Salgueiro;2612208;0;Sertão Pernambucano;1;Salgueiro;2;3;4;EDUCA-SOCIEDADE EDUCACIONAL,CULTURAL E ESPORTIVA DE SALGUEIR - ME;1326;2019;INSTITUTO SUPERIOR DE EDUCAÇÃO DE SALGUEIRO;ISES;Rua Professora Maria Nita de Oliveira;169;;Divino Espírito Santo;56000000;4;0;0;0;0;0;0;1;0;3;0;0;0;0;0;0;0;0;0;0;0;0;0;0;0;15;15;9;6;0;0;11;4;0;0;0;0;0;15;0;3;3;1;1;3;0;4;1;0;6;1;0;7;15;0;0
2014;Centro-Oeste;5;Distrito Federal;DF;53;Brasília;5300108;1;Distrito Federal;1;Brasília;1;3;4;FACULDADES EURO BRASILEIRAS PARA EDUCACAO SUPERIOR PRIVADA LTDA - ME;1327;2021;FACULDADE JK - UNIDADE II - GAMA;;Área Especial Lotes 18 a 22;s/n;Setor Central Lado L;Gama;72405370;21;0;0;0;0;7;5;6;0;3;0;0;0;0;0;1;1;0;0;0;0;0;0;0;0;44;44;13;31;0;0;23;16;5;10;3;7;25;9;4;12;7;6;7;4;2;2;17;1;7;1;0;15;43;1;0
2014;Norte;1;Rondônia;RO;11;Rolim de Moura;1100288;0;Leste Rondoniense;2;Cacoal;6;3;4;SOCIEDADE ROLIMOURENSE DE EDUCACAO E CULTURA LTDA;1328;2022;FACULDADE DE ROLIM DE MOURA;FAROL;Rodovia 383;Km 01;Saida para Santa Luz;Zona Rural;78987000;54;3;4;3;3;10;7;12;2;8;2;0;0;0;0;1;1;0;0;0;0;0;0;0;0;60;58;21;37;0;1;42;13;2;10;0;10;16;32;12;9;14;7;9;5;1;1;21;1;18;0;0;5;58;0;0
2014;Nordeste;2;Bahia;BA;29;Guanambi;2911709;0;Centro Sul Baiano;6;Guanambi;26;3;4;CESG - CENTRO DE EDUCACAO SUPERIOR DE GUANAMBI LTDA;1329;2023;FACULDADE DE GUANAMBI;;Rua Vasco da Gama;317;;Centro;46430000;119;2;0;20;9;35;18;11;2;15;6;0;1;0;0;0;1;0;0;0;0;0;0;0;0;116;115;54;61;0;0;70;39;6;15;0;15;100;0;33;42;19;8;8;3;1;1;16;2;7;0;0;54;115;0;0
2014;Nordeste;2;Paraíba;PB;25;Campina Grande;2504009;0;Agreste Paraibano;3;Campina Grande;17;3;4;UNESC-PB UNIAO DE ENSINO SUPERIOR DE CAMPINA GRANDE LTDA - ME;1332;2027;FACULDADE DE CAMPINA GRANDE;FAC-CG;Rua Coronel Antonio Pessoa;111;;Centro;58400262;182;3;5;4;4;29;16;33;29;0;0;35;15;3;6;1;1;0;0;0;0;0;0;0;0;76;76;50;26;0;0;13;49;14;8;0;8;57;11;17;20;18;7;8;2;1;3;14;0;50;0;0;11;76;0;0
2014;Sudeste;3;São Paulo;SP;35;Campo Limpo Paulista;3509601;0;Macro Metropolitana Paulista;12;Jundiaí;47;3;4;INSTITUTO DE ENSINO CAMPO LIMPO PAULISTA LTDA;849;2030;INSTITUTO SUPERIOR DE EDUCAÇÃO CAMPO LIMPO PAULISTA;ISECAMP;Rua Guatemala;167;;Jardim América;13231230;205;13;10;12;6;30;6;82;31;8;7;0;0;0;0;1;1;0;0;0;0;0;0;0;0;44;44;21;23;0;0;13;18;13;13;0;13;11;20;2;5;8;11;5;6;2;5;6;0;0;0;0;1;43;1;0
2014;Nordeste;2;Pernambuco;PE;26;Floresta;2605707;0;São Francisco Pernambucano;2;Itaparica;6;3;4;SECEF-SOCIEDADE DE EDUCACAO CULTURA E ESPORTES DE FLORESTA LTDA S/C - ME;1337;2033;INSTITUTO SUPERIOR DE EDUCAÇÃO DE FLORESTA;ISEF;Avenida  Deputado Audomar Ferraz;98;;Centro;56400000;14;0;0;0;0;5;3;3;0;2;0;1;0;0;0;0;0;0;0;0;0;0;0;0;0;33;20;15;5;0;1;13;6;0;13;0;13;3;4;5;2;0;1;7;3;1;1;8;2;10;0;0;0;20;0;0
2014;Sul;4;Paraná;PR;41;Jaguariaíva;4112009;0;Centro Oriental Paranaense;5;Jaguariaíva;20;3;4;ULT UNIAO LATINO AMERICANA DE TECNOLOGIA SS LTDA - EPP;1338;2035;UNIÃO LATINO-AMERICADA DE TECNOLOGIA;ULT;Rua Santa Catarina;4;;Centro;84200000;18;2;0;1;0;7;2;2;0;2;1;0;1;0;0;1;1;0;0;0;0;0;0;0;0;35;35;12;23;0;0;16;16;3;5;3;2;13;17;7;6;10;4;2;5;1;0;29;0;3;0;0;3;35;0;0
2014;Norte;1;Pará;PA;15;Belém;1501402;1;Metropolitana de Belém;3;Belém;7;3;4;IREP SOCIEDADE DE ENSINO SUPERIOR, MEDIO E FUNDAMENTAL LTDA.;545;2036;Faculdade Estácio do Pará - Estácio FAP;ESTÁCIO FAP;Rua Municipalidade;839;;Reduto;66050350;77;0;0;1;5;27;26;9;7;2;0;0;0;0;0;1;1;0;0;0;0;0;0;0;0;177;126;54;72;0;0;53;62;11;29;0;29;59;38;5;31;21;18;22;16;9;4;17;1;107;0;0;0;126;0;1
2014;Nordeste;2;Bahia;BA;29;Lauro de Freitas;2919207;0;Metropolitana de Salvador;5;Salvador;21;3;4;UNIME - UNIAO METROPOLITANA PARA O DESENVOLVIMENTO DA EDUCACAO E CULTURA LTDA.;1029;2037;FACULDADE UNIME DE CIÊNCIAS EXATAS E TECNOLÓGICAS;FCT;Avenida Luís Tarquínio Pontes;600;;centro;42700000;260;15;12;27;35;50;80;20;15;3;3;0;0;0;0;0;1;0;0;0;0;0;0;0;0;104;104;46;58;0;3;25;49;27;9;0;9;88;7;1;8;17;27;11;17;6;17;44;4;25;1;0;23;104;0;1
2014;Sudeste;3;São Paulo;SP;35;Ilha Solteira;3520442;0;Araçatuba;3;Andradina;16;3;4;SOCIEDADE DE ENSINO E CULTURA DE ILHA SOLTEIRA S/S LTDA - ME;1340;2039;FACULDADE CIDADE LUZ;FACILUZ;Alameda Bahia;490D;;Centro;15385000;9;0;0;0;1;3;2;2;0;0;0;0;1;0;0;1;1;0;0;0;0;0;0;0;0;18;18;10;8;0;0;10;7;1;1;0;1;17;0;0;4;4;3;4;2;1;0;11;0;1;0;0;1;18;0;0
2014;Sudeste;3;Minas Gerais;MG;31;Manhuaçu;3139409;0;Zona da Mata;12;Manhuaçu;61;3;4;SOCIEDADE DE ENSINO SUPERIOR DE MANHUACU LTDA;1341;2040;FACULDADE DO FUTURO;FAF;Rua Duarte Peixoto;259;;Coqueiro;36900000;43;0;0;12;6;5;3;4;3;2;0;2;4;1;1;0;1;0;0;0;0;0;0;0;0;50;50;23;27;0;0;22;26;2;7;7;0;30;13;7;17;9;6;3;4;3;1;36;1;6;0;1;4;50;0;0
2014;Sudeste;3;Minas Gerais;MG;31;Cataguases;3115300;0;Zona da Mata;12;Cataguases;66;3;4;CENTRO DE ENSINO SUPERIOR SOUSA BORGES LTDA - EPP;1342;2041;FACULDADE SUDAMÉRICA;SUDAMÉRICA;Rua Ofélia Resende;101;;Bandeirantes;36773082;16;0;0;1;0;3;0;3;0;5;0;3;0;1;0;1;1;0;0;0;0;0;0;0;0;26;26;13;13;0;0;2;19;5;6;0;6;15;5;2;9;6;3;3;0;1;2;22;0;4;0;0;0;26;0;0
2014;Nordeste;2;Alagoas;AL;27;Maceió;2704302;1;Leste Alagoano;3;Maceió;11;3;4;UNIAO DE FACULDADES DE ALAGOAS LTDA - EPP;1343;2042;FACULDADE FIGUEIREDO COSTA - FIC;;Rua Barão de Jaraguá;398;;Jaraguá;57022140;30;2;3;0;6;3;6;3;2;3;0;0;2;0;0;1;1;0;0;0;0;0;0;0;0;52;52;17;35;0;0;20;25;7;14;4;10;19;19;7;20;5;8;1;6;4;1;16;0;23;0;0;10;51;1;0
2014;Nordeste;2;Ceará;CE;23;Icó;2305407;0;Centro-Sul Cearense;6;Iguatu;26;3;4;TCC EDUCACAO, CIENCIA E CULTURA LTDA - EPP;1344;2043;FACULDADE VALE DO SALGADO;FVS;Rua Monsenhor Frota;609;;Centro;63430000;55;4;3;0;0;8;9;5;3;15;4;2;2;0;0;1;1;0;0;0;0;0;0;0;0;109;108;55;53;0;0;55;31;22;8;0;8;54;46;32;28;13;13;9;4;4;5;47;3;45;0;1;10;108;0;1
2014;Nordeste;2;Sergipe;SE;28;Aracaju;2800308;1;Leste Sergipano;3;Aracaju;11;3;4;SESA - SOCIEDADE DE ENSINO SUPERIOR AMADEUS LTDA;1345;2045;FACULDADE AMADEUS;FAMA;Rua Estância;937;;Centro;49010180;17;0;0;0;0;1;1;5;3;2;1;1;3;0;0;0;1;0;0;0;0;0;0;0;0;33;33;16;17;0;0;10;19;4;6;0;6;9;18;1;6;4;7;4;5;3;3;12;1;17;0;0;1;33;0;1
2014;Nordeste;2;Maranhão;MA;21;São Luís;2111300;1;Norte Maranhense;1;Aglomeração Urbana de São Luís;2;3;5;SOCIEDADE MARANHENSE DE CULTURA SUPERIOR;1346;2049;INSTITUTO DE ESTUDOS SUPERIORES DO MARANHÃO;IESMA;Rua do Rancho;110;;Centro;65010010;14;1;1;0;0;2;5;0;0;5;0;0;0;0;0;1;1;0;0;0;0;0;0;0;0;14;14;3;11;0;0;5;8;1;4;1;3;8;2;2;1;0;4;5;2;0;0;6;1;7;0;0;0;14;0;0
2014;Centro-Oeste;5;Mato Grosso do Sul;MS;50;Nova Andradina;5006200;0;Leste de Mato Grosso do Sul;3;Nova Andradina;8;3;5;ASSOCIACAO EDUCACIONAL DO CONE SUL;1782;2054;FACULDADE DE EDUCAÇÃO DE NOVA ANDRADINA;FENA;Avenida Antônio Joaquim de Moura Andrade;910;;Centro;79750000;22;1;2;1;1;6;5;2;0;2;1;0;1;0;0;0;0;0;0;0;0;0;0;0;0;9;9;7;2;0;0;5;3;1;6;0;6;3;0;0;0;3;2;3;1;0;0;8;0;1;0;0;0;9;0;0
2014;Sudeste;3;São Paulo;SP;35;Tupã;3555000;0;Marília;9;Tupã;37;3;4;INSTITUICAO DOM BOSCO DE ENSINO E CULTURA LTDA;191;2056;FACULDADE DA ALTA PAULISTA;FAP;Rua Mandaguaris;1010;Térreo;Centro;17604000;34;1;1;0;0;9;8;7;3;2;3;0;0;0;0;1;1;0;0;0;0;0;0;0;0;54;53;29;24;0;0;20;27;6;8;0;8;30;15;13;18;7;8;0;3;1;3;28;0;1;1;0;13;53;0;0
2014;Norte;1;Rondônia;RO;11;Porto Velho;1100205;1;Madeira-Guaporé;1;Porto Velho;1;3;4;UNNESA - UNIAO DE ENSINO SUPERIOR DA AMAZONIA OCIDENTAL S/C LTDA - EPP;1352;2058;FACULDADE METROPOLITANA;UNNESA;Rua Araras;241;;Jardim Eldorado;78912640;5;0;0;0;0;3;0;1;1;0;0;0;0;0;0;1;1;0;0;0;0;0;0;0;0;31;31;20;11;0;0;13;14;4;6;0;6;25;0;2;5;4;6;3;9;1;1;12;3;15;0;0;1;31;0;0
2014;Nordeste;2;Bahia;BA;29;Santo Antônio de Jesus;2928703;0;Metropolitana de Salvador;5;Santo Antônio de Jesus;20;3;4;CENTRO DE ESTUDOS SUPERIORES DE SANTO ANTONIO DE JESUS S/C - EPP;1359;2067;FACULDADE DE CIÊNCIAS EMPRESARIAIS;FACEMP;Rua Manoel Jose da Paixão Araújo;89-A;A;Centro;44571024;25;0;0;1;2;9;1;6;3;2;1;0;0;0;0;1;0;0;0;0;0;0;0;0;0;49;49;23;26;0;0;20;23;6;16;1;15;31;2;6;13;7;9;4;4;3;3;13;4;23;1;0;5;49;0;0
2014;Norte;1;Amapá;AP;16;Macapá;1600303;1;Sul do Amapá;2;Macapá;3;3;5;IGREJA EVANGELICA ASSEMBLEIA DE DEUS DE MACAPA;1361;2069;FACULDADE DE TEOLOGIA E CIÊNCIAS HUMANAS;FATECH;Avenida Professora Cora de Carvalho;1648;;Centro;68906370;16;0;2;0;0;3;0;3;1;4;3;0;0;0;0;1;1;0;0;0;0;0;0;0;0;6;6;2;4;0;0;4;2;0;3;2;1;1;2;0;0;2;1;0;3;0;0;4;0;2;0;0;0;6;0;0
2014;Norte;1;Acre;AC;12;Cruzeiro do Sul;1200203;0;Vale do Juruá;1;Cruzeiro do Sul;1;3;5;INSTITUTO DE EDUCACAO, CIENCIAS E TECNOLOGIA DO VALE DO JURUA;1364;2072;FACULDADE DE DESENVOLVIMENTO SUSTENTÁVEL DE CRUZEIRO DO SUL;IEVAL;Rodovia BR 307;Km 09;IEVAL;Boca da Alemanha;69980000;6;0;0;0;1;0;0;4;1;0;0;0;0;0;0;1;1;0;0;0;0;0;0;0;0;24;23;7;16;0;0;17;6;0;3;1;2;19;1;3;12;3;3;0;2;0;0;12;0;10;0;0;1;23;0;0
2014;Centro-Oeste;5;Goiás;GO;52;Goiânia;5208707;1;Centro Goiano;3;Goiânia;10;3;4;SOCIEDADE DE EDUCACAO E CULTURA DE GOIANIA LTDA;828;2073;INSTITUTO SUPERIOR DE EDUCAÇÃO PADRÃO;ISE-PADRAO;Rua Araponga;70;;Jardim Vila Boa;74360210;2;0;0;0;0;0;0;2;0;0;0;0;0;0;0;0;1;0;0;0;0;0;0;0;0;10;10;5;5;0;0;5;3;2;0;0;0;7;3;0;2;1;3;1;1;2;0;8;0;1;0;0;1;10;0;1
2014;Nordeste;2;Alagoas;AL;27;Maceió;2704302;1;Leste Alagoano;3;Maceió;11;3;5;ASSOCIACAO DE ENSINO SUPERIOR DE ALAGOAS-AESA;637;2075;INSTITUTO DE ENSINO SUPERIOR DE ALAGOAS;IESA;Avenida Engenheiro Paulo Brandão Nogueira;160;Loteamento Stella Ma;Jatiúca;57035360;35;0;0;2;1;11;12;3;2;1;1;1;1;0;0;0;0;0;0;0;0;0;0;0;0;74;73;28;45;0;0;50;18;5;14;0;14;29;30;11;18;14;13;7;2;5;3;15;5;44;0;0;2;73;0;0
2014;Nordeste;2;Bahia;BA;29;Salvador;2927408;1;Metropolitana de Salvador;5;Salvador;21;3;4;UNIRB - UNIDADES DE ENSINO SUPERIOR DA BAHIA LTDA;1367;2076;FACULDADE REGIONAL DA BAHIA;FARB;Rua Tamburugy;474;Colégio Diplomata;Patamares;41680430;38;0;0;3;4;14;7;3;2;3;1;1;0;0;0;0;0;0;0;0;0;0;0;0;0;176;176;112;64;0;0;1;132;43;30;2;28;135;11;22;46;33;21;16;16;10;12;28;4;60;3;0;40;173;3;0
2014;Sul;4;Paraná;PR;41;Foz do Iguaçu;4108304;0;Oeste Paranaense;6;Foz do Iguaçu;24;3;5;UNIAO DINAMICA DE FACULDADES CATARATAS UDC LTDA;924;2077;FACULDADE ANGLO-AMERICANO;FAA;Avenida Paraná;5.661;;Vila A;85868030;38;3;1;4;1;10;6;12;1;0;0;0;0;0;0;1;0;0;0;0;0;0;0;0;0;74;74;36;38;0;2;26;42;4;13;0;13;46;15;7;17;19;9;11;9;2;0;50;2;7;0;0;5;73;1;0
2014;Norte;1;Pará;PA;15;Itaituba;1503606;0;Sudoeste Paraense;5;Itaituba;14;3;4;CENTRO DE ESTUDOS SUPERIORES DE ITAITUBA LTDA - ME;1368;2079;FACULDADE DE ITAITUBA;FAI;Avenida Fernando Guilhon;895;4ª Rua;Jardim das Araras;68180110;25;0;0;0;0;0;5;5;1;8;2;0;1;1;2;0;0;0;0;0;0;0;0;0;0;37;37;22;15;0;0;27;7;3;8;2;6;29;0;6;6;7;5;5;4;1;3;16;1;19;0;0;0;37;0;0
2014;Nordeste;2;Paraíba;PB;25;João Pessoa;2507507;1;Mata Paraibana;4;João Pessoa;22;3;4;CENTRO NORDESTINO DE ENSINO SUPERIOR S/S LTDA;1371;2082;FACULDADE DE CIÊNCIAS MÉDICAS DA PARAÍBA;FCM-PB;Praça Dom Ulrico;56;;Centro;58010740;200;8;10;6;16;49;44;39;11;9;3;3;1;1;0;0;1;0;0;0;0;0;0;0;0;211;210;131;79;0;0;45;108;57;15;0;15;193;2;6;34;61;34;21;16;7;31;133;1;67;1;0;7;210;0;1
2014;Sul;4;Rio Grande do Sul;RS;43;Nova Petrópolis;4313201;0;Metropolitana de Porto Alegre;5;Gramado-Canela;24;3;5;CAMPANHA NACIONAL DE ESCOLAS DA COMUNIDADE;407;2084;FACULDADE CENECISTA DE NOVA PETRÓPOLIS;FACENP;Rua 28 de Fevereiro;100;;Logradouro;95150000;6;1;0;0;1;2;0;1;0;0;0;0;1;0;0;1;0;0;0;0;0;0;0;0;0;17;16;7;9;0;0;10;5;1;0;0;0;4;12;0;3;5;3;3;2;0;0;1;0;0;0;0;2;16;0;0
2014;Nordeste;2;Bahia;BA;29;Salvador;2927408;1;Metropolitana de Salvador;5;Salvador;21;3;5;ASSOCIACAO UNIFICADA PAULISTA DE ENSINO RENOVADO OBJETIVO-ASSUPERO;2415;2085;INSTITUTO BAIANO DE ENSINO SUPERIOR;IBES;Rua Luiz Portela da Silva;628;;Itaigara;41815290;58;1;3;4;1;18;17;6;1;6;1;0;0;0;0;0;0;0;0;0;0;0;0;0;0;101;93;39;54;0;1;66;24;2;32;2;30;42;19;6;18;27;19;8;7;5;3;21;2;58;0;0;6;92;1;0
2014;Sul;4;Paraná;PR;41;Foz do Iguaçu;4108304;0;Oeste Paranaense;6;Foz do Iguaçu;24;3;5;"ASSOCIACAO EDUCACIONAL IGUACU ""AEI""";611;2086;INSTITUTO DE ENSINO SUPERIOR DE FOZ DO IGUAÇU;IESFI;Avenida Paraná;3.695;;Jardim Central;85863720;47;5;0;0;2;21;9;2;3;3;2;0;0;0;0;0;0;0;0;0;0;0;0;0;0;111;104;53;51;0;0;68;34;2;14;0;14;74;16;11;20;24;15;14;8;6;6;85;1;9;1;0;1;103;1;1
2014;Sudeste;3;Rio de Janeiro;RJ;33;Rio de Janeiro;3304557;1;Metropolitana do Rio de Janeiro;6;Rio de Janeiro;18;3;5;CENTRO DE ESTUDOS PSICO PEDAGOGICOS PRO-SABER;1374;2091;INSTITUTO SUPERIOR DE EDUCAÇÃO PRÓ-SABER;ISEPS;Rua Largo dos Leões;70;Parte;Humaitá;22260210;9;0;0;0;0;1;3;2;1;2;0;0;0;0;0;1;1;0;0;0;0;0;0;0;0;17;16;16;0;0;1;8;4;3;5;0;5;11;0;0;0;3;2;0;3;1;7;15;1;0;0;0;0;16;0;0
2014;Sudeste;3;Minas Gerais;MG;31;Manhuaçu;3139409;0;Zona da Mata;12;Manhuaçu;61;3;5;INSTITUTO ENSINAR BRASIL;218;2096;Faculdade Doctum de Manhuaçu;DOCTUM;Avenida Getúlio Vargas;700;4º andar;Bairro Coqueiro;36900000;17;0;0;3;1;2;3;5;1;1;0;0;1;0;0;0;0;0;0;0;0;0;0;0;0;28;28;4;24;0;0;10;11;7;0;0;0;28;0;2;7;12;4;2;0;1;0;19;0;3;0;0;5;28;0;1
2014;Nordeste;2;Ceará;CE;23;Maranguape;2307700;0;Metropolitana de Fortaleza;3;Fortaleza;16;3;5;COMUNIDADE EVANGELICA BATISTA KURIOS;1380;2098;FACULDADE KURIOS;FAK;Avenida Dr. Argeu Gurgel B. Herbest;960;;Centro;61940000;44;0;0;4;5;10;7;12;2;0;0;2;0;2;0;0;0;0;0;0;0;0;0;0;0;69;69;30;39;0;0;27;34;8;24;0;24;43;2;9;14;9;17;4;7;5;4;29;3;26;0;0;9;67;2;0
2014;Sudeste;3;São Paulo;SP;35;Auriflama;3504206;0;São José do Rio Preto;1;Auriflama;6;3;4;CENTRO DE ENSINO E CULTURA DE AURIFLAMA LTDA - EPP;1381;2102;FACULDADE DE AURIFLAMA;FAU;Via de Acesso Sp 310 Arthur Fornazari Neto;Km 2,8;;Limoeiro;15350000;7;0;0;0;0;2;0;3;0;1;0;0;1;0;0;1;0;0;0;0;0;0;0;0;0;23;21;15;6;0;0;14;6;1;7;0;7;13;1;1;3;6;6;0;4;1;0;19;0;0;1;0;0;21;0;0
2014;Nordeste;2;Ceará;CE;23;Sobral;2312908;0;Noroeste Cearense;1;Sobral;5;3;5;ASSOCIACAO IGREJA ADVENTISTA MISSIONARIA - AIAMIS;1390;2111;INSTITUTO SUPERIOR DE TEOLOGIA APLICADA;INTA;Rua Coronel Antônio Rodrigues Magalhães;700;;Dom Expedito;62011230;345;5;14;8;32;48;113;84;17;16;8;0;0;0;0;1;1;0;0;0;0;0;0;0;0;209;208;110;98;0;0;0;159;49;113;0;113;95;0;29;69;54;20;18;8;5;5;66;7;108;0;1;21;205;3;2
2014;Sul;4;Rio Grande do Sul;RS;43;Porto Alegre;4314902;1;Metropolitana de Porto Alegre;5;Porto Alegre;26;3;5;INSPETORIA SALESIANA SAO PIO X;1391;2113;FACULDADE DOM BOSCO DE PORTO ALEGRE;FDB;Rua Marechal José Inácio da Silva;355;;Passo D'Areia;90520280;16;3;0;0;1;5;2;2;2;0;1;0;0;0;0;0;0;0;0;0;0;0;0;0;0;55;47;17;30;0;0;1;29;17;6;1;5;13;28;1;5;8;15;2;8;3;5;43;1;1;0;0;2;46;1;0
2014;Sul;4;Paraná;PR;41;Palotina;4117909;0;Oeste Paranaense;6;Toledo;22;3;4;UESPAR - UNIAO DE ENSINO SUPERIOR DO PARANA LTDA - EPP;1395;2117;FACULDADE DE CIÊNCIA E TECNOLOGIA;FACITEC;Avenida Presidente Kennedy;2300;;Jardim Itália;85950000;4;0;0;0;0;1;0;2;0;1;0;0;0;0;0;0;0;0;0;0;0;0;0;0;0;31;31;13;18;0;0;20;10;1;5;5;0;1;25;3;9;6;2;7;3;0;1;30;0;0;0;0;1;31;0;0
2014;Nordeste;2;Sergipe;SE;28;Aracaju;2800308;1;Leste Sergipano;3;Aracaju;11;3;4;IREP SOCIEDADE DE ENSINO SUPERIOR, MEDIO E FUNDAMENTAL LTDA.;545;2122;Estácio FASE - Faculdade Estácio de Sergipe;Estácio FASE;Rua Teixeira de Freitas;10;;Salgado Filho;49020530;75;0;0;1;2;26;17;11;6;6;2;0;3;1;0;1;1;0;0;0;0;0;0;0;0;181;172;96;76;0;0;75;82;15;10;0;10;89;73;17;43;51;26;18;9;5;3;89;0;61;0;0;10;172;0;0
2014;Sudeste;3;São Paulo;SP;35;Indaiatuba;3520509;0;Campinas;7;Campinas;32;3;4;INSTITUTO DE ENSINO SUPERIOR DE INDAIATUBA LTDA;1399;2123;FACULDADE MAX PLANCK;FMP;Rua Rêmulo Zoppi;434;;Vila Georgina;13333090;104;0;0;0;3;24;8;25;12;6;11;6;5;3;1;1;1;0;0;0;0;0;0;0;0;201;201;78;123;0;0;91;89;21;9;0;9;64;128;14;40;41;40;24;20;11;11;179;1;1;1;0;8;199;2;0
2014;Sudeste;3;Minas Gerais;MG;31;São Sebastião do Paraíso;3164704;0;Sul/Sudoeste de Minas;10;São Sebastião do Paraíso;48;3;4;UNIAO DE ESCOLAS SUPERIORES PARAISO LTDA - UNIESP - EPP;1400;2124;FACULDADE CALAFIORI;CALAFIORI;Avenida José Pio de Oliveira;10;;Cidade Jardim Industrial;37950000;12;2;0;0;2;3;0;1;0;2;1;0;0;1;0;0;0;0;0;0;0;0;0;0;0;17;17;9;8;0;0;5;10;2;15;0;15;2;0;0;8;2;3;3;1;0;0;10;0;1;0;0;6;17;0;0
2014;Sudeste;3;Rio de Janeiro;RJ;33;Rio de Janeiro;3304557;1;Metropolitana do Rio de Janeiro;6;Rio de Janeiro;18;3;5;FUNDACAO GETULIO VARGAS;110;2126;ESCOLA DE DIREITO DO RIO DE JANEIRO;DIREITO RIO;Praia de Botafogo;190;13º  Andar;Botafogo;22250900;41;0;0;0;0;1;6;11;4;13;0;2;4;0;0;1;1;0;0;0;0;0;0;0;0;55;49;11;38;0;1;6;16;26;26;0;26;22;1;3;9;15;5;3;9;1;4;25;0;3;0;0;16;49;0;0
2014;Sudeste;3;São Paulo;SP;35;São Paulo;3550308;1;Metropolitana de São Paulo;15;São Paulo;61;3;5;FUNDACAO GETULIO VARGAS;110;2128;ESCOLA DE DIREITO DE SÃO PAULO;DIREITO GV;Avenida Nove de Julho;2029;;Bela Vista;1313902;68;0;0;0;0;5;5;25;8;11;3;5;2;2;2;1;1;0;0;0;0;0;0;0;0;48;47;20;27;0;0;1;4;42;24;16;8;22;1;0;6;13;10;8;5;2;3;32;0;0;1;0;10;45;2;0
2014;Sudeste;3;São Paulo;SP;35;São Paulo;3550308;1;Metropolitana de São Paulo;15;São Paulo;61;3;5;FUNDACAO GETULIO VARGAS;110;2129;ESCOLA DE ECONOMIA DE SÃO PAULO;EESP;Rua Itapeva;474;13º andar;Bela Vista;1332000;27;0;0;0;0;1;1;12;0;2;9;0;1;1;0;1;1;0;0;0;0;0;0;0;0;45;44;6;38;0;0;0;0;44;37;33;4;3;4;0;4;10;12;8;2;1;7;20;0;0;1;0;21;41;3;0
2014;Sudeste;3;São Paulo;SP;35;São Bernardo do Campo;3548708;0;Metropolitana de São Paulo;15;São Paulo;61;3;4;SOCIEDADE EDUCACIONAL DO GRANDE ABC LTDA;1403;2131;FACULDADE FAPAN;FAPAN;Avenida Francisco Prestes Maia;98;;Centro;9770000;20;0;0;4;2;6;3;4;0;0;1;0;0;0;0;0;0;0;0;0;0;0;0;0;0;24;24;13;11;0;0;8;10;6;3;0;3;6;15;0;4;6;3;5;2;3;1;16;2;2;0;0;2;24;0;1
2014;Norte;1;Acre;AC;12;Rio Branco;1200401;1;Vale do Acre;2;Rio Branco;4;3;4;UNIAO EDUCACIONAL DO NORTE LTDA;1404;2132;FACULDADE BARÃO DO RIO BRANCO;FAB;Br 364 Km 02;200;Alameda Hungria;Jardim Europa II;69911900;269;0;19;0;51;60;72;23;14;21;9;0;0;0;0;1;1;0;0;0;0;0;0;0;0;179;179;93;86;0;0;67;76;36;120;0;120;36;23;19;39;31;45;14;15;5;11;43;2;88;2;0;37;177;2;0
2014;Norte;1;Roraima;RR;14;Boa Vista;1400100;1;Norte de Roraima;1;Boa Vista;1;3;5;INSTITUTO SUPERIOR DE EDUCACAO FACETEN LTDA - ISEF - ME;15456;2133;Faculdade de Ciências, Educação e Teologia do Norte do Brasil;FACETEN;Avenida dos Bandeirantes;900;;Pricumã;69300000;22;0;0;0;0;8;3;3;2;1;3;1;1;0;0;1;0;0;0;0;0;0;0;0;0;23;21;12;9;0;0;5;15;1;6;3;3;8;7;1;1;6;0;5;5;2;1;8;1;11;0;0;0;20;1;0
2014;Centro-Oeste;5;Goiás;GO;52;Goiânia;5208707;1;Centro Goiano;3;Goiânia;10;3;5;ORGANIZACAO CULTURAL EDUCACIONAL FILANTROPICA;1406;2134;FACULDADE DA IGREJA MINISTÉRIO FAMA;FAIFA;Rua Florianópolis;220;Qd 11  Lote 06;Vila Paraíso;74553520;10;1;0;0;0;2;1;1;1;1;2;0;0;1;0;0;1;0;0;0;0;0;0;0;0;9;7;2;5;0;0;3;3;1;1;1;0;1;5;0;1;1;1;0;3;1;0;0;2;3;0;0;1;7;0;0
2014;Nordeste;2;Ceará;CE;23;Quixadá;2311306;0;Sertões Cearenses;4;Sertão de Quixeramobim;19;3;5;ASSOCIACAO EDUCACIONAL E CULTURAL DE QUIXADA;15681;2135;FACULDADE CATÓLICA RAINHA DO SERTÃO;FCRS;Rua Basílio Pinto;s/n;;Combate;63900000;172;5;6;2;5;59;43;28;14;6;2;1;0;0;1;1;0;0;0;0;0;0;0;0;0;190;190;81;109;0;0;66;106;18;45;0;45;81;64;34;55;41;27;10;13;8;2;24;0;153;0;0;4;189;1;0
2014;Norte;1;Tocantins;TO;17;Porto Nacional;1718204;0;Oriental do Tocantins;2;Porto Nacional;6;3;4;SOCIEDADE SAO MARCOS LTDA - ME;1408;2137;FACULDADE SÃO MARCOS;FASAMAR;Rua Antônio Aires Primo;2.697;;Centro;77500000;9;0;0;0;0;3;2;2;0;1;0;1;0;0;0;0;0;0;0;0;0;0;0;0;0;17;14;11;3;0;0;9;5;0;0;0;0;14;0;3;1;3;1;2;0;2;2;7;1;4;0;1;0;14;0;0
