NU_ANO_CENSO;NO_REGIAO_IES;CO_REGIAO_IES;NO_UF_IES;SG_UF_IES;CO_UF_IES;NO_MUNICIPIO_IES;CO_MUNICIPIO_IES;IN_CAPITAL_IES;NO_MESORREGIAO_IES;CO_MESORREGIAO_IES;NO_MICRORREGIAO_IES;CO_MICRORREGIAO_IES;TP_ORGANIZACAO_ACADEMICA;TP_CATEGORIA_ADMINISTRATIVA;NO_MANTENEDORA;CO_MANTENEDORA;CO_IES;NO_IES;SG_IES;DS_ENDERECO_IES;DS_NUMERO_ENDERECO_IES;DS_COMPLEMENTO_ENDERECO_IES;NO_BAIRRO_IES;NU_CEP_IES;QT_TEC_TOTAL;QT_TEC_FUNDAMENTAL_INCOMP_FEM;QT_TEC_FUNDAMENTAL_INCOMP_MASC;QT_TEC_FUNDAMENTAL_COMP_FEM;QT_TEC_FUNDAMENTAL_COMP_MASC;QT_TEC_MEDIO_FEM;QT_TEC_MEDIO_MASC;QT_TEC_SUPERIOR_FEM;QT_TEC_SUPERIOR_MASC;QT_TEC_ESPECIALIZACAO_FEM;QT_TEC_ESPECIALIZACAO_MASC;QT_TEC_MESTRADO_FEM;QT_TEC_MESTRADO_MASC;QT_TEC_DOUTORADO_FEM;QT_TEC_DOUTORADO_MASC;IN_ACESSO_PORTAL_CAPES;IN_ACESSO_OUTRAS_BASES;IN_ASSINA_OUTRA_BASE;IN_REPOSITORIO_INSTITUCIONAL;IN_BUSCA_INTEGRADA;IN_SERVICO_INTERNET;IN_PARTICIPA_REDE_SOCIAL;IN_CATALOGO_ONLINE;QT_PERIODICO_ELETRONICO;QT_LIVRO_ELETRONICO;QT_DOC_TOTAL;QT_DOC_EXE;QT_DOC_EX_FEMI;QT_DOC_EX_MASC;QT_DOC_EX_SEM_GRAD;QT_DOC_EX_GRAD;QT_DOC_EX_ESP;QT_DOC_EX_MEST;QT_DOC_EX_DOUT;QT_DOC_EX_INT;QT_DOC_EX_INT_DE;QT_DOC_EX_INT_SEM_DE;QT_DOC_EX_PARC;QT_DOC_EX_HOR;QT_DOC_EX_0_29;QT_DOC_EX_30_34;QT_DOC_EX_35_39;QT_DOC_EX_40_44;QT_DOC_EX_45_49;QT_DOC_EX_50_54;QT_DOC_EX_55_59;QT_DOC_EX_60_MAIS;QT_DOC_EX_BRANCA;QT_DOC_EX_PRETA;QT_DOC_EX_PARDA;QT_DOC_EX_AMARELA;QT_DOC_EX_INDIGENA;QT_DOC_EX_COR_ND;QT_DOC_EX_BRA;QT_DOC_EX_EST;QT_DOC_EX_COM_DEFICIENCIA
2016;Centro-Oeste;5;Mato Grosso;MT;51;Cuiabá;5103403;1;Centro-Sul Mato-grossense;4;Cuiabá;17;1;1;FUNDACAO UNIVERSIDADE FEDERAL DE MATO GROSSO;1;1;UNIVERSIDADE FEDERAL DE MATO GROSSO;UFMT;Avenida Fernando Correa da Costa;2367;Cidade Universitária;Boa Esperança;78060900;1603;3;28;14;45;145;211;156;136;367;267;129;72;18;12;1;1;0;1;0;1;0;1;0;0;2240;2240;1093;1147;0;176;138;642;1284;2162;1713;449;78;0;226;376;430;340;234;203;189;242;1148;7;424;133;5;523;2204;36;8
2016;Centro-Oeste;5;Distrito Federal;DF;53;Brasília;5300108;1;Distrito Federal;1;Brasília;1;1;1;FUNDACAO UNIVERSIDADE DE BRASILIA;2;2;UNIVERSIDADE DE BRASÍLIA;UNB;Campus Universitário Darcy Ribeiro;s/n;;Asa Norte;70910900;3270;9;38;24;61;366;426;1074;948;84;70;74;69;13;14;1;1;0;1;1;1;1;1;38262;175995;3034;2874;1316;1558;0;33;24;450;2367;2636;2289;347;238;0;108;313;504;464;374;440;327;344;1800;60;468;57;12;477;2684;190;7
2016;Nordeste;2;Sergipe;SE;28;São Cristóvão;2806701;0;Leste Sergipano;3;Aracaju;11;1;1;FUNDACAO UNIVERSIDADE FEDERAL DE SERGIPE;3;3;UNIVERSIDADE FEDERAL DE SERGIPE;UFS;Avenida Marechal Rondon;s/n;;Jardim Rosa Elze;49100000;1472;0;6;8;63;146;198;194;180;293;153;121;86;15;9;1;1;0;1;1;1;1;0;38197;30210;1810;1771;855;916;0;87;80;461;1143;1515;1316;199;256;0;128;289;349;306;241;199;114;145;21;1;51;0;0;1698;1721;50;1
2016;Norte;1;Amazonas;AM;13;Manaus;1302603;1;Centro Amazonense;3;Manaus;7;1;1;FUNDACAO UNIVERSIDADE DO AMAZONAS;4;4;UNIVERSIDADE FEDERAL DO AMAZONAS;UFAM;Av. Rodrigo Otávio;6200;Campus Universitário;Coroado II;69077000;1716;14;18;1;28;215;229;200;203;388;256;83;53;15;13;1;1;0;0;0;1;1;1;0;3245;1937;1661;772;889;0;165;200;513;783;1508;1172;336;153;0;190;254;263;245;214;227;125;143;103;10;141;5;1;1401;1653;8;16
2016;Nordeste;2;Piauí;PI;22;Teresina;2211001;1;Centro-Norte Piauiense;2;Teresina;3;1;1;FUNDACAO UNIVERSIDADE FEDERAL DO PIAUI;14054;5;UNIVERSIDADE FEDERAL DO PIAUÍ;UFPI;Campus Universitário Ministro Petrônio Portela;s/n;SG - 07;Ininga;64049550;1225;6;53;2;38;59;135;160;164;254;216;62;58;8;10;1;1;0;1;1;1;1;1;0;0;2073;1850;925;925;0;31;262;632;925;1701;1290;411;149;0;223;317;340;238;171;178;150;233;125;44;190;3;2;1486;1850;0;0
2016;Sudeste;3;Minas Gerais;MG;31;Ouro Preto;3146107;0;Metropolitana de Belo Horizonte;7;Ouro Preto;33;1;1;UNIVERSIDADE FEDERAL DE OURO PRETO;6;6;UNIVERSIDADE FEDERAL DE OURO PRETO;UFOP;Rua Diogo de Vasconcelos;122;;Centro;35400000;798;9;60;4;26;40;114;54;105;125;114;81;47;12;7;1;1;0;1;1;1;1;1;107;7;1001;891;353;538;0;43;16;207;625;881;697;184;10;0;85;144;193;108;95;106;87;73;293;16;98;3;1;480;890;1;0
2016;Sudeste;3;São Paulo;SP;35;São Carlos;3548906;0;Araraquara;5;São Carlos;25;1;1;FUNDACAO UNIVERSIDADE FEDERAL DE SAO CARLOS;1302;7;UNIVERSIDADE FEDERAL DE SÃO CARLOS;UFSCAR;Via Washington  Luis;Km 235;S/Nº;Monjolinho;13565905;1014;3;22;1;13;66;115;91;127;198;150;96;67;35;30;1;1;0;1;1;1;1;1;37600;274766;1459;1437;653;784;0;6;7;114;1310;1346;1208;138;91;0;48;221;278;213;193;185;120;179;1285;6;76;26;1;43;1417;20;15
2016;Sudeste;3;Minas Gerais;MG;31;Viçosa;3171303;0;Zona da Mata;12;Viçosa;62;1;1;UNIVERSIDADE FEDERAL DE VICOSA;15588;8;UNIVERSIDADE FEDERAL DE VIÇOSA;UFV;Av. P.H. Rolfs;s/n;Campus Universitário;Campus Universitário;36570000;2355;8;202;8;69;50;563;120;234;363;471;109;103;25;30;1;0;0;1;1;1;1;1;128585;11159;1244;1244;475;769;0;33;37;213;961;1240;1081;159;4;0;78;188;256;155;115;180;154;118;293;14;49;2;0;886;1222;22;0
2016;Sul;4;Paraná;PR;41;Londrina;4113700;0;Norte Central Paranaense;3;Londrina;11;1;2;SECRET DE EST CIENCIA TECNOLOGIA E ENSINO SUPERIOR SETI;37;9;UNIVERSIDADE ESTADUAL DE LONDRINA;UEL;Rodovia Celso Garcia Cid Pr 445 Km 380;;;Campus Universitário;86057970;1592;6;93;12;52;233;370;182;226;197;113;42;41;8;17;1;1;0;1;1;1;1;1;0;2521;1811;1773;912;861;0;18;86;381;1288;1490;1250;240;221;62;48;174;251;217;265;315;222;281;1296;18;92;91;0;276;1752;21;49
2016;Sul;4;Paraná;PR;41;Curitiba;4106902;1;Metropolitana de Curitiba;10;Curitiba;37;1;5;ASSOCIACAO PARANAENSE DE CULTURA - APC;10;10;PONTIFÍCIA UNIVERSIDADE CATÓLICA DO PARANÁ;PUCPR;Rua Imaculada Conceição;1155;;Prado Velho;80215901;1239;1;3;6;6;325;253;292;160;109;43;11;20;6;4;1;1;0;1;1;1;1;1;45003;230420;1649;1624;647;977;0;15;209;724;676;571;0;571;551;502;69;186;248;264;266;199;202;190;476;5;15;11;1;1116;1623;1;2
2016;Nordeste;2;Pernambuco;PE;26;Recife;2611606;1;Metropolitana de Recife;5;Recife;17;1;5;CENTRO DE EDUCACAO TECNICA E CULTURAL;11;11;UNIVERSIDADE CATÓLICA DE PERNAMBUCO;UNICAP;Rua do Príncipe;526;Campus Universitário;Boa Vista;50050900;442;2;9;0;10;72;88;96;84;42;29;0;9;0;1;1;1;0;1;0;1;1;1;174;1092;473;464;197;267;0;0;44;215;205;167;0;167;91;206;7;25;52;62;52;68;57;141;313;11;124;1;0;15;464;0;3
2016;Sul;4;Rio Grande do Sul;RS;43;Rio Grande;4315602;0;Sudeste Rio-grandense;7;Litoral Lagunar;35;1;1;UNIVERSIDADE FEDERAL DO RIO GRANDE - FURG;15596;12;UNIVERSIDADE FEDERAL DO RIO GRANDE;FURG;Av. Itália;S/N;KM - 8;Carreiros;96201900;1192;0;23;11;13;116;135;154;122;228;121;138;75;37;19;1;1;0;1;1;1;1;1;0;5000;974;895;437;458;0;45;42;170;638;873;712;161;22;0;63;126;191;134;106;99;84;92;726;19;63;9;5;73;869;26;5
2016;Sul;4;Rio Grande do Sul;RS;43;Caxias do Sul;4305108;0;Nordeste Rio-grandense;2;Caxias do Sul;16;1;5;FUNDACAO UNIVERSIDADE DE CAXIAS DO SUL;13;13;UNIVERSIDADE DE CAXIAS DO SUL;UCS;Rua Francisco Getúlio Vargas;1130;Bloco A;Petrópolis;95070560;1368;101;38;70;46;182;182;386;214;89;31;17;7;4;1;1;1;0;1;1;1;1;1;10000;13000;1060;1049;515;534;0;0;141;542;366;351;0;351;284;414;38;120;167;167;161;143;132;121;966;1;9;0;0;73;1049;0;11
2016;Sul;4;Rio Grande do Sul;RS;43;São Leopoldo;4318705;0;Metropolitana de Porto Alegre;5;Porto Alegre;26;1;5;ASSOCIACAO ANTONIO VIEIRA;14;14;UNIVERSIDADE DO VALE DO RIO DOS SINOS;UNISINOS;Av. Unisinos;950;;Cristo Rei;93022000;983;3;4;9;5;336;286;147;53;64;26;23;19;5;3;1;1;0;1;1;1;1;1;80;9435;1090;1071;525;546;0;0;44;487;540;333;0;333;582;156;22;94;233;172;143;146;107;154;1046;10;2;2;0;11;1047;24;4
2016;Sudeste;3;Rio de Janeiro;RJ;33;Petrópolis;3303906;0;Metropolitana do Rio de Janeiro;6;Serrana;15;1;5;MITRA DIOCESANA DE PETROPOLIS;15;15;UNIVERSIDADE CATÓLICA DE PETRÓPOLIS;UCP;Rua Benjamin Constant;213;;Centro;25610130;243;5;31;9;25;52;59;28;20;5;3;4;2;0;0;1;0;0;0;0;1;0;1;0;0;221;221;78;143;0;0;29;120;72;72;0;72;29;120;9;20;36;33;24;37;19;43;206;3;12;0;0;0;218;3;5
2016;Sudeste;3;Minas Gerais;MG;31;Uberlândia;3170206;0;Triângulo Mineiro/Alto Paranaíba;5;Uberlândia;18;1;1;UNIVERSIDADE FEDERAL DE UBERLANDIA;9140;17;UNIVERSIDADE FEDERAL DE UBERLÂNDIA;UFU;Avenida João Naves de Ávila;2121;Reitoria;Santa Mônica;38408144;1817;18;63;14;32;154;228;173;200;372;285;120;108;37;13;1;1;0;1;1;1;1;1;5705;305;1992;1968;863;1105;0;42;62;317;1547;1925;1655;270;43;0;106;260;384;355;245;246;163;209;1437;32;195;38;2;264;1935;33;12
2016;Sul;4;Rio Grande do Sul;RS;43;Pelotas;4314407;0;Sudeste Rio-grandense;7;Pelotas;33;1;5;SOCIEDADE PELOTENSE DE ASSISTENCIA E CULTURA(SPAC);18;18;UNIVERSIDADE CATÓLICA DE PELOTAS;UCPEL;Rua Félix da Cunha;412;;Centro;96010000;300;8;8;5;8;34;37;99;47;22;16;10;4;1;1;1;1;0;1;0;1;0;1;38;7232;280;280;150;130;0;0;69;127;84;95;0;95;153;32;4;50;48;40;31;39;36;32;279;1;0;0;0;0;279;1;2
2016;Sudeste;3;São Paulo;SP;35;Campinas;3509502;0;Campinas;7;Campinas;32;1;5;SOCIEDADE CAMPINEIRA DE EDUCACAO E INSTRUCAO;19;19;PONTIFÍCIA UNIVERSIDADE CATÓLICA DE CAMPINAS;PUC-CAMPINAS;Rodovia Dom Pedro I;Km 136;Prédio da Reitoria;Parque das Universidades;13086900;1433;158;148;74;73;270;299;212;130;38;22;4;5;0;0;1;1;0;1;0;0;0;1;13880;246782;966;949;430;519;0;0;204;322;423;264;0;264;192;493;16;102;144;108;125;118;138;198;419;3;22;9;4;492;935;14;6
2016;Sul;4;Rio Grande do Sul;RS;43;Passo Fundo;4314100;0;Noroeste Rio-grandense;1;Passo Fundo;10;1;5;FUNDACAO UNIVERSIDADE DE PASSO FUNDO;20;20;UNIVERSIDADE DE PASSO FUNDO;UPF;Upf Campus Passo Fundo - Campus I;s/nº;BR 285 - KM 171;São José;99001970;1248;32;24;55;26;321;270;199;135;101;45;24;14;2;0;1;1;0;1;0;1;0;1;91;158396;945;909;412;497;0;0;172;453;284;322;0;322;314;273;46;119;150;148;121;127;106;92;898;2;0;0;0;9;900;9;17
2016;Sul;4;Rio Grande do Sul;RS;43;Porto Alegre;4314902;1;Metropolitana de Porto Alegre;5;Porto Alegre;26;1;5;UNIAO BRASILEIRA DE EDUCACAO E ASSISTENCIA;21;21;PONTIFÍCIA UNIVERSIDADE CATÓLICA DO RIO GRANDE DO SUL;PUCRS;Av. Ipiranga;6681;;Partenon;90619900;1953;30;73;84;104;428;676;241;185;39;32;21;25;10;5;1;1;0;1;1;1;1;1;572574;107664;1293;1293;505;788;0;5;51;417;820;554;147;407;503;236;18;87;174;192;160;198;189;275;1242;5;18;8;0;20;1279;14;5
2016;Sudeste;3;São Paulo;SP;35;São Paulo;3550308;1;Metropolitana de São Paulo;15;São Paulo;61;1;5;INSTITUTO PRESBITERIANO MACKENZIE;22;22;UNIVERSIDADE PRESBITERIANA MACKENZIE;MACKENZIE;Rua da Consolação;896;Campus São Paulo;Consolação;1302907;1823;22;62;21;62;392;473;274;194;157;95;27;33;4;7;1;1;0;1;0;1;1;1;51103;14511;1245;1245;460;785;0;0;32;464;749;509;0;509;252;484;15;54;139;163;163;248;160;303;1074;10;104;43;1;13;1199;46;8
2016;Sul;4;Rio Grande do Sul;RS;43;Novo Hamburgo;4313409;0;Metropolitana de Porto Alegre;5;Porto Alegre;26;1;5;ASSOCIACAO PRO ENSINO SUPERIOR EM NOVO HAMBURGO;23;23;UNIVERSIDADE FEEVALE;FEEVALE;Rua 239;nº 2755;;VILA  NOVA;93352000;805;14;3;17;14;231;185;136;74;79;26;17;8;1;0;1;1;0;0;1;1;1;1;45000;150000;567;561;323;238;0;0;28;347;186;183;0;183;360;18;19;74;127;101;96;67;46;31;551;3;5;0;0;2;560;1;4
2016;Nordeste;2;Bahia;BA;29;Ilhéus;2913606;0;Sul Baiano;7;Ilhéus-Itabuna;31;1;2;UNIVERSIDADE ESTADUAL DE SANTA CRUZ;24;24;UNIVERSIDADE ESTADUAL DE SANTA CRUZ;UESC;KM 16 DA RODOVIA ILHÉUS ITABUNA;S/N;;Salobrinho;45662900;418;0;15;1;6;63;88;120;62;32;17;10;4;0;0;1;1;0;0;1;1;1;1;4678;38182;775;729;350;379;0;8;54;191;476;712;561;151;17;0;8;61;94;126;140;122;83;95;29;3;53;1;1;642;700;29;0
2016;Sudeste;3;Rio de Janeiro;RJ;33;Rio de Janeiro;3304557;1;Metropolitana do Rio de Janeiro;6;Rio de Janeiro;18;3;1;FUNDACAO INSTIT BRAS DE GEOGRAFIA E ESTATISTICA IBGE;26;26;ESCOLA NACIONAL DE CIÊNCIAS ESTATÍSTICAS;ENCE;Rua André Cavalcanti;106;;Santa Teresa;20231050;94;0;0;0;0;4;10;6;5;8;7;6;11;21;16;1;0;0;1;1;1;0;1;0;1825;51;51;26;25;0;0;1;10;40;41;0;41;10;0;1;8;4;7;7;7;6;11;42;0;5;1;1;2;50;1;0
2016;Sudeste;3;Minas Gerais;MG;31;Três Corações;3169307;0;Sul/Sudoeste de Minas;10;Varginha;50;1;5;FUNDACAO COMUNITARIA TRICORDIANA DE EDUCACAO;27;27;UNIVERSIDADE VALE DO RIO VERDE;UNINCOR;Av. Castelo Branco;82;;Chácara das Rosas;37410000;382;17;22;21;16;68;51;49;25;30;32;24;20;6;1;1;1;0;1;1;1;1;1;4620;4000;232;232;114;118;0;0;73;119;40;90;11;79;58;84;15;33;52;51;30;26;13;12;161;9;43;1;0;18;232;0;0
2016;Nordeste;2;Ceará;CE;23;Fortaleza;2304400;1;Metropolitana de Fortaleza;3;Fortaleza;16;1;2;FUNDACAO UNIVERSIDADE ESTADUAL DO CEARA FUNECE;29;29;UNIVERSIDADE ESTADUAL DO CEARÁ;UECE;Av. Dr. Silas Munguba;1700;Campus Universitário;Serrinha;60740000;714;24;56;28;25;187;147;104;68;31;21;7;8;4;4;1;0;0;1;0;0;0;0;0;0;1305;1219;599;620;0;49;110;469;591;1053;570;483;84;82;120;170;164;161;142;149;118;195;22;0;64;0;0;1133;1215;4;0
2016;Sudeste;3;Minas Gerais;MG;31;Alfenas;3101607;0;Sul/Sudoeste de Minas;10;Alfenas;49;1;5;FUNDACAO DE ENSINO E TECNOLOGIA DE ALFENAS;30;30;UNIVERSIDADE JOSÉ DO ROSÁRIO VELLANO;UNIFENAS;Rodovia Mg 179 - Km 0;s/n;;Campus Universitário;37130000;741;43;150;19;27;122;117;85;60;54;36;12;11;2;3;1;1;0;1;1;1;0;1;144;886;409;409;202;207;0;0;73;185;151;194;0;194;158;57;11;37;79;79;56;59;35;53;39;1;7;0;0;362;408;1;0
2016;Sudeste;3;Minas Gerais;MG;31;Belo Horizonte;3106200;1;Metropolitana de Belo Horizonte;7;Belo Horizonte;30;3;2;FUNDACAO DE EDUCACAO PARA O TRABALHO DE MINAS GERAIS;31;31;CENTRO DE EDUCAÇÃO TÉCNICA DA UTRAMIG;UTRAMIG;Avenida Afonso Pena;3400;;CRUZEIRO;30130009;4;0;0;0;0;1;0;0;0;1;0;1;0;1;0;0;0;0;0;1;1;1;0;0;0;5;5;3;2;0;0;5;0;0;0;0;0;0;5;0;1;0;0;0;1;2;1;1;1;1;0;0;2;5;0;0
2016;Nordeste;2;Alagoas;AL;27;Maceió;2704302;1;Leste Alagoano;3;Maceió;11;1;2;UNIVERSIDADE ESTADUAL DE CIENCIAS DA SAUDE DE ALAGOAS - UNCISAL;32;32;UNIVERSIDADE ESTADUAL DE CIÊNCIAS DA SAÚDE DE ALAGOAS - UNCISAL;UNCISAL;Rua Jorge de Lima;113;;Trapiche da Barra;57010300;300;0;0;32;27;23;30;56;43;45;19;11;8;3;3;1;0;0;1;1;1;0;0;0;0;314;312;186;126;0;0;93;155;64;135;0;135;177;0;21;47;54;52;40;31;32;35;123;1;103;0;0;85;312;0;2
2016;Sudeste;3;São Paulo;SP;35;Sorocaba;3552205;0;Macro Metropolitana Paulista;12;Sorocaba;46;3;2;CENTRO ESTADUAL DE EDUCACAO TECNOLOGICA PAULA SOUZA;33;33;FACULDADE DE TECNOLOGIA DE SOROCABA;FATEC SO;AVENIDA ENGENHEIRO CARLOS REINALDO MENDES;2.015;;ALTO DA BOA VISTA;18013280;71;2;2;2;1;18;12;12;17;2;3;0;0;0;0;0;0;0;0;0;1;0;0;0;3;124;121;25;96;0;19;21;51;30;73;16;57;37;11;0;4;11;9;18;22;27;30;94;2;2;1;0;22;121;0;0
2016;Sudeste;3;São Paulo;SP;35;São Paulo;3550308;1;Metropolitana de São Paulo;15;São Paulo;61;3;2;CENTRO ESTADUAL DE EDUCACAO TECNOLOGICA PAULA SOUZA;33;34;FACULDADE DE TECNOLOGIA DE SÃO PAULO;FATEC-SP;Praça Coronel Fernando Prestes;30;;BOM RETIRO;1124060;101;4;2;2;1;44;14;22;12;0;0;0;0;0;0;0;0;0;1;0;1;0;1;0;0;1063;1061;449;612;0;66;158;577;260;138;35;103;591;332;12;68;117;169;177;197;121;200;723;4;30;48;0;256;1052;9;1
2016;Sudeste;3;São Paulo;SP;35;Americana;3501608;0;Campinas;7;Campinas;32;3;2;CENTRO ESTADUAL DE EDUCACAO TECNOLOGICA PAULA SOUZA;33;35;FACULDADE DE TECNOLOGIA DE AMERICANA;FATEC-AM;Rua Emílio de Menezes;s/n;;Vila Amorim;13469111;28;0;0;0;0;3;4;11;7;3;0;0;0;0;0;0;0;0;1;1;1;0;1;3169;0;132;132;38;94;0;8;23;72;29;48;12;36;60;24;5;17;15;17;17;27;21;13;96;2;4;1;0;29;130;2;0
2016;Sudeste;3;São Paulo;SP;35;Santos;3548500;0;Metropolitana de São Paulo;15;Santos;63;3;2;CENTRO ESTADUAL DE EDUCACAO TECNOLOGICA PAULA SOUZA;33;36;FACULDADE DE TECNOLOGIA RUBENS LARA;FATEC-BS;Avenida Bartolomeu de Gusmão 110 Fatec - Faculdade de Tecnólogia da Baixada Santista;110;;Aparecida;11045908;26;0;0;1;1;1;5;10;5;1;1;0;0;0;1;0;0;0;0;1;1;1;1;0;0;74;74;23;51;0;4;9;47;14;8;3;5;59;7;0;5;5;9;11;12;13;19;32;2;0;0;0;40;74;0;0
2016;Sudeste;3;São Paulo;SP;35;Jaú;3525300;0;Bauru;4;Jaú;21;3;2;CENTRO ESTADUAL DE EDUCACAO TECNOLOGICA PAULA SOUZA;33;37;FACULDADE DE TECNOLOGIA DE JAHU;FATEC-JAHU;Rua Frei Galvão;S/N;;JARDIM PEDRO OMETTO;17212599;33;0;0;1;0;2;4;9;4;5;6;0;2;0;0;0;0;0;0;0;0;0;0;0;0;96;94;33;61;0;8;19;47;20;51;13;38;31;12;1;8;15;17;15;17;13;8;87;0;0;1;0;6;94;0;0
2016;Norte;1;Pará;PA;15;Belém;1501402;1;Metropolitana de Belém;3;Belém;7;1;2;UNIVERSIDADE DO ESTADO DO PARA UEP;34;38;UNIVERSIDADE DO ESTADO DO PARÁ;UEPA;Travessa Djalma Dutra;S/N;;Telégrafo Sem Fio;66113010;1307;14;26;40;56;337;265;367;161;17;7;11;3;2;1;1;1;0;0;1;1;1;1;12;0;1264;1196;670;526;0;0;275;554;367;1000;150;850;106;90;78;185;173;168;159;167;141;125;205;35;453;3;3;497;1195;1;2
2016;Nordeste;2;Bahia;BA;29;Salvador;2927408;1;Metropolitana de Salvador;5;Salvador;21;1;2;UNIVERSIDADE DO ESTADO DA BAHIA;36;40;UNIVERSIDADE DO ESTADO DA BAHIA;UNEB;Rua Silveira Martins;2555;;Cabula;41150000;1706;0;0;93;103;368;323;392;182;175;44;14;6;2;4;1;1;0;1;1;1;0;0;0;0;1784;1784;1042;742;0;9;333;770;672;1629;745;884;146;9;45;202;284;280;333;286;173;181;573;252;702;7;10;240;1773;11;13
2016;Sul;4;Santa Catarina;SC;42;Florianópolis;4205407;1;Grande Florianópolis;5;Florianópolis;16;1;2;FUNDACAO UNIVERSIDADE DO ESTADO DE SC UDESC;39;43;FUNDAÇÃO UNIVERSIDADE DO ESTADO DE SANTA CATARINA;UDESC;Avenida Madre Benvenuta;1907;Campus I;Itacorubi;88035001;760;13;22;97;94;138;116;39;58;67;40;45;24;5;2;1;1;0;0;1;1;1;1;222;7166;1266;1195;551;644;0;34;61;433;667;752;634;118;80;363;94;203;229;195;150;148;100;76;717;12;15;4;1;446;1192;3;1
2016;Centro-Oeste;5;Goiás;GO;52;Anápolis;5201108;0;Centro Goiano;3;Anápolis;7;1;2;UNIVERSIDADE ESTADUAL DE GOIAS;42;47;UNIVERSIDADE ESTADUAL DE GOIÁS;UEG;BR 153;S/N;KM 98 (Campus);Zona Rural;75000000;1422;1;4;97;85;283;152;368;149;189;77;4;11;2;0;1;0;0;0;1;1;1;1;1;3130;2005;1845;1025;820;0;0;832;606;407;752;327;425;1093;0;167;292;374;314;253;189;138;118;503;64;237;18;1;1022;1841;4;6
2016;Sudeste;3;São Paulo;SP;35;Campinas;3509502;0;Campinas;7;Campinas;32;1;2;ESTADO DE SAO PAULO;46;54;UNIVERSIDADE ESTADUAL DE CAMPINAS;UNICAMP;Cidade Universitária;S/N;;BARÃO GERALDO;13083970;4260;18;91;42;144;504;743;984;809;329;248;137;94;63;54;1;1;0;1;1;1;1;1;3439;279527;2060;1998;743;1255;4;19;6;30;1939;1825;1815;10;173;0;10;127;264;242;207;294;350;504;1814;9;22;29;3;121;1893;105;6
2016;Sudeste;3;São Paulo;SP;35;São Paulo;3550308;1;Metropolitana de São Paulo;15;São Paulo;61;1;2;UNIVERSIDADE DE SAO PAULO;15715;55;UNIVERSIDADE DE SÃO PAULO;USP;Rua da Reitoria;374;;Butantã;5508220;15562;140;649;165;515;2686;3839;2161;1784;1260;682;540;345;487;309;1;1;0;1;1;1;1;1;975;374420;6286;6186;2379;3807;0;2;0;54;6130;5846;5220;626;340;0;24;176;555;830;806;1078;1076;1641;5648;239;1;141;2;155;5900;286;0
2016;Sudeste;3;São Paulo;SP;35;São Paulo;3550308;1;Metropolitana de São Paulo;15;São Paulo;61;1;2;ESTADO DE SAO PAULO;46;56;UNIVERSIDADE ESTADUAL PAULISTA JÚLIO DE MESQUITA FILHO;UNESP;Rua Quirino de Andrade;215;;Centro;1049010;6445;22;146;114;295;771;1403;1400;1273;476;260;107;74;62;42;1;1;0;1;1;1;1;1;37793;314198;3457;3450;1397;2053;0;7;1;36;3406;3313;3313;0;137;0;4;164;407;425;487;695;630;638;731;3;22;20;0;2674;3349;101;1
2016;Sul;4;Paraná;PR;41;Maringá;4115200;0;Norte Central Paranaense;3;Maringá;9;1;2;SECRET DE EST CIENCIA TECNOLOGIA E ENSINO SUPERIOR SETI;37;57;UNIVERSIDADE ESTADUAL DE MARINGÁ;UEM;Avenida Colombo;5790;Campus Universitário;Zona 7;87020900;1636;3;88;17;45;208;333;184;204;158;238;39;67;20;32;1;0;0;1;1;1;1;1;37000;305;1783;1607;779;828;0;35;40;386;1146;1554;1380;174;53;0;114;237;233;196;223;267;191;146;776;23;77;53;1;677;1587;20;8
2016;Sudeste;3;São Paulo;SP;35;São Bernardo do Campo;3548708;0;Metropolitana de São Paulo;15;São Paulo;61;3;3;PREFEITURA DO MUNICIPIO DE SAO BERNARDO DO CAMPO;48;58;FACULDADE DE DIREITO DE SÃO BERNARDO DO CAMPO;FDSBC;Rua Java;425;;JARDIM DO MAR;9750650;121;1;3;1;0;17;15;38;20;12;11;0;1;1;1;0;1;0;1;0;1;1;1;30;0;60;59;22;37;0;2;2;19;36;0;0;0;1;58;2;3;4;16;9;12;5;8;37;0;2;3;0;17;59;0;0
2016;Sudeste;3;São Paulo;SP;35;Franca;3516200;0;Ribeirão Preto;2;Franca;12;3;7;FACULDADE DE DIREITO DE FRANCA;49;59;FACULDADE DE DIREITO DE FRANCA;FDF;Avenida Major Nicácio;2377;;SÃO JOSÉ;14401135;23;0;0;0;1;5;2;4;3;1;1;0;2;1;3;1;1;0;1;1;1;0;1;28;450;34;34;6;28;0;0;0;27;7;12;1;11;18;4;1;1;2;3;3;6;9;9;32;0;0;0;0;2;34;0;0
2016;Sudeste;3;São Paulo;SP;35;Franca;3516200;0;Ribeirão Preto;2;Franca;12;2;7;CENTRO UNIVERSITARIO MUNICIPAL DE FRANCA;2234;60;CENTRO UNIVERSITÁRIO MUNICIPAL DE FRANCA;UNI-FACEF;Avenida Major Nicácio;2433;;SÃO JOSÉ;14401135;35;0;0;0;0;2;0;6;4;12;4;3;3;1;0;1;0;0;1;1;1;0;1;45245;5222;138;136;72;64;0;0;19;67;50;32;15;17;39;65;4;13;14;21;22;17;18;27;118;0;2;1;0;15;136;0;0
2016;Sudeste;3;São Paulo;SP;35;Piracicaba;3538709;0;Piracicaba;6;Piracicaba;28;3;3;FUNDACAO MUNICIPAL DE ENSINO DE PIRACICABA;52;67;ESCOLA DE ENGENHARIA DE PIRACICABA;EEP/FUMEP;Avenida Monsenhor Martinho Salgot;560;;Areião;13414040;77;0;0;2;0;12;12;18;15;7;7;1;3;0;0;0;1;0;0;1;1;1;1;20;5241;116;112;19;93;0;1;12;55;44;7;0;7;19;86;2;4;15;9;15;19;24;24;28;1;1;0;0;82;112;0;0
2016;Sudeste;3;São Paulo;SP;35;Penápolis;3537305;0;Araçatuba;3;Birigui;18;3;5;FUNDACAO EDUCACIONAL DE PENAPOLIS;53;68;FACULDADE DE FILOSOFIA CIÊNCIAS E LETRAS DE PENÁPOLIS;FAFIPE;AV SÃO JOSÉ;400;;VILA MARTINS;16300000;26;0;0;0;0;4;7;11;3;0;0;0;1;0;0;1;1;0;0;0;1;0;1;0;0;45;43;17;26;0;3;8;22;10;0;0;0;0;43;4;8;10;8;3;5;4;1;35;0;5;0;0;3;43;0;0
2016;Nordeste;2;Rio Grande do Norte;RN;24;Mossoró;2408003;0;Oeste Potiguar;1;Mossoró;1;1;2;UNIVERSIDADE DO ESTADO DO RIO GRANDE DO NORTE - UERN;55;71;UNIVERSIDADE DO ESTADO DO RIO GRANDE DO NORTE;UERN;Rua Almino Afonso;478;SEDE DA REITORIA;CENTRO;59610210;611;0;0;0;0;3;6;83;127;192;154;24;19;2;1;1;0;0;0;1;1;1;0;0;0;923;917;408;509;0;72;230;353;262;762;429;333;154;1;50;145;187;177;121;108;58;71;363;22;399;0;1;132;907;10;0
2016;Nordeste;2;Pernambuco;PE;26;Palmares;2610004;0;Mata Pernambucana;4;Mata Meridional Pernambucana;15;3;3;AUTARQUIA EDUCACIONAL DA MATA SUL;56;72;FACULDADE DE FORMAÇÃO DE PROFESSORES DA MATA SUL;FAMASUL;Br 101 Km 186 Sul;S/N;;ENGENHO SAO MANOEL;55540000;52;0;0;4;1;6;13;6;9;6;7;0;0;0;0;0;0;0;0;0;1;1;0;0;0;80;48;24;24;0;1;27;15;5;2;2;0;46;0;0;6;5;11;6;8;6;6;12;3;31;0;0;2;48;0;0
2016;Nordeste;2;Pernambuco;PE;26;Arcoverde;2601201;0;Sertão Pernambucano;1;Sertão do Moxotó;4;3;3;AUTARQUIA DE ENSINO SUPERIOR DE ARCOVERDE;57;73;CENTRO DE ENSINO SUPERIOR DE ARCOVERDE;CESA;Rua Gumercindo Cavalcanti;420;PREDIO;SÃO CRISTOVÃO;56512902;58;2;5;4;5;12;5;15;6;1;3;0;0;0;0;0;0;0;1;0;1;0;0;0;0;71;70;28;42;0;1;44;18;7;24;24;0;44;2;7;9;9;9;11;4;13;8;16;2;13;0;0;39;70;0;0
2016;Sudeste;3;São Paulo;SP;35;São José do Rio Pardo;3549706;0;Campinas;7;São João da Boa Vista;30;3;3;SAO JOSE DO RIO PARDO PREFEITURA;58;74;FACULDADE DE FILOSOFIA CIÊNCIAS E LETRAS DE SÃO JOSÉ DO RIO PARDO;FFCL;Avenida Deputado Eduardo Vicente Nasser;1020;TERREO;CENTRO;13720000;53;0;0;0;1;3;1;9;8;7;11;5;4;1;3;0;0;0;0;0;0;0;0;0;0;33;33;13;20;0;0;21;6;6;0;0;0;0;33;2;6;3;4;2;8;4;4;32;1;0;0;0;0;33;0;0
2016;Sul;4;Santa Catarina;SC;42;Blumenau;4202404;0;Vale do Itajaí;4;Blumenau;12;1;7;FUNDACAO UNIVERSIDADE REGIONAL DE BLUMENAU;60;76;UNIVERSIDADE REGIONAL DE BLUMENAU;FURB;Rua Antonio da Veiga;140;;Victor Konder;89012900;577;6;8;5;15;80;148;96;79;58;48;14;18;2;0;1;1;0;1;0;1;1;1;38213;9;928;912;395;517;0;11;212;423;266;212;15;197;70;630;76;145;159;120;143;138;70;61;884;9;11;1;1;6;902;10;0
2016;Sudeste;3;Rio de Janeiro;RJ;33;Cabo Frio;3300704;0;Baixadas;4;Lagos;10;3;5;FUNDACAO EDUCACIONAL DA REGIAO DOS LAGOS;61;77;FACULDADE DA REGIÃO DOS LAGOS;FERLAGOS;Avenida Professora Júlia Kubitschek;80;;JARDIM FLAMBOYANT;28905000;20;0;0;1;1;10;6;1;0;0;1;0;0;0;0;0;0;0;0;1;1;1;1;203;0;33;33;16;17;0;0;2;23;8;6;0;6;24;3;1;1;5;3;5;6;6;6;21;0;3;0;0;9;33;0;1
2016;Sudeste;3;Espírito Santo;ES;32;Alegre;3200201;0;Sul Espírito-santense;4;Alegre;11;3;3;PREFEITURA MUNICIPAL DE ALEGRE;62;78;FACULDADE DE FILOSOFIA CIÊNCIAS E LETRAS DE ALEGRE;FAFIA;Rua Belo Amorim;100;;Centro;29500000;18;0;0;1;0;1;3;2;1;8;2;0;0;0;0;1;1;0;1;1;0;0;0;3000;0;34;34;23;11;0;0;20;10;4;7;0;7;20;7;4;7;2;2;4;7;2;6;31;0;3;0;0;0;34;0;1
2016;Sudeste;3;São Paulo;SP;35;Catanduva;3511102;0;São José do Rio Preto;1;Catanduva;5;3;7;INSTITUTO MUNICIPAL DE ENSINO SUPERIOR DE CATANDUVA;63;79;INSTITUTO MUNICIPAL DE ENSINO SUPERIOR DE CATANDUVA;IMES CATANDUVA;Av. Daniel Dalto S/N;S/N;Rodovia Washington L;Rural;15800970;31;0;0;0;2;5;6;7;8;2;1;0;0;0;0;1;1;0;0;1;1;0;1;0;0;102;100;51;49;0;0;29;48;23;2;0;2;35;63;5;24;14;12;18;6;11;10;98;1;0;0;0;1;100;0;0
2016;Sul;4;Santa Catarina;SC;42;Rio do Sul;4214805;0;Vale do Itajaí;4;Rio do Sul;11;2;7;FUNDACAO UNIVERSIDADE PARA O DESENVOLVIMENTO DO ALTO VALE DO ITAJAI - UNIDAVI -;64;80;CENTRO UNIVERSITÁRIO PARA O DESENVOLVIMENTO DO ALTO VALE DO ITAJAÍ;UNIDAVI;Rua Dr. Guilherme Gemballa;13;;Jardim América;89160000;141;19;7;3;4;17;17;26;12;24;10;1;1;0;0;1;1;0;0;0;1;0;0;2129;0;211;211;87;124;0;0;98;94;19;44;0;44;20;147;19;33;40;39;27;25;20;8;176;1;2;1;0;31;210;1;1
2016;Sul;4;Santa Catarina;SC;42;Joinville;4209102;0;Norte Catarinense;2;Joinville;8;1;5;FUNDACAO EDUCACIONAL DA REGIAO DE JOINVILLE;65;81;UNIVERSIDADE DA REGIÃO DE JOINVILLE;UNIVILLE;Rua Paulo Malschitzki;10;;Campus Universitário - Zona Industrial;89219710;436;0;0;14;14;131;32;120;34;49;13;11;8;5;5;1;1;0;1;1;1;1;1;0;8675;583;574;246;328;0;0;137;316;121;200;0;200;220;154;13;53;88;90;83;87;74;86;537;4;17;5;0;11;569;5;0
2016;Sul;4;Santa Catarina;SC;42;Joaçaba;4209003;0;Oeste Catarinense;1;Joaçaba;4;1;5;FUNDACAO UNIVERSIDADE DO OESTE DE SANTA CATARINA;66;82;UNIVERSIDADE DO OESTE DE SANTA CATARINA;UNOESC;Rua Getúlio Vargas;2125;;Flor da Serra;89600000;653;21;29;21;26;124;77;145;46;133;22;8;1;0;0;1;1;0;1;1;1;1;1;1335;1800;945;944;437;507;0;0;323;455;166;399;0;399;228;317;85;179;188;161;127;102;57;45;867;6;26;3;0;42;941;3;26
2016;Sul;4;Santa Catarina;SC;42;Itajaí;4208203;0;Vale do Itajaí;4;Itajaí;13;1;5;FUNDACAO UNIVERSIDADE DO VALE DO ITAJAI;67;83;UNIVERSIDADE DO VALE DO ITAJAÍ;UNIVALI;Rua Uruguai;458;;Centro;88302202;1115;11;15;14;23;223;202;272;150;108;35;33;16;6;7;1;1;0;1;0;1;0;1;2;268;1387;1329;614;715;0;0;308;720;301;451;0;451;699;179;77;158;215;224;199;218;132;106;1300;10;6;2;0;11;1329;0;7
2016;Sudeste;3;Rio de Janeiro;RJ;33;Macaé;3302403;0;Norte Fluminense;2;Macaé;4;3;5;FUNDACAO EDUCACIONAL LUIZ REID;68;84;FACULDADE DE FILOSOFIA CIÊNCIAS E LETRAS DE MACAÉ;FAFIMA;Rua Tenente Rui Lopes Ribeiro;200;;Centro;27910340;27;2;2;0;0;11;4;6;0;2;0;0;0;0;0;1;0;0;0;0;1;1;0;0;0;42;39;20;19;0;0;6;26;7;9;0;9;18;12;4;5;3;6;6;9;3;3;19;4;3;0;0;13;39;0;0
