NU_ANO_CENSO;NO_REGIAO_IES;CO_REGIAO_IES;NO_UF_IES;SG_UF_IES;CO_UF_IES;NO_MUNICIPIO_IES;CO_MUNICIPIO_IES;IN_CAPITAL_IES;NO_MESORREGIAO_IES;CO_MESORREGIAO_IES;NO_MICRORREGIAO_IES;CO_MICRORREGIAO_IES;TP_ORGANIZACAO_ACADEMICA;TP_CATEGORIA_ADMINISTRATIVA;NO_MANTENEDORA;CO_MANTENEDORA;CO_IES;NO_IES;SG_IES;DS_ENDERECO_IES;DS_NUMERO_ENDERECO_IES;DS_COMPLEMENTO_ENDERECO_IES;NO_BAIRRO_IES;NU_CEP_IES;QT_TEC_TOTAL;QT_TEC_FUNDAMENTAL_INCOMP_FEM;QT_TEC_FUNDAMENTAL_INCOMP_MASC;QT_TEC_FUNDAMENTAL_COMP_FEM;QT_TEC_FUNDAMENTAL_COMP_MASC;QT_TEC_MEDIO_FEM;QT_TEC_MEDIO_MASC;QT_TEC_SUPERIOR_FEM;QT_TEC_SUPERIOR_MASC;QT_TEC_ESPECIALIZACAO_FEM;QT_TEC_ESPECIALIZACAO_MASC;QT_TEC_MESTRADO_FEM;QT_TEC_MESTRADO_MASC;QT_TEC_DOUTORADO_FEM;QT_TEC_DOUTORADO_MASC;IN_ACESSO_PORTAL_CAPES;IN_ACESSO_OUTRAS_BASES;IN_ASSINA_OUTRA_BASE;IN_REPOSITORIO_INSTITUCIONAL;IN_BUSCA_INTEGRADA;IN_SERVICO_INTERNET;IN_PARTICIPA_REDE_SOCIAL;IN_CATALOGO_ONLINE;QT_PERIODICO_ELETRONICO;QT_LIVRO_ELETRONICO;QT_DOC_TOTAL;QT_DOC_EXE;QT_DOC_EX_FEMI;QT_DOC_EX_MASC;QT_DOC_EX_SEM_GRAD;QT_DOC_EX_GRAD;QT_DOC_EX_ESP;QT_DOC_EX_MEST;QT_DOC_EX_DOUT;QT_DOC_EX_INT;QT_DOC_EX_INT_DE;QT_DOC_EX_INT_SEM_DE;QT_DOC_EX_PARC;QT_DOC_EX_HOR;QT_DOC_EX_0_29;QT_DOC_EX_30_34;QT_DOC_EX_35_39;QT_DOC_EX_40_44;QT_DOC_EX_45_49;QT_DOC_EX_50_54;QT_DOC_EX_55_59;QT_DOC_EX_60_MAIS;QT_DOC_EX_BRANCA;QT_DOC_EX_PRETA;QT_DOC_EX_PARDA;QT_DOC_EX_AMARELA;QT_DOC_EX_INDIGENA;QT_DOC_EX_COR_ND;QT_DOC_EX_BRA;QT_DOC_EX_EST;QT_DOC_EX_COM_DEFICIENCIA
2014;Centro-Oeste;5;Mato Grosso;MT;51;Cuiabá;5103403;1;Centro-Sul Mato-grossense;4;Cuiabá;17;1;1;FUNDACAO UNIVERSIDADE FEDERAL DE MATO GROSSO;1;1;UNIVERSIDADE FEDERAL DE MATO GROSSO;UFMT;Avenida Fernando Correa da Costa;2367;Cidade Universitária;Boa Esperança;78060900;1603;0;0;23;92;192;231;191;159;314;236;92;52;13;8;1;1;0;0;0;0;0;0;0;0;2077;2071;988;1083;0;220;93;633;1125;2037;1635;402;34;0;215;366;367;291;200;214;209;209;736;47;281;62;2;730;2042;29;4
2014;Centro-Oeste;5;Distrito Federal;DF;53;Brasília;5300108;1;Distrito Federal;1;Brasília;1;1;1;FUNDACAO UNIVERSIDADE DE BRASILIA;2;2;UNIVERSIDADE DE BRASÍLIA;UNB;Campus Universitário Darcy Ribeiro;s/n;;Asa Norte;70910900;2623;12;52;28;76;312;350;417;383;422;349;108;74;19;21;1;1;0;0;0;0;0;0;0;0;2872;2695;1252;1443;0;91;10;412;2182;2493;2240;253;202;0;101;334;454;403;378;399;297;329;1538;53;386;56;8;624;2538;157;2
2014;Nordeste;2;Sergipe;SE;28;São Cristóvão;2806701;0;Leste Sergipano;3;Aracaju;11;1;1;FUNDACAO UNIVERSIDADE FEDERAL DE SERGIPE;3;3;UNIVERSIDADE FEDERAL DE SERGIPE;UFS;Avenida Marechal Rondon;s/n;;Jardim Rosa Elze;49100000;1059;5;59;5;25;108;210;200;191;99;64;56;34;0;3;1;1;0;0;0;0;0;0;0;0;1736;1696;804;892;0;121;83;468;1024;1461;1271;190;235;0;160;307;347;265;223;162;95;137;4;0;26;0;0;1664;1649;47;0
2014;Norte;1;Amazonas;AM;13;Manaus;1302603;1;Centro Amazonense;3;Manaus;7;1;1;FUNDACAO UNIVERSIDADE DO AMAZONAS;4;4;UNIVERSIDADE FEDERAL DO AMAZONAS;UFAM;Av. Rodrigo Otávio;6200;Campus Universitário;Coroado II;69077000;1711;9;11;3;22;200;227;215;191;397;276;90;49;9;12;1;1;0;0;0;0;0;0;0;0;1873;1725;777;948;0;174;196;596;759;1578;1267;311;147;0;181;277;303;236;250;187;128;163;373;34;1158;17;8;116;1706;19;3
2014;Nordeste;2;Piauí;PI;22;Teresina;2211001;1;Centro-Norte Piauiense;2;Teresina;3;1;1;FUNDACAO UNIVERSIDADE FEDERAL DO PIAUI;14054;5;UNIVERSIDADE FEDERAL DO PIAUÍ;UFPI;Campus Universitário Ministro Petrônio Portela;s/n;SG - 07;Ininga;64049550;1185;10;65;5;41;85;184;194;181;191;155;30;32;5;7;1;1;0;0;0;0;0;0;0;0;1790;1629;789;840;0;25;263;613;728;1487;1172;315;107;35;175;315;277;182;175;162;152;191;62;16;96;0;2;1444;1629;0;7
2014;Sudeste;3;Minas Gerais;MG;31;Ouro Preto;3146107;0;Metropolitana de Belo Horizonte;7;Ouro Preto;33;1;1;UNIVERSIDADE FEDERAL DE OURO PRETO;6;6;UNIVERSIDADE FEDERAL DE OURO PRETO;UFOP;Rua Diogo de Vasconcelos;122;;Centro;35400000;793;15;75;5;42;51;135;57;90;130;107;45;29;8;4;1;1;0;0;0;0;0;0;0;0;940;900;358;542;0;37;14;260;589;892;745;147;8;0;91;158;181;94;115;110;95;56;313;8;72;3;1;499;899;1;1
2014;Sudeste;3;São Paulo;SP;35;São Carlos;3548906;0;Araraquara;5;São Carlos;25;1;1;FUNDACAO UNIVERSIDADE FEDERAL DE SAO CARLOS;1302;7;UNIVERSIDADE FEDERAL DE SÃO CARLOS;UFSCAR;Via Washington  Luis;Km 235;S/Nº;Monjolinho;13565905;971;3;27;2;15;70;150;87;93;207;142;74;50;28;23;1;1;0;0;0;0;0;0;0;0;1363;1353;610;743;0;13;10;138;1192;1241;1147;94;112;0;65;197;250;200;191;165;119;166;1203;15;59;20;2;42;1327;26;13
2014;Sudeste;3;Minas Gerais;MG;31;Viçosa;3171303;0;Zona da Mata;12;Viçosa;62;1;1;UNIVERSIDADE FEDERAL DE VICOSA;15588;8;UNIVERSIDADE FEDERAL DE VIÇOSA;UFV;Av. P.H. Rolfs;s/n;Campus Universitário;Campus Universitário;36570000;2536;14;305;9;114;85;721;162;218;346;358;88;84;12;20;1;0;0;0;0;0;0;0;0;0;1249;1249;484;765;0;52;39;250;908;1247;1093;154;2;0;106;221;211;146;136;174;129;126;9;0;4;0;1;16;1230;19;0
2014;Sul;4;Paraná;PR;41;Londrina;4113700;0;Norte Central Paranaense;3;Londrina;11;1;2;UNIVERSIDADE ESTADUAL DO PARANA;37;9;UNIVERSIDADE ESTADUAL DE LONDRINA;UEL;Rodovia Celso Garcia Cid Pr 445 Km 380;;;Campus Universitário;86057970;1666;12;113;7;45;243;401;191;216;217;124;37;38;8;14;1;1;0;0;0;0;0;0;0;0;1907;1858;952;906;0;26;113;487;1232;1508;1179;329;245;105;83;191;244;255;287;307;241;250;255;3;15;13;0;1528;1835;23;1
2014;Sul;4;Paraná;PR;41;Curitiba;4106902;1;Metropolitana de Curitiba;10;Curitiba;37;1;5;ASSOCIACAO PARANAENSE DE CULTURA - APC;10;10;PONTIFÍCIA UNIVERSIDADE CATÓLICA DO PARANÁ;PUCPR;Rua Imaculada Conceição;1155;;Prado Velho;80215901;833;6;17;2;7;197;158;220;97;80;28;5;11;5;0;1;1;0;0;0;0;0;0;0;0;1765;1699;663;1036;0;84;250;759;606;626;0;626;544;529;82;209;276;268;271;237;153;203;447;6;17;10;1;8;1698;1;0
2014;Nordeste;2;Pernambuco;PE;26;Recife;2611606;1;Metropolitana de Recife;5;Recife;17;1;5;CENTRO DE EDUCACAO TECNICA E CULTURAL;11;11;UNIVERSIDADE CATÓLICA DE PERNAMBUCO;UNICAP;Rua do Príncipe;526;Campus Universitário;Boa Vista;50050900;450;2;14;0;10;73;90;97;82;43;31;1;6;0;1;1;1;0;0;0;0;0;0;0;0;447;440;182;258;0;0;52;217;171;165;0;165;76;199;6;25;62;52;50;62;50;133;297;13;119;1;0;5;440;0;4
2014;Sul;4;Rio Grande do Sul;RS;43;Rio Grande;4315602;0;Sudeste Rio-grandense;7;Litoral Lagunar;35;1;1;UNIVERSIDADE FEDERAL DO RIO GRANDE - FURG;15596;12;UNIVERSIDADE FEDERAL DO RIO GRANDE;FURG;Av. Itália;S/N;KM - 8;Carreiros;96201900;1243;4;29;15;22;174;181;155;117;202;127;118;66;16;17;1;1;0;0;0;0;0;0;0;0;884;812;379;433;0;43;41;175;553;792;669;123;20;0;63;125;150;117;92;109;74;82;651;13;47;5;5;91;792;20;1
2014;Sul;4;Rio Grande do Sul;RS;43;Caxias do Sul;4305108;0;Nordeste Rio-grandense;2;Caxias do Sul;16;1;5;FUNDACAO UNIVERSIDADE DE CAXIAS DO SUL;13;13;UNIVERSIDADE DE CAXIAS DO SUL;UCS;Rua Francisco Getúlio Vargas;1130;Bloco A;Petrópolis;95070560;990;11;19;15;27;258;183;240;74;90;34;18;16;3;2;1;1;0;0;0;0;0;0;0;0;1089;1078;530;548;0;0;152;582;344;374;0;374;285;419;39;132;155;186;153;165;108;140;862;2;8;0;0;206;1077;1;4
2014;Sul;4;Rio Grande do Sul;RS;43;São Leopoldo;4318705;0;Metropolitana de Porto Alegre;5;Porto Alegre;26;1;5;ASSOCIACAO ANTONIO VIEIRA;14;14;UNIVERSIDADE DO VALE DO RIO DOS SINOS;UNISINOS;Av. Unisinos;950;;Cristo Rei;93022000;1089;5;5;10;6;383;306;166;62;64;29;21;21;6;5;1;1;0;0;0;0;0;0;0;0;1094;1067;514;553;0;2;52;528;485;358;0;358;558;151;33;136;224;157;144;150;98;125;1048;12;2;0;0;4;1046;21;3
2014;Sudeste;3;Rio de Janeiro;RJ;33;Petrópolis;3303906;0;Metropolitana do Rio de Janeiro;6;Serrana;15;1;5;MITRA DIOCESANA DE PETROPOLIS;15;15;UNIVERSIDADE CATÓLICA DE PETRÓPOLIS;UCP;Rua Benjamin Constant;213;;Centro;25610130;213;3;34;6;23;33;50;32;22;4;1;4;1;0;0;1;0;0;0;0;0;0;0;0;0;207;207;75;132;0;0;31;110;66;68;0;68;37;102;12;11;28;26;27;26;20;57;198;2;6;0;0;0;203;4;5
2014;Sudeste;3;Minas Gerais;MG;31;Uberlândia;3170206;0;Triângulo Mineiro/Alto Paranaíba;5;Uberlândia;18;1;1;UNIVERSIDADE FEDERAL DE UBERLANDIA;9140;17;UNIVERSIDADE FEDERAL DE UBERLÂNDIA;UFU;Avenida João Naves de Ávila;2121;Reitoria;Santa Mônica;38408144;1851;30;91;20;50;194;287;165;149;365;267;112;89;26;6;1;1;0;0;0;0;0;0;0;0;1870;1823;792;1031;0;28;62;345;1388;1752;1543;209;37;34;101;271;358;287;236;223;159;188;1264;26;141;33;2;352;1794;29;11
2014;Sul;4;Rio Grande do Sul;RS;43;Pelotas;4314407;0;Sudeste Rio-grandense;7;Pelotas;33;1;5;SOCIEDADE PELOTENSE DE ASSISTENCIA E CULTURA(SPAC);18;18;UNIVERSIDADE CATÓLICA DE PELOTAS;UCPEL;Rua Félix da Cunha;412;;Centro;96010000;341;9;6;9;13;64;63;89;44;21;12;7;3;0;1;1;1;0;0;0;0;0;0;0;0;309;309;152;157;0;0;75;144;90;111;0;111;160;38;5;53;55;37;36;47;34;42;280;1;0;0;0;28;308;1;2
2014;Sudeste;3;São Paulo;SP;35;Campinas;3509502;0;Campinas;7;Campinas;32;1;5;SOCIEDADE CAMPINEIRA DE EDUCACAO E INSTRUCAO;19;19;PONTIFÍCIA UNIVERSIDADE CATÓLICA DE CAMPINAS;PUC-CAMPINAS;Rodovia Dom Pedro I;Km 136;Prédio da Reitoria;Parque das Universidades;13086900;1724;199;181;58;63;325;339;287;171;53;35;6;6;1;0;1;1;0;0;0;0;0;0;0;0;993;968;442;526;0;0;190;368;410;247;0;247;133;588;29;117;110;130;123;149;146;164;430;5;27;10;3;466;952;16;5
2014;Sul;4;Rio Grande do Sul;RS;43;Passo Fundo;4314100;0;Noroeste Rio-grandense;1;Passo Fundo;10;1;5;FUNDACAO UNIVERSIDADE DE PASSO FUNDO;20;20;UNIVERSIDADE DE PASSO FUNDO;UPF;Upf Campus Passo Fundo - Campus I;s/nº;BR 285 - KM 171;São José;99001970;1328;30;25;43;29;366;314;216;128;95;44;20;15;2;1;1;1;0;0;0;0;0;0;0;0;994;961;431;530;0;1;211;480;269;338;0;338;318;305;80;129;155;141;149;113;106;88;953;2;0;0;0;6;952;9;17
2014;Sul;4;Rio Grande do Sul;RS;43;Porto Alegre;4314902;1;Metropolitana de Porto Alegre;5;Porto Alegre;26;1;5;UNIAO BRASILEIRA DE EDUCACAO E ASSISTENCIA;21;21;PONTIFÍCIA UNIVERSIDADE CATÓLICA DO RIO GRANDE DO SUL;PUCRS;Av. Ipiranga;6681;;Partenon;90619900;1836;27;20;78;55;472;666;240;157;38;29;21;21;6;6;1;1;0;0;0;0;0;0;0;0;1419;1419;555;864;0;22;82;489;826;603;174;429;467;349;24;116;183;169;188;223;186;330;1381;10;20;8;0;0;1403;16;4
2014;Sudeste;3;São Paulo;SP;35;São Paulo;3550308;1;Metropolitana de São Paulo;15;São Paulo;61;1;5;INSTITUTO PRESBITERIANO MACKENZIE;22;22;UNIVERSIDADE PRESBITERIANA MACKENZIE;MACKENZIE;Rua da Consolação;896;Campus São Paulo;Consolação;1302907;1730;21;70;26;66;389;506;311;191;58;49;14;22;1;6;1;1;0;0;0;0;0;0;0;0;1267;1267;484;783;0;0;55;508;704;480;0;480;213;574;15;55;170;153;204;222;171;277;1045;12;120;48;1;9;1222;45;5
2014;Sul;4;Rio Grande do Sul;RS;43;Novo Hamburgo;4313409;0;Metropolitana de Porto Alegre;5;Porto Alegre;26;1;5;ASSOCIACAO PRO ENSINO SUPERIOR EM NOVO HAMBURGO;23;23;UNIVERSIDADE FEEVALE;FEEVALE;Rua 239;nº 2755;;VILA  NOVA;93352000;856;13;3;16;13;293;210;115;71;66;31;18;6;1;0;1;1;0;0;0;0;0;0;0;0;572;565;316;249;0;0;57;353;155;176;0;176;369;20;20;96;115;108;102;64;28;32;547;4;4;0;0;4;563;2;1
2014;Nordeste;2;Bahia;BA;29;Ilhéus;2913606;0;Sul Baiano;7;Ilhéus-Itabuna;31;1;2;UNIVERSIDADE ESTADUAL DE SANTA CRUZ;24;24;UNIVERSIDADE ESTADUAL DE SANTA CRUZ;UESC;KM 16 DA RODOVIA ILHÉUS ITABUNA;S/N;;Salobrinho;45662900;428;0;15;1;6;66;91;121;65;32;17;10;4;0;0;1;0;0;0;0;0;0;0;0;0;809;755;368;387;0;14;56;226;459;739;561;178;16;0;23;74;112;139;146;103;75;83;32;2;30;0;1;670;728;27;0
2014;Sudeste;3;Rio de Janeiro;RJ;33;Rio de Janeiro;3304557;1;Metropolitana do Rio de Janeiro;6;Rio de Janeiro;18;3;1;FUNDACAO INSTIT BRAS DE GEOGRAFIA E ESTATISTICA IBGE;26;26;ESCOLA NACIONAL DE CIÊNCIAS ESTATÍSTICAS;ENCE;Rua André Cavalcanti;106;;Santa Teresa;20231050;96;0;0;0;0;5;13;7;7;5;6;11;10;19;13;1;0;0;0;0;0;0;0;0;0;66;65;32;33;0;0;1;23;41;44;0;44;21;0;5;10;11;10;2;7;8;12;57;1;6;1;0;0;64;1;0
2014;Sudeste;3;Minas Gerais;MG;31;Três Corações;3169307;0;Sul/Sudoeste de Minas;10;Varginha;50;1;5;FUNDACAO COMUNITARIA TRICORDIANA DE EDUCACAO;27;27;UNIVERSIDADE VALE DO RIO VERDE;UNINCOR;Av. Castelo Branco;82;;Chácara das Rosas;37410000;342;20;17;19;18;61;29;67;23;22;21;25;15;5;0;1;1;0;0;0;0;0;0;0;0;220;220;96;124;0;0;98;91;31;83;6;77;27;110;15;48;33;40;28;28;11;17;145;6;43;0;0;14;220;0;0
2014;Nordeste;2;Ceará;CE;23;Fortaleza;2304400;1;Metropolitana de Fortaleza;3;Fortaleza;16;1;2;FUNDACAO UNIVERSIDADE ESTADUAL DO CEARA FUNECE;29;29;UNIVERSIDADE ESTADUAL DO CEARÁ;UECE;Av. Dr. Silas Munguba;1700;Campus Universitário;Serrinha;60740000;873;31;91;31;38;186;187;128;96;31;29;8;11;3;3;1;0;0;0;0;0;0;0;0;0;1203;1192;583;609;0;87;121;459;525;1117;550;567;1;74;128;140;152;135;163;138;125;211;15;0;5;0;0;3;1189;3;0
2014;Sudeste;3;Minas Gerais;MG;31;Alfenas;3101607;0;Sul/Sudoeste de Minas;10;Alfenas;49;1;5;FUNDACAO DE ENSINO E TECNOLOGIA DE ALFENAS;30;30;UNIVERSIDADE JOSÉ DO ROSÁRIO VELLANO;UNIFENAS;Rodovia Mg 179 - Km 0;s/n;;Campus Universitário;37130000;786;47;148;33;79;126;110;91;83;38;21;6;3;0;1;1;1;0;0;0;0;0;0;0;0;620;617;319;298;0;0;222;250;145;236;1;235;184;197;17;82;140;113;102;69;39;55;20;2;11;0;0;7;616;1;0
2014;Sudeste;3;Minas Gerais;MG;31;Belo Horizonte;3106200;1;Metropolitana de Belo Horizonte;7;Belo Horizonte;30;3;2;FUNDACAO DE EDUCACAO PARA O TRABALHO DE MINAS GERAIS;31;31;CENTRO DE EDUCAÇÃO TÉCNICA DA UTRAMIG;UTRAMIG;Avenida Afonso Pena;3400;;CRUZEIRO;30130009;322;0;0;8;1;22;26;163;84;4;3;5;6;0;0;0;0;0;0;0;0;0;0;0;0;9;7;5;2;0;0;2;5;0;0;0;0;0;7;0;1;1;0;0;2;2;1;2;1;1;0;0;1;7;0;0
2014;Nordeste;2;Alagoas;AL;27;Maceió;2704302;1;Leste Alagoano;3;Maceió;11;1;2;UNIVERSIDADE ESTADUAL DE CIENCIAS DA SAUDE DE ALAGOAS - UNCISAL;32;32;UNIVERSIDADE ESTADUAL DE CIÊNCIAS DA SAÚDE DE ALAGOAS - UNCISAL;UNCISAL;Rua Jorge de Lima;113;;Trapiche da Barra;57010300;572;0;0;3;14;148;71;112;77;64;33;20;14;11;5;0;0;0;0;0;0;0;0;0;0;272;269;163;106;0;0;102;120;47;114;0;114;155;0;17;41;54;43;35;36;24;19;120;5;84;3;0;49;269;0;2
2014;Sudeste;3;São Paulo;SP;35;Sorocaba;3552205;0;Macro Metropolitana Paulista;12;Sorocaba;46;3;2;CENTRO ESTADUAL DE EDUCACAO TECNOLOGICA PAULA SOUZA;33;33;FACULDADE DE TECNOLOGIA DE SOROCABA;FATEC SO;AVENIDA ENGENHEIRO CARLOS REINALDO MENDES;2.015;;ALTO DA BOA VISTA;18013280;45;2;3;1;2;9;6;17;3;2;0;0;0;0;0;0;0;0;0;0;0;0;0;0;0;130;129;30;99;0;21;25;56;27;65;21;44;58;6;1;9;8;17;25;16;29;24;80;3;3;1;0;22;129;0;0
2014;Sudeste;3;São Paulo;SP;35;São Paulo;3550308;1;Metropolitana de São Paulo;15;São Paulo;61;3;2;CENTRO ESTADUAL DE EDUCACAO TECNOLOGICA PAULA SOUZA;33;34;FACULDADE DE TECNOLOGIA DE SÃO PAULO;FATEC-SP;Praça Coronel Fernando Prestes;30;;BOM RETIRO;1124060;121;5;2;2;1;51;19;29;12;0;0;0;0;0;0;0;0;0;0;0;0;0;0;0;0;281;278;88;190;0;49;45;107;77;121;36;85;128;29;5;13;12;22;38;57;43;88;215;3;11;35;0;5;274;4;1
2014;Sudeste;3;São Paulo;SP;35;Americana;3501608;0;Campinas;7;Campinas;32;3;2;CENTRO ESTADUAL DE EDUCACAO TECNOLOGICA PAULA SOUZA;33;35;FACULDADE DE TECNOLOGIA DE AMERICANA;FATEC-AM;Rua Emílio de Menezes;s/n;;Vila Amorim;13469111;32;0;0;1;0;6;6;13;4;2;0;0;0;0;0;0;0;0;0;0;0;0;0;0;0;118;118;32;86;0;18;19;62;19;34;14;20;76;8;9;18;10;15;19;20;20;7;99;0;3;2;0;4;117;1;2
2014;Sudeste;3;São Paulo;SP;35;Santos;3548500;0;Metropolitana de São Paulo;15;Santos;63;3;2;CENTRO ESTADUAL DE EDUCACAO TECNOLOGICA PAULA SOUZA;33;36;FACULDADE DE TECNOLOGIA RUBENS LARA;FATEC-BS;Avenida Bartolomeu de Gusmão;110;;APARECIDA;11045908;28;0;0;0;3;2;5;6;10;1;1;0;0;0;0;0;0;0;0;0;0;0;0;0;0;62;62;20;42;0;5;12;35;10;0;0;0;0;62;1;5;5;5;12;13;10;11;39;2;1;0;0;8;62;0;0
2014;Sudeste;3;São Paulo;SP;35;Jaú;3525300;0;Bauru;4;Jaú;21;3;2;CENTRO ESTADUAL DE EDUCACAO TECNOLOGICA PAULA SOUZA;33;37;FACULDADE DE TECNOLOGIA DE JAHU;FATEC-JAHU;Rua Frei Galvão;S/N;;JARDIM PEDRO OMETTO;17212599;34;0;0;1;0;4;4;9;6;5;5;0;0;0;0;0;0;0;0;0;0;0;0;0;0;86;84;31;53;0;5;19;45;15;43;30;13;32;9;2;6;15;14;18;15;7;7;78;0;0;1;0;3;83;1;0
2014;Norte;1;Pará;PA;15;Belém;1501402;1;Metropolitana de Belém;3;Belém;7;1;2;UNIVERSIDADE DO ESTADO DO PARA UEP;34;38;UNIVERSIDADE DO ESTADO DO PARÁ;UEPA;Travessa Djalma Dutra;S/N;;Telégrafo Sem Fio;66113010;1572;17;29;67;73;431;470;236;116;82;18;22;7;3;1;1;1;0;0;0;0;0;0;0;0;1323;1250;671;579;0;17;387;568;278;960;114;846;68;222;102;187;193;185;203;148;125;107;219;35;474;1;1;448;1250;0;5
2014;Nordeste;2;Bahia;BA;29;Salvador;2927408;1;Metropolitana de Salvador;5;Salvador;21;1;2;UNIVERSIDADE DO ESTADO DA BAHIA;36;40;UNIVERSIDADE DO ESTADO DA BAHIA;UNEB;Rua Silveira Martins;2555;;Cabula;41150000;1199;0;0;1;2;186;284;346;144;174;39;16;3;2;2;1;1;0;0;0;0;0;0;0;0;2561;2327;1394;933;0;26;650;1107;544;1640;769;871;57;630;111;321;418;412;420;273;183;189;261;128;332;7;1;608;2323;4;18
2014;Sul;4;Santa Catarina;SC;42;Florianópolis;4205407;1;Grande Florianópolis;5;Florianópolis;16;1;2;FUNDACAO UNIVERSIDADE DO ESTADO DE SC UDESC;39;43;FUNDAÇÃO UNIVERSIDADE DO ESTADO DE SANTA CATARINA;UDESC;Avenida Madre Benvenuta;1907;Campus I;Itacorubi;88035001;797;16;27;101;125;146;125;47;31;66;39;47;22;2;3;1;1;0;0;0;0;0;0;0;0;1239;1189;537;652;0;43;76;455;615;654;406;248;80;455;107;189;219;212;148;156;86;72;722;9;17;4;0;427;1184;5;1
2014;Centro-Oeste;5;Goiás;GO;52;Anápolis;5201108;0;Centro Goiano;3;Anápolis;7;1;2;UNIVERSIDADE ESTADUAL DE GOIAS;42;47;UNIVERSIDADE ESTADUAL DE GOIÁS;UEG;BR 153;S/N;KM 98 (Campus);Zona Rural;75000000;1775;25;31;127;80;343;185;488;178;204;105;3;5;0;1;1;0;0;0;0;0;0;0;0;0;2219;2067;1165;902;0;195;966;609;297;570;288;282;1479;18;312;375;384;325;248;196;116;111;428;48;184;13;1;1373;2063;4;4
2014;Sudeste;3;São Paulo;SP;35;Campinas;3509502;0;Campinas;7;Campinas;32;1;2;ESTADO DE SAO PAULO;46;54;UNIVERSIDADE ESTADUAL DE CAMPINAS;UNICAMP;"Cidade Universitária ""Zeferino Vaz""";S/N;;Distrito de Barão Geraldo;13081970;4547;23;107;66;196;623;845;1075;856;246;162;140;98;57;53;1;1;0;0;0;0;0;0;0;0;1962;1910;690;1220;5;25;4;34;1842;1723;1706;17;187;0;10;111;189;201;217;301;400;481;1802;9;26;35;2;12;1813;97;8
2014;Sudeste;3;São Paulo;SP;35;São Paulo;3550308;1;Metropolitana de São Paulo;15;São Paulo;61;1;2;UNIVERSIDADE DE SAO PAULO;15715;55;UNIVERSIDADE DE SÃO PAULO;USP;Rua da Reitoria;109;Cidade Universitária;Butantã;5508900;17661;240;884;259;619;3305;4282;2506;1913;1305;665;555;361;461;306;1;1;0;0;0;0;0;0;0;0;6435;6360;2420;3940;0;1;0;64;6295;6108;5423;685;252;0;19;266;645;826;893;1092;1015;1604;5805;18;110;259;2;155;6078;282;1
2014;Sudeste;3;São Paulo;SP;35;São Paulo;3550308;1;Metropolitana de São Paulo;15;São Paulo;61;1;2;ESTADO DE SAO PAULO;46;56;UNIVERSIDADE ESTADUAL PAULISTA JÚLIO DE MESQUITA FILHO;UNESP;Rua Quirino de Andrade;215;;Centro;1049010;6946;26;184;141;336;910;1547;1529;1274;479;241;112;72;57;38;1;1;0;0;0;0;0;0;0;0;4331;4293;1805;2488;0;11;4;304;3974;3693;3690;3;238;362;236;455;504;498;609;711;643;637;1140;6;38;47;0;2862;4189;104;3
2014;Sul;4;Paraná;PR;41;Maringá;4115200;0;Norte Central Paranaense;3;Maringá;9;1;2;UNIVERSIDADE ESTADUAL DO PARANA;37;57;UNIVERSIDADE ESTADUAL DE MARINGÁ;UEM;Avenida Colombo;5790;Campus Universitário;Zona 7;87020900;1631;4;105;18;54;205;323;177;166;261;157;64;47;33;17;1;1;0;0;0;0;0;0;0;0;1775;1606;793;813;0;65;53;429;1059;1546;1354;192;60;0;135;250;196;198;242;246;193;146;11;0;0;1;0;1588;1584;22;0
2014;Sudeste;3;São Paulo;SP;35;São Bernardo do Campo;3548708;0;Metropolitana de São Paulo;15;São Paulo;61;3;3;PREFEITURA DO MUNICIPIO DE SAO BERNARDO DO CAMPO;48;58;FACULDADE DE DIREITO DE SÃO BERNARDO DO CAMPO;FDSBC;Rua Java;425;;JARDIM DO MAR;9750650;115;1;3;1;0;18;14;43;17;8;8;0;1;0;1;0;1;0;0;0;0;0;0;0;0;65;60;23;37;0;0;2;25;33;0;0;0;0;60;4;6;11;10;10;11;2;6;15;0;0;0;0;37;60;0;0
2014;Sudeste;3;São Paulo;SP;35;Franca;3516200;0;Ribeirão Preto;2;Franca;12;3;7;FACULDADE DE DIREITO DE FRANCA;49;59;FACULDADE DE DIREITO DE FRANCA;FDF;Avenida Major Nicácio;2377;;SÃO JOSÉ;14401135;17;0;0;0;1;5;3;3;0;1;1;0;2;1;0;1;1;0;0;0;0;0;0;0;0;34;34;4;30;0;0;0;25;9;10;4;6;24;0;0;0;0;4;1;9;4;16;33;0;0;0;0;1;34;0;0
2014;Sudeste;3;São Paulo;SP;35;Franca;3516200;0;Ribeirão Preto;2;Franca;12;2;7;CENTRO UNIVERSITARIO DE FRANCA;2234;60;CENTRO UNIVERSITÁRIO DE FRANCA;UNI-FACEF;Avenida Major Nicácio;2433;;SÃO JOSÉ;14401135;33;1;1;0;0;0;3;9;5;7;3;1;3;0;0;1;1;0;0;0;0;0;0;0;0;93;92;47;45;0;0;4;51;37;32;16;16;28;32;2;9;13;12;10;16;13;17;82;0;0;1;0;6;92;0;0
2014;Sudeste;3;São Paulo;SP;35;Piracicaba;3538709;0;Piracicaba;6;Piracicaba;28;3;3;FUNDACAO MUNICIPAL DE ENSINO DE PIRACICABA;52;67;ESCOLA DE ENGENHARIA DE PIRACICABA;EEP/FUMEP;Avenida Monsenhor Martinho Salgot;560;;Areião;13414040;81;0;0;2;0;11;13;20;15;6;8;1;3;0;2;0;0;0;0;0;0;0;0;0;0;138;130;23;107;0;15;15;57;43;0;0;0;8;122;7;13;17;11;19;20;19;24;88;0;4;1;0;27;129;1;1
2014;Sudeste;3;São Paulo;SP;35;Penápolis;3537305;0;Araçatuba;3;Birigui;18;3;5;FUNDACAO EDUCACIONAL DE PENAPOLIS;53;68;FACULDADE DE FILOSOFIA CIÊNCIAS E LETRAS DE PENÁPOLIS;FAFIPE;AV SÃO JOSÉ;400;;VILA MARTINS;16300000;91;0;0;0;0;8;12;12;19;4;8;5;13;5;5;1;1;0;0;0;0;0;0;0;0;48;46;21;25;0;1;14;22;9;0;0;0;1;45;8;9;6;7;5;5;2;4;37;0;7;0;0;1;46;0;0
2014;Nordeste;2;Rio Grande do Norte;RN;24;Mossoró;2408003;0;Oeste Potiguar;1;Mossoró;1;1;2;UNIVERSIDADE DO ESTADO DO RIO GRANDE DO NORTE - UERN;55;71;UNIVERSIDADE DO ESTADO DO RIO GRANDE DO NORTE;UERN;Rua Almino Afonso;478;SEDE DA REITORIA;CENTRO;59610210;1053;0;0;51;56;111;274;86;114;187;138;15;17;3;1;1;1;0;0;0;0;0;0;0;0;1072;918;403;515;0;76;245;355;242;769;416;353;149;0;92;178;186;156;121;82;45;58;361;20;416;0;1;120;907;11;0
2014;Nordeste;2;Pernambuco;PE;26;Palmares;2610004;0;Mata Pernambucana;4;Mata Meridional Pernambucana;15;3;3;AUTARQUIA EDUCACIONAL DA MATA SUL;56;72;FACULDADE DE FORMAÇÃO DE PROFESSORES DA MATA SUL;FAMASUL;Br 101 Km 186 Sul;S/N;;ENGENHO SAO MANOEL;55540000;185;0;0;7;15;30;41;14;17;14;17;10;13;5;2;0;0;0;0;0;0;0;0;0;0;61;57;24;33;0;0;29;22;6;0;0;0;0;57;3;3;8;8;9;12;6;8;13;2;38;0;0;1;57;0;0
2014;Nordeste;2;Pernambuco;PE;26;Arcoverde;2601201;0;Sertão Pernambucano;1;Sertão do Moxotó;4;3;3;AUTARQUIA DE ENSINO SUPERIOR DE ARCOVERDE;57;73;CENTRO DE ENSINO SUPERIOR DE ARCOVERDE;CESA;Rua Gumercindo Cavalcanti;420;PREDIO;SÃO CRISTOVÃO;56512902;36;0;0;0;0;7;4;16;9;0;0;0;0;0;0;1;0;0;0;0;0;0;0;0;0;66;65;32;33;0;0;36;23;6;0;0;0;0;65;3;7;11;10;7;11;9;7;20;2;10;0;0;13;65;0;1
2014;Sudeste;3;São Paulo;SP;35;São José do Rio Pardo;3549706;0;Campinas;7;São João da Boa Vista;30;3;3;SAO JOSE DO RIO PARDO PREFEITURA;58;74;FACULDADE DE FILOSOFIA CIÊNCIAS E LETRAS DE SÃO JOSÉ DO RIO PARDO;FFCL;Avenida Deputado Eduardo Vicente Nasser;1020;TERREO;CENTRO;13720000;21;0;0;0;1;3;2;9;6;0;0;0;0;0;0;0;0;0;0;0;0;0;0;0;0;40;39;19;20;0;3;22;10;4;3;3;0;0;36;3;4;7;4;7;4;3;7;35;1;0;0;0;2;39;0;0
2014;Sul;4;Santa Catarina;SC;42;Blumenau;4202404;0;Vale do Itajaí;4;Blumenau;12;1;7;FUNDACAO UNIVERSIDADE REGIONAL DE BLUMENAU;60;76;UNIVERSIDADE REGIONAL DE BLUMENAU;FURB;Rua Antonio da Veiga;140;;Victor Konder;89012900;564;6;22;13;12;100;104;92;79;56;43;15;18;1;3;1;0;0;0;0;0;0;0;0;0;946;921;387;534;0;6;242;452;221;283;21;262;4;634;83;152;146;132;146;129;74;59;886;7;15;2;3;7;906;15;2
2014;Sudeste;3;Rio de Janeiro;RJ;33;Cabo Frio;3300704;0;Baixadas;4;Lagos;10;3;5;FUNDACAO EDUCACIONAL DA REGIAO DOS LAGOS;61;77;FACULDADE DA REGIÃO DOS LAGOS;FERLAGOS;Avenida Professora Júlia Kubitschek;80;;JARDIM FLAMBOYANT;28905000;20;0;0;1;0;2;2;5;3;4;2;1;0;0;0;1;0;0;0;0;0;0;0;0;0;41;41;17;24;0;0;7;25;9;2;0;2;35;4;1;3;5;6;9;5;7;5;26;0;4;0;0;10;41;0;2
2014;Sudeste;3;Espírito Santo;ES;32;Alegre;3200201;0;Sul Espírito-santense;4;Alegre;11;3;3;PREFEITURA MUNICIPAL DE ALEGRE;62;78;FACULDADE DE FILOSOFIA CIÊNCIAS E LETRAS DE ALEGRE;FAFIA;Rua Belo Amorim;100;;Centro;29500000;22;0;0;1;0;0;3;2;0;11;4;1;0;0;0;0;0;0;0;0;0;0;0;0;0;44;44;27;17;0;0;23;17;4;10;0;10;14;20;5;10;4;3;6;7;5;4;36;0;4;0;0;4;44;0;0
2014;Sudeste;3;São Paulo;SP;35;Catanduva;3511102;0;São José do Rio Preto;1;Catanduva;5;3;7;INSTITUTO MUNICIPAL DE ENSINO SUPERIOR DE CATANDUVA;63;79;INSTITUTO MUNICIPAL DE ENSINO SUPERIOR DE CATANDUVA;IMES CATANDUVA;Av. Daniel Dalto S/N;S/N;Rodovia Washington L;Rural;15800970;41;0;0;5;4;10;5;11;3;2;1;0;0;0;0;1;1;0;0;0;0;0;0;0;0;125;123;64;59;0;0;37;64;22;2;0;2;35;86;17;27;18;13;17;9;10;12;110;1;1;0;0;0;122;1;1
2014;Sul;4;Santa Catarina;SC;42;Rio do Sul;4214805;0;Vale do Itajaí;4;Rio do Sul;11;2;7;FUNDACAO UNIVERSIDADE PARA O DESENVOLVIMENTO DO ALTO VALE DO ITAJAI - UNIDAVI -;64;80;CENTRO UNIVERSITÁRIO PARA O DESENVOLVIMENTO DO ALTO VALE DO ITAJAÍ;UNIDAVI;Rua Dr. Guilherme Gemballa;13;;Jardim América;89160000;131;17;7;0;3;18;16;30;10;18;10;1;1;0;0;1;0;0;0;0;0;0;0;0;0;224;224;100;124;0;0;114;92;18;46;0;46;16;162;29;29;44;35;32;30;16;9;173;1;4;0;0;46;222;2;1
2014;Sul;4;Santa Catarina;SC;42;Joinville;4209102;0;Norte Catarinense;2;Joinville;8;1;7;FUNDACAO EDUCACIONAL DA REGIAO DE JOINVILLE;65;81;UNIVERSIDADE DA REGIÃO DE JOINVILLE;UNIVILLE;Rua Paulo Malschitzki;10;;Campus Universitário - Zona Industrial;89219710;364;3;3;20;11;54;37;131;24;51;13;9;6;2;0;1;1;0;0;0;0;0;0;0;0;605;589;254;335;0;0;169;300;120;202;0;202;250;137;24;65;93;84;83;93;75;72;12;0;0;0;0;574;586;3;0
2014;Sul;4;Santa Catarina;SC;42;Joaçaba;4209003;0;Oeste Catarinense;1;Joaçaba;4;1;7;FUNDACAO UNIVERSIDADE DO OESTE DE SANTA CATARINA;66;82;UNIVERSIDADE DO OESTE DE SANTA CATARINA;UNOESC;Rua Getúlio Vargas;2125;;Flor da Serra;89600000;584;14;7;24;12;140;72;149;39;109;13;4;1;0;0;1;1;0;0;0;0;0;0;0;0;967;959;430;529;0;0;401;438;120;332;0;332;221;406;97;181;198;170;122;99;54;38;864;5;29;4;0;54;955;4;26
2014;Sul;4;Santa Catarina;SC;42;Itajaí;4208203;0;Vale do Itajaí;4;Itajaí;13;1;5;FUNDACAO UNIVERSIDADE DO VALE DO ITAJAI;67;83;UNIVERSIDADE DO VALE DO ITAJAÍ;UNIVALI;Rua Uruguai;458;;Centro;88302202;929;8;13;22;22;220;167;188;108;85;27;35;24;6;4;1;1;0;0;0;0;0;0;0;0;1320;1250;591;659;0;0;342;656;252;377;0;377;620;253;79;145;215;219;203;204;96;89;1208;6;13;3;0;20;1250;0;3
2014;Sudeste;3;Rio de Janeiro;RJ;33;Macaé;3302403;0;Norte Fluminense;2;Macaé;4;3;5;FUNDACAO EDUCACIONAL LUIZ REID;68;84;FACULDADE DE FILOSOFIA CIÊNCIAS E LETRAS DE MACAÉ;FAFIMA;Rua Tenente Rui Lopes Ribeiro;200;;Centro;27910340;28;0;0;3;2;11;4;5;0;3;0;0;0;0;0;1;0;0;0;0;0;0;0;0;0;44;39;18;21;0;0;7;26;6;7;1;6;20;12;3;7;4;5;6;7;4;3;24;3;2;1;0;5;39;0;0
