2016;Sudeste;3;São Paulo;SP;35;São Paulo;3550308;1;Metropolitana de São Paulo;15;São Paulo;61;3;5;ASSOCIACAO JOAO MEINBERG DE ENSINO DE SAO PAULO;14876;1190;FACULDADE INTEGRAL CANTAREIRA;F.I.C.;Rua Marcos Arruda;729;;Belenzinho;3020000;35;0;0;0;0;4;7;8;6;1;2;2;1;3;1;1;1;0;0;0;1;1;1;237;201;71;67;27;40;0;0;1;41;25;26;0;26;31;10;1;2;14;11;12;13;10;4;63;1;0;2;0;1;66;1;0
2016;Nordeste;2;Ceará;CE;23;Fortaleza;2304400;1;Metropolitana de Fortaleza;3;Fortaleza;16;3;5;ASSOCIACAO INTEGRADA DE ENSINO SUPERIOR DO NORDESTE;808;1191;INSTITUTO DE ENSINO SUPERIOR DE FORTALEZA;IESF;Rua Dona Leopoldina;912;;Centro;60110001;14;0;0;1;1;2;2;3;2;2;0;1;0;0;0;0;1;0;1;1;1;1;0;2800;5000;45;45;29;16;0;0;11;23;11;10;1;9;20;15;4;15;9;5;1;3;2;6;3;0;38;0;0;4;45;0;0
2016;Sudeste;3;São Paulo;SP;35;São Paulo;3550308;1;Metropolitana de São Paulo;15;São Paulo;61;3;4;CENTRO DE ENSINO SUPERIOR DE HOMEOPATIA IBEHE S/S LTDA - EPP;809;1192;FACULDADE DE CIÊNCIAS DA SAÚDE DE SÃO PAULO;FACIS;Rua Bartolomeu de Gusmão;86;;Vila Mariana;4111020;13;2;1;1;0;3;2;3;1;0;0;0;0;0;0;0;0;0;0;1;1;1;1;20;0;12;12;6;6;0;0;1;2;9;0;0;0;2;10;0;1;2;3;0;2;2;2;10;0;2;0;0;0;12;0;0
2016;Centro-Oeste;5;Mato Grosso do Sul;MS;50;Ponta Porã;5006606;0;Sudoeste de Mato Grosso do Sul;4;Dourados;10;3;4;ASSOCIACAO EDUCACIONAL ESGAIB KAYATT;777;1194;FACULDADE DE TECNOLOGIA DE PONTA PORÃ;FATEP;Rua Antônio João;1675;;Centro;79900000;9;0;1;0;0;2;0;3;2;0;0;1;0;0;0;0;0;0;0;1;1;1;1;842;8659;12;12;6;6;0;0;6;4;2;1;0;1;6;5;2;1;4;1;0;4;0;0;10;0;1;0;1;0;12;0;0
2016;Sudeste;3;São Paulo;SP;35;São Caetano do Sul;3548807;0;Metropolitana de São Paulo;15;São Paulo;61;3;5;SERVICO NACIONAL DE APRENDIZAGEM INDUSTRIAL;796;1195;FACULDADE SENAI DE TECNOLOGIA MECATRÔNICA;SENAI;Rua Niterói;180;;Centro;9510200;9;0;0;0;1;0;1;1;1;1;2;0;1;0;1;0;1;0;0;0;0;0;0;0;0;26;25;1;24;0;0;8;14;3;21;16;5;4;0;0;1;2;5;4;6;6;1;21;0;1;0;0;3;24;1;1
2016;Sul;4;Paraná;PR;41;Maringá;4115200;0;Norte Central Paranaense;3;Maringá;9;2;4;CESUMAR - CENTRO DE ENSINO SUPERIOR DE MARINGA LTDA;560;1196;CENTRO UNIVERSITÁRIO DE MARINGÁ - UNICESUMAR;UNICESUMAR;Avenida Guedner;1610;;Jardim Aclimação;87050390;1812;65;53;67;72;397;343;378;194;120;54;39;23;5;2;1;1;0;1;1;1;1;1;1132;4200;466;466;270;196;0;0;26;287;153;284;0;284;180;2;37;109;101;82;48;52;16;21;383;3;7;6;0;67;466;0;0
2016;Sul;4;Paraná;PR;41;Curitiba;4106902;1;Metropolitana de Curitiba;10;Curitiba;37;3;4;SOCIEDADE EDUCACIONAL DE CIENCIAS E TECNOLOGIA SC - ME;810;1198;FACULDADE DE CIÊNCIAS SOCIAIS E APLICADAS DO PARANÁ;FACET;Rua Marechal Floriano Peixoto;470;;Centro;80010130;14;0;0;0;0;2;2;6;2;2;0;0;0;0;0;0;0;0;0;0;1;0;1;0;0;27;27;7;20;0;0;5;20;2;0;0;0;8;19;2;6;5;6;3;2;1;2;24;0;1;0;0;2;27;0;0
2016;Sudeste;3;Minas Gerais;MG;31;Nova Lima;3144805;0;Metropolitana de Belo Horizonte;7;Belo Horizonte;30;3;5;CENTRO EDUCACIONAL DE FORMACAO SUPERIOR - CEFOS;414;1201;FACULDADE DE ADMINISTRAÇÃO MILTON CAMPOS;FAMC;Alameda da Serra;61;;Vila da Serra;34000000;158;6;11;6;11;25;29;39;22;3;1;1;0;1;3;0;1;0;0;0;1;0;1;1;0;55;45;20;25;0;0;8;33;4;5;0;5;11;29;1;6;3;8;7;8;3;9;35;1;9;0;0;0;45;0;0
2016;Sudeste;3;Minas Gerais;MG;31;Conselheiro Lafaiete;3118304;0;Metropolitana de Belo Horizonte;7;Conselheiro Lafaiete;34;3;4;ENTIDADE MANTENEDORA DE ENSINO - SANTA RITA LTDA;813;1202;FACULDADE SANTA RITA;FASAR;ESTRADA REAL KM 2;S/N;CAIXA POSTAL 26;Rodovia;36400000;69;4;2;1;5;12;14;13;2;3;2;4;4;1;2;0;0;0;0;0;1;1;1;0;0;88;88;42;46;0;0;14;57;17;9;0;9;55;24;7;19;22;13;8;9;7;3;24;1;5;0;0;58;88;0;0
2016;Centro-Oeste;5;Mato Grosso do Sul;MS;50;Amambai;5000609;0;Sudoeste de Mato Grosso do Sul;4;Dourados;10;3;5;ASSOCIACAO EDUCACIONAL DE AMAMBAI;814;1204;FACULDADE DE AMAMBAI;FIAMA;Rua Padre Anchieta;202;;Vila Copacabana;79990000;9;1;0;1;0;3;1;1;1;0;1;0;0;0;0;0;0;0;0;0;1;0;0;842;8659;18;12;8;4;0;0;4;7;1;8;0;8;4;0;3;1;3;2;2;1;0;0;8;0;1;0;1;2;12;0;0
2016;Sul;4;Paraná;PR;41;Lapa;4113205;0;Metropolitana de Curitiba;10;Lapa;36;3;4;SOCIEDADE TECNICA EDUCACIONAL DA LAPA S/A;815;1205;FACULDADE EDUCACIONAL DA LAPA;FAEL;Rodovia Olívio Belich Km 30;s/n;Pr 476;Boqueirão;83750000;682;0;0;10;6;103;30;202;78;133;32;44;25;12;7;0;0;0;0;1;1;0;1;176;3621;109;109;79;30;0;0;40;48;21;22;0;22;82;5;4;14;23;25;10;14;9;10;89;2;4;1;0;13;109;0;3
2016;Nordeste;2;Rio Grande do Norte;RN;24;Natal;2408102;1;Leste Potiguar;4;Natal;18;3;4;ANEC - SOCIEDADE NATALENSE DE EDUCACAO E CULTURA LTDA;816;1208;FAL ESTÁCIO - FACULDADE ESTÁCIO DE NATAL;;Rua Henrique Dias;s/n;;Igapó;59104300;38;0;0;0;0;13;10;0;5;4;2;2;2;0;0;0;1;0;0;1;1;0;1;35000;4800;67;67;37;30;0;0;31;28;8;7;0;7;21;39;3;11;13;16;9;7;5;3;31;2;7;0;0;27;67;0;0
2016;Sudeste;3;São Paulo;SP;35;Assis;3504008;0;Assis;10;Assis;39;3;5;INSTITUTO EDUCACIONAL DE ASSIS IEDA;484;1212;FACULDADE DE CIÊNCIAS CONTÁBEIS DE ASSIS;FCCA;Avenida Doutor Dória;260;;Vila Ouro Verde;19816230;16;0;0;0;0;4;8;3;1;0;0;0;0;0;0;1;1;0;1;1;1;1;1;245;5000;6;6;1;5;0;0;3;2;1;1;0;1;3;2;0;0;3;3;0;0;0;0;5;0;0;0;0;1;6;0;0
2016;Sudeste;3;São Paulo;SP;35;Campinas;3509502;0;Campinas;7;Campinas;32;3;5;SOCIEDADE EDUCACIONAL FLEMING;819;1213;FACULDADE FLEMING;SEF;Rua Dona Maria Uumbelina Couto;58;;Bairro Guanabara;13090110;13;0;0;1;3;2;2;5;0;0;0;0;0;0;0;0;0;0;0;0;1;1;0;842;8659;39;32;14;18;0;0;17;11;4;4;0;4;9;19;1;3;3;1;4;7;7;6;30;0;0;0;0;2;32;0;0
2016;Sudeste;3;São Paulo;SP;35;Itapetininga;3522307;0;Itapetininga;11;Itapetininga;42;3;5;CENTRO INT DE ESTUDOS SUP PESQ E TECNOLOGIA-CIESPT;823;1219;INSTITUTO ITAPETININGANO DE ENSINO SUPERIOR;IIES;Rua Izolina de Morais Rosa;727;;Vila Nastri;18206320;26;0;1;0;0;7;10;4;3;1;0;0;0;0;0;0;0;0;0;1;1;0;1;250;9456;63;63;21;42;0;0;39;18;6;8;0;8;55;0;6;14;13;9;5;5;5;6;57;0;0;2;0;4;63;0;1
2016;Sudeste;3;São Paulo;SP;35;Paraguaçu Paulista;3535507;0;Assis;10;Assis;39;3;5;FUNDACAO GAMMON DE ENSINO;229;1221;FACULDADE GAMMON;;Rua Prefeito Jayme Monteiro;791;;Centro;19700000;39;2;5;0;8;3;5;16;0;0;0;0;0;0;0;0;1;0;0;0;1;1;1;0;0;37;36;11;25;0;2;16;4;14;2;1;1;18;16;1;5;8;5;6;2;3;6;33;0;2;0;0;1;36;0;0
2016;Sudeste;3;São Paulo;SP;35;Jales;3524808;0;São José do Rio Preto;1;Jales;1;2;5;ASSOCIACAO EDUCACIONAL DE JALES;291;1224;CENTRO UNIVERSITÁRIO DE JALES;UNIJALES;Avenida Francisco Jalles;1851;;Centro;15700000;42;8;7;0;4;2;0;5;5;8;3;0;0;0;0;0;0;0;1;1;1;1;1;321;464;67;65;37;28;0;0;37;24;4;23;0;23;38;4;4;10;16;7;9;7;5;7;51;1;1;1;0;11;65;0;0
2016;Sudeste;3;São Paulo;SP;35;Amparo;3501905;0;Campinas;7;Amparo;33;2;4;UNISEPE UNIAO DAS INSTITUICOES DE SERVICO, ENSINO E PESQUISA LTDA;715;1225;CENTRO UNIVERSITÁRIO AMPARENSE;UNIFIA;Rodovia Sp 95, Km 46,5;s/n;;Martírio;13900000;32;0;1;3;4;5;4;6;4;2;3;0;0;0;0;0;0;0;0;0;1;1;0;0;0;85;85;45;40;0;0;41;32;12;24;19;5;7;54;8;15;18;10;14;16;1;3;83;1;0;0;0;1;85;0;0
2016;Norte;1;Acre;AC;12;Rio Branco;1200401;1;Vale do Acre;2;Rio Branco;4;3;4;SOCIEDADE DE ENSINO SUPERIOR DO ACRE LTDA;801;1226;INSTITUTO DE ENSINO SUPERIOR DO ACRE;IESACRE;Travessa Ponta Porã;100;;José Augusto;69910100;1;0;0;0;0;0;0;1;0;0;0;0;0;0;0;0;1;0;0;0;1;0;1;729;0;66;66;20;46;0;0;19;29;18;21;0;21;33;12;6;10;19;8;8;5;2;8;15;2;31;1;0;17;64;2;0
2016;Nordeste;2;Bahia;BA;29;Barreiras;2903201;0;Extremo Oeste Baiano;1;Barreiras;1;3;5;INSTITUTO AVANCADO DE ENSINO SUPERIOR DE BARREIRAS - IAESB;824;1227;FACULDADE SÃO FRANCISCO DE BARREIRAS - FASB;FASB;Avenida São Desidério;2440;;Ribeirão;47808180;152;2;18;11;25;32;33;12;9;8;2;0;0;0;0;0;1;0;0;1;1;0;1;32;4921;110;110;58;52;0;0;62;40;8;55;0;55;8;47;17;37;20;16;8;5;1;6;54;2;49;1;0;4;109;1;0
2016;Sudeste;3;São Paulo;SP;35;Espírito Santo do Pinhal;3515186;0;Campinas;7;São João da Boa Vista;30;2;5;FUNDACAO PINHALENSE DE ENSINO;179;1230;CENTRO REGIONAL UNIVERSITÁRIO DE ESPÍRITO SANTO DO PINHAL;UNIPINHAL;Avenida Hélio Vergueiro Leite;s/n;;Jardim Universitário;13990000;33;0;0;0;1;6;2;11;13;0;0;0;0;0;0;0;0;0;1;0;1;0;1;8;0;245;156;65;91;0;0;42;82;32;10;0;10;53;93;8;27;26;25;19;16;14;21;147;0;2;2;0;5;155;1;2
2016;Sul;4;Rio Grande do Sul;RS;43;Santo Ângelo;4317509;0;Noroeste Rio-grandense;1;Santo Ângelo;7;3;5;CAMPANHA NACIONAL DE ESCOLAS DA COMUNIDADE;407;1231;INSTITUTO CENECISTA DE ENSINO SUPERIOR DE SANTO ÂNGELO;CNEC/IESA;Rua Professor Doutor João Augusto Rodrigues;471;;Harmonia;98801015;49;0;0;8;5;9;6;8;4;7;1;0;1;0;0;0;0;0;0;1;1;1;1;105;1;82;78;41;37;0;0;6;61;11;13;0;13;35;30;6;13;12;8;12;18;6;3;73;1;1;0;0;3;78;0;1
2016;Sul;4;Paraná;PR;41;Curitiba;4106902;1;Metropolitana de Curitiba;10;Curitiba;37;2;5;ASSOCIACAO DE ENSINO VERSALHES;495;1232;CENTRO UNIVERSITÁRIO CAMPOS DE ANDRADE;UNIANDRADE;Rua Marumby;283;;Campo Comprido;81220090;154;0;1;3;1;43;28;36;27;6;4;2;2;1;0;1;1;0;0;1;1;1;1;400;6600;159;146;81;65;0;0;13;84;49;57;10;47;86;3;17;31;19;18;14;13;13;21;115;0;3;0;1;27;146;0;0
2016;Centro-Oeste;5;Mato Grosso;MT;51;Cuiabá;5103403;1;Centro-Sul Mato-grossense;4;Cuiabá;17;2;5;UNIAO EDUCACIONAL CANDIDO RONDON - UNIRONDON LTDA;631;1233;CENTRO UNIVERSITÁRIO CÂNDIDO RONDON;UNIRONDON;Avenida Manoel José de Arruda;3001;;Jardim Europa;78065780;72;3;1;5;2;20;15;10;8;4;2;0;1;1;0;0;1;0;1;1;1;0;1;24951;7250;124;121;51;70;0;0;59;55;7;19;0;19;62;40;13;24;22;24;13;6;16;3;59;8;49;1;0;4;121;0;6
2016;Centro-Oeste;5;Goiás;GO;52;Aparecida de Goiânia;5201405;0;Centro Goiano;3;Goiânia;10;3;5;ASSOCIACAO EDUCACIONAL NOSSA SENHORA APARECIDA - AENSA;827;1237;FACULDADE NOSSA SENHORA APARECIDA;FANAP;AV. PEDRO LUIZ RIBEIRO QD. 01, LT. 01;1;CHÁCARA SANTO ANTÔNI;CONJUNTO BELA MORADA;74920760;54;1;5;6;7;6;7;15;3;0;2;1;1;0;0;0;0;0;1;0;1;0;1;35;0;61;61;28;33;0;0;7;38;16;17;0;17;37;7;3;7;11;11;8;11;8;2;43;2;11;1;0;4;61;0;1
2016;Centro-Oeste;5;Goiás;GO;52;Goiânia;5208707;1;Centro Goiano;3;Goiânia;10;3;4;SOCIEDADE DE EDUCACAO E CULTURA DE GOIANIA LTDA;828;1239;FACULDADE PADRÃO;PADRAO;Rua Arapongas;70;;Jardim Vila Boa;74360210;16;0;0;0;0;0;0;5;2;3;4;1;0;1;0;1;1;0;1;1;1;1;1;7000;4000;68;68;41;27;0;0;21;39;8;9;0;9;36;23;3;10;11;14;6;7;8;9;44;0;10;0;0;14;68;0;1
2016;Sudeste;3;Espírito Santo;ES;32;Cariacica;3201308;0;Central Espírito-santense;3;Vitória;9;3;5;ASS. DE ENSINO INTEGRADO E ORGANIZADO UNIVERSITARIO;829;1240;FACULDADE DE ESTUDOS SOCIAIS DO ESPÍRITO SANTO;PIO XII;Rua Bolivar de Abreu;48;;Campo Grande;29146330;30;1;1;1;3;5;9;5;1;2;2;0;0;0;0;1;1;0;1;1;1;1;1;110;0;31;31;11;20;0;0;10;18;3;3;0;3;28;0;2;4;10;3;1;6;1;4;23;2;5;0;0;1;31;0;0
2016;Sudeste;3;Espírito Santo;ES;32;Serra;3205002;0;Central Espírito-santense;3;Vitória;9;3;5;INSTITUTO ENSINAR BRASIL;218;1243;Faculdade Doctum de Administração da Serra;DOCTUM;Rua 1d;80;;CIVIT II;29165157;70;4;5;3;2;14;14;8;1;5;4;4;5;1;0;0;0;0;0;0;1;1;1;0;0;32;32;9;23;0;0;12;11;9;0;0;0;31;1;0;4;5;7;8;6;1;1;21;2;6;0;0;3;32;0;0
2016;Sudeste;3;Espírito Santo;ES;32;Vitória;3205309;1;Central Espírito-santense;3;Vitória;9;3;4;EMPRESA BRASILEIRA DE ENSINO PESQUISA E EXTENSAO S.A. - EMBRAE;832;1244;FACULDADE BRASILEIRA;MULTIVIX VITÓRIA;Rua José Alves;301;;Goiabeiras;29075080;258;10;7;10;11;73;40;34;31;7;7;15;7;4;2;0;0;0;0;0;1;1;0;555;60;184;184;105;79;0;0;27;127;30;29;0;29;118;37;12;43;42;39;11;19;7;11;142;3;27;1;0;11;184;0;0
2016;Sudeste;3;Espírito Santo;ES;32;Castelo;3201407;0;Sul Espírito-santense;4;Cachoeiro de Itapemirim;12;3;4;INSTITUTO DE ENSINO SUPERIOR DO ESPIRITO SANTO - IESES;833;1245;Faculdade de Castelo - Multivix Castelo;Multivix Castelo;Avenida Nicanor Marques;245;;Centro;29360000;28;0;5;0;0;11;2;3;0;5;0;0;2;0;0;0;0;0;0;0;1;1;1;130;55;43;43;23;20;0;0;10;26;7;5;0;5;19;19;3;13;16;5;5;1;0;0;36;1;6;0;0;0;43;0;0
2016;Sudeste;3;Espírito Santo;ES;32;Vitória;3205309;1;Central Espírito-santense;3;Vitória;9;3;5;ASSOCIACAO SOCIEDADE BRASILEIRA DE INSTRUCAO;134;1246;FACULDADE CANDIDO MENDES DE VITÓRIA;FCMV;Avenida Leitão da Silva;2055;;Itararé;29045914;12;1;1;0;3;1;1;0;1;3;1;0;0;0;0;0;0;0;0;0;0;1;0;0;0;10;7;1;6;0;0;3;4;0;0;0;0;0;7;0;2;1;1;1;2;0;0;3;1;2;0;0;1;7;0;0
2016;Centro-Oeste;5;Mato Grosso do Sul;MS;50;Nova Andradina;5006200;0;Leste de Mato Grosso do Sul;3;Nova Andradina;8;3;5;ASSOCIACAO EDUCACIONAL DO CONE SUL;1782;1247;FACULDADE DE CIÊNCIAS CONTÁBEIS DE NOVA ANDRADINA - FACINAN;FACINAN;Avenida Antônio Joaquim de Moura Andrade;910;;Centro;79750000;18;3;4;0;0;3;2;4;2;0;0;0;0;0;0;0;0;0;0;0;1;1;1;842;8659;35;35;17;18;0;0;23;9;3;3;0;3;32;0;6;8;7;5;3;4;1;1;25;1;6;0;0;3;35;0;0
2016;Centro-Oeste;5;Mato Grosso do Sul;MS;50;Nova Andradina;5006200;0;Leste de Mato Grosso do Sul;3;Nova Andradina;8;3;5;ASSOCIACAO NOVANDRADINENSE DE EDUCACAO E CULTURA;834;1248;FACULDADE DE PEDAGOGIA;ANAEC;Avenida Eurico Soares Andrade;730;;Centro;79750000;9;1;0;0;0;1;1;2;1;2;1;0;0;0;0;0;0;0;0;1;1;0;0;1;0;18;18;13;5;0;0;8;9;1;4;3;1;11;3;2;2;4;1;5;2;0;2;13;0;3;0;0;2;18;0;0
2016;Centro-Oeste;5;Mato Grosso do Sul;MS;50;Costa Rica;5003256;0;Leste de Mato Grosso do Sul;3;Cassilândia;5;3;4;EVAIR GOMES NOGUEIRA - ME;835;1249;FACULDADE DE EDUCAÇÃO DE COSTA RICA;FECRA;Rua Ambrosina Paes Coelho;1054;;Centro;79550000;10;0;0;1;0;3;0;2;0;2;1;1;0;0;0;0;0;0;0;0;1;1;0;127;127;21;21;15;6;0;0;10;11;0;4;1;3;12;5;2;2;4;1;4;5;1;2;16;1;0;0;0;4;21;0;0
2016;Sudeste;3;Minas Gerais;MG;31;Belo Horizonte;3106200;1;Metropolitana de Belo Horizonte;7;Belo Horizonte;30;3;5;ASSOCIACAO EDUCATIVA DO BRASIL - SOEBRAS;1509;1252;FACULDADE PROMOVE DE MINAS GERAIS;PROMOVE;AVENIDA JOÃO PINHEIRO;164;;CENTRO;30130180;120;3;0;6;11;30;23;25;12;4;1;1;2;1;1;0;0;0;0;1;1;1;0;5;5;35;35;18;17;0;0;0;23;12;18;0;18;9;8;0;3;6;10;3;5;3;5;27;0;1;0;0;7;35;0;0
2016;Sudeste;3;Minas Gerais;MG;31;Juiz de Fora;3136702;0;Zona da Mata;12;Juiz de Fora;65;3;5;INSTITUTO METODISTA GRANBERY;838;1253;FACULDADE METODISTA GRANBERY;FMG;Rua Batista de Oliveira;1.145;;Granbery;36010530;99;2;8;3;8;21;10;22;9;10;3;1;2;0;0;0;0;0;0;0;1;0;1;20;6589;88;85;39;46;0;0;17;55;13;13;0;13;23;49;3;4;15;17;19;11;7;9;77;0;3;0;0;5;85;0;1
2016;Sudeste;3;Minas Gerais;MG;31;Itabirito;3131901;0;Metropolitana de Belo Horizonte;7;Ouro Preto;33;3;5;FUNDACAO JOSE BONIFACIO LAFAYETTE DE ANDRADA;220;1254;FACULDADE DE ADMINISTRAÇÃO DE ITABIRITO;FAI;Rua Matozinhos;293;;Matozinhos;35450000;6;0;0;0;0;2;2;0;0;2;0;0;0;0;0;0;1;0;0;1;1;1;1;14000;7100;7;7;6;1;0;0;2;5;0;0;0;0;0;7;0;1;2;3;0;1;0;0;2;0;2;0;0;3;7;0;0
2016;Nordeste;2;Pernambuco;PE;26;Recife;2611606;1;Metropolitana de Recife;5;Recife;17;3;4;FBV - FACULDADE BOA VIAGEM S.A.;14488;1255;FACULDADE BOA VIAGEM;FBV;Avenida Jean Emile Favre;422;;Imbiribeira;51190540;167;2;5;6;12;47;53;20;10;8;3;1;0;0;0;0;1;0;1;1;1;0;0;800;0;231;231;118;113;0;0;14;163;54;140;0;140;84;7;9;54;59;41;22;19;11;16;111;4;116;0;0;0;231;0;0
2016;Sul;4;Paraná;PR;41;Cascavel;4104808;0;Oeste Paranaense;6;Cascavel;23;3;4;CENTRO DE ENSINO SUPERIOR DE CASCAVEL LTDA;840;1256;FACULDADE DOM BOSCO;DOM BOSCO;Avenida das Torres;500;;Loteamento FAG;85806095;9;1;0;2;0;1;0;2;0;0;0;0;3;0;0;0;0;0;0;1;1;1;0;0;0;47;47;26;21;0;0;17;23;7;8;0;8;9;30;5;11;7;8;6;6;3;1;36;1;2;0;0;8;47;0;0
2016;Sul;4;Paraná;PR;41;Curitiba;4106902;1;Metropolitana de Curitiba;10;Curitiba;37;3;5;ASSOC EDUC DAS IGREJAS EV ASSEMBL DE DEUS NO EST DO PAR;841;1257;FACULDADE DE ADMINISTRAÇÃO, CIÊNCIAS, EDUCAÇÃO E LETRAS;FACEL;Av. Vicente Machado, 156 Centro;156;;Centro;80420010;58;0;0;1;2;13;9;14;10;4;5;0;0;0;0;1;1;0;1;1;1;0;1;36;300;60;60;36;24;0;0;14;39;7;5;0;5;30;25;5;13;8;8;10;5;5;6;31;0;3;2;0;24;59;1;1
2016;Sul;4;Paraná;PR;41;Cascavel;4104808;0;Oeste Paranaense;6;Cascavel;23;3;4;ANHANGUERA EDUCACIONAL LTDA;2600;1258;FACULDADE DE CASCAVEL;;Avenida Brasil;7210;;Centro;85810000;44;0;0;0;0;4;6;10;6;12;5;0;0;0;1;0;1;0;1;1;1;1;1;24951;7250;97;97;57;40;0;0;63;29;5;11;0;11;44;42;9;26;21;14;14;10;2;1;75;6;8;3;0;5;97;0;1
2016;Sudeste;3;Rio de Janeiro;RJ;33;Rio de Janeiro;3304557;1;Metropolitana do Rio de Janeiro;6;Rio de Janeiro;18;3;4;CENTRO DE FORMACAO PROFISSIONAL BEZERRA DE ARAUJO LTDA.;845;1263;FACULDADE BEZERRA DE ARAÚJO;FABA;Rua Viúva Dantas;501;;Campo Grande;23052090;26;1;2;3;1;7;3;5;0;3;1;0;0;0;0;0;1;0;0;1;0;1;1;0;0;65;65;42;23;0;0;14;41;10;1;0;1;15;49;3;4;10;14;12;8;6;8;17;2;3;0;0;43;65;0;0
2016;Nordeste;2;Rio Grande do Norte;RN;24;Natal;2408102;1;Leste Potiguar;4;Natal;18;2;5;LIGA DE ENSINO DO RIO GRANDE DO NORTE;846;1264;CENTRO UNIVERSITÁRIO DO RIO GRANDE DO NORTE;UNI-RN;Rua Prefeita Eliane Barros;2000;;Tirol;59014540;117;0;0;2;8;18;20;22;24;16;7;0;0;0;0;0;1;0;0;1;1;0;1;6360;4332;212;191;96;95;0;0;27;117;47;87;23;64;104;0;14;32;38;43;24;11;11;18;149;2;29;0;0;11;191;0;5
2016;Sudeste;3;São Paulo;SP;35;Pereira Barreto;3537404;0;Araçatuba;3;Andradina;16;3;5;ASSOCIACAO DE ENSINO E CULTURA URUBUPUNGA AECU;178;1266;FACULDADES INTEGRADAS URUBUPUNGÁ;FIU;Avenida Coronel Jonas Alves de Mello;1.660;Térreo;Centro;15370000;34;0;0;0;1;4;1;9;4;9;6;0;0;0;0;1;0;0;0;1;1;1;1;3;0;28;28;15;13;0;0;8;14;6;9;0;9;19;0;3;5;3;6;2;2;1;6;24;0;2;1;0;1;28;0;0
2016;Sul;4;Santa Catarina;SC;42;São José;4216602;0;Grande Florianópolis;5;Florianópolis;16;3;5;ASSOCIACAO DE ENSINO SUPERIOR DA GRANDE FLORIANOPOLIS - AESGF;847;1267;INSTITUTO DE ENSINO SUPERIOR DA GRANDE FLORIANÓPOLIS;IESGF;Rua Vereador Walter Borges;424;;Campinas;88101030;51;4;0;3;1;22;7;7;3;3;1;0;0;0;0;0;0;0;0;1;1;0;1;250;9874;112;96;49;47;0;0;32;55;9;16;0;16;70;10;14;21;25;20;5;6;2;3;90;3;0;0;0;3;95;1;1
2016;Sudeste;3;São Paulo;SP;35;Ribeirão Preto;3543402;0;Ribeirão Preto;2;Ribeirão Preto;14;2;4;UNISEB UNIAO DOS CURSOS SUPERIORES SEB LTDA;848;1270;CENTRO UNIVERSITÁRIO ESTÁCIO DE RIBEIRÃO PRETO;ESTÁCIO RIBEIRÃO PRE;Rua Abrahão Issa Halack, 980, Ribeirânia.;980;;Ribeirânia;14096160;206;0;0;1;1;40;26;62;43;21;8;2;2;0;0;1;1;0;0;1;1;0;1;35000;4800;225;218;106;112;0;0;25;125;68;60;0;60;101;57;12;34;55;45;34;23;9;6;209;2;3;3;0;1;216;2;0
2016;Sudeste;3;São Paulo;SP;35;Salto;3545209;0;Macro Metropolitana Paulista;12;Sorocaba;46;3;5;INSTITUTO SANTANENSE DE ENSINO SUPERIOR;316;1272;FACULDADE SANT'ANNA DE SALTO;FASAS;Avenida Tranquilo Gianini;801;;Saída 44 da Rodovia Santos Dumont;13320000;2;0;0;0;0;0;0;1;0;0;0;0;1;0;0;0;0;0;1;1;1;0;1;350;500;1;1;0;1;0;0;0;1;0;1;1;0;0;0;0;0;0;0;0;0;0;1;1;0;0;0;0;0;1;0;0
2016;Sudeste;3;São Paulo;SP;35;Campo Limpo Paulista;3509601;0;Macro Metropolitana Paulista;12;Jundiaí;47;3;4;INSTITUTO DE ENSINO CAMPO LIMPO PAULISTA LTDA;849;1273;FACULDADE CAMPO LIMPO PAULISTA;FACCAMP;Rua Guatemala;167;;Jardim América;13231230;223;7;10;10;10;52;33;43;16;27;13;1;0;0;1;1;1;0;0;0;1;0;1;7;260;191;191;67;124;0;0;69;69;53;48;0;48;64;79;14;16;22;26;29;35;19;30;61;0;0;0;0;130;185;6;0
2016;Sudeste;3;São Paulo;SP;35;Guarujá;3518701;0;Metropolitana de São Paulo;15;Santos;63;3;5;INSTITUTO EDUCACIONAL DO ESTADO DE SAO PAULO - IESP;289;1275;FACULDADE DO GUARUJÁ;FAGU;Avenida Adhemar de Barros;820;;Jd Santo Antonio;11431120;33;1;1;0;2;10;2;7;0;3;4;2;1;0;0;0;0;0;1;0;1;1;0;842;8659;52;40;16;24;0;0;18;19;3;4;0;4;11;25;0;3;9;9;4;5;3;7;32;0;6;1;0;1;40;0;0
2016;Sudeste;3;São Paulo;SP;35;Taubaté;3554102;0;Vale do Paraíba Paulista;13;São José dos Campos;50;3;5;"ASSOCIACAO DE ENSINO SAO JOSE DOS CAMPOS ""AESJC""";851;1276;INSTITUTO TAUBATÉ DE ENSINO SUPERIOR;I.T.E.S.;Rua Bahia;44;;Jardim dos Estados;12062100;30;4;0;1;0;6;8;3;0;6;2;0;0;0;0;0;0;0;0;1;1;0;1;350;9874;41;41;22;19;0;1;12;23;5;8;0;8;13;20;2;8;4;4;5;8;3;7;36;1;3;1;0;0;40;1;1
2016;Sudeste;3;São Paulo;SP;35;Itápolis;3522703;0;Araraquara;5;Araraquara;24;3;4;ASSOCIACAO EDUCACIONAL E CULTURAL DE ITAPOLIS LTDA - EPP;853;1279;FACULDADE DE ITÁPOLIS - FACITA;FACITA;Rua Mário de Souza Castro;200;;Santa Mônica;14900000;16;0;1;0;0;0;0;0;2;7;2;2;2;0;0;0;1;0;0;1;1;1;1;62;0;25;25;16;9;0;0;7;15;3;8;0;8;3;14;1;3;2;7;1;5;2;4;25;0;0;0;0;0;25;0;0
2016;Sudeste;3;São Paulo;SP;35;Cotia;3513009;0;Metropolitana de São Paulo;15;Itapecerica da Serra;60;3;4;IREP SOCIEDADE DE ENSINO SUPERIOR, MEDIO E FUNDAMENTAL LTDA.;545;1280;Faculdade Estácio Cotia;Estácio FAAC;Rua Howard Archibaldi Acheson Júnior;393;;Jardim da Glória;6711280;8;0;0;0;0;6;0;2;0;0;0;0;0;0;0;0;1;0;0;1;1;0;1;35000;4800;18;17;13;4;0;0;3;6;8;1;0;1;5;11;0;0;5;4;2;2;1;3;14;0;1;0;0;2;17;0;1
2016;Sudeste;3;São Paulo;SP;35;Itapeva;3522406;0;Itapetininga;11;Itapeva;41;3;4;SOCIEDADE CULTURAL E EDUCACIONAL DE ITAPEVA S/S LTDA;855;1281;FACULDADE DE CIÊNCIAS SOCIAIS E AGRÁRIAS DE ITAPEVA;FAIT;Rodovia Francisco Alves Negrão (SP 258);Km 285;;Pilão d'Água;18412000;51;0;0;0;0;10;9;0;2;5;3;5;4;10;3;1;1;0;1;1;1;1;1;356;40;55;55;23;32;0;0;9;22;24;15;12;3;40;0;6;12;11;5;10;5;4;2;53;0;1;0;0;1;55;0;0
2016;Sudeste;3;São Paulo;SP;35;São Bernardo do Campo;3548708;0;Metropolitana de São Paulo;15;São Paulo;61;3;5;SERVICO NACIONAL DE APRENDIZAGEM INDUSTRIAL;796;1286;FACULDADE SENAI DE TECNOLOGIA AMBIENTAL;SENAI;Avenida José Odorizzi;1555;;Assunção;9861000;6;0;0;0;0;0;0;3;0;1;2;0;0;0;0;1;0;0;1;1;1;1;1;0;8;20;20;7;13;0;0;3;10;7;1;0;1;0;19;0;0;2;4;4;6;3;1;17;2;1;0;0;0;18;2;0
2016;Sudeste;3;São Paulo;SP;35;São Paulo;3550308;1;Metropolitana de São Paulo;15;São Paulo;61;3;5;FUNDACAO ARMANDO ALVARES PENTEADO;320;1289;FACULDADE DE DIREITO DA FUNDAÇÃO ARMANDO ALVARES PENTEADO;FAD-FAAP;Rua Alagoas;903;PRÉDIO 2;HIGIENÓPOLIS;1242902;12;0;0;0;0;2;1;1;2;5;0;1;0;0;0;1;1;0;0;1;1;0;1;20954;2500;68;67;21;46;0;2;7;29;29;2;0;2;5;60;1;3;8;15;6;7;13;14;63;0;0;1;0;3;67;0;0
2016;Sudeste;3;São Paulo;SP;35;São Paulo;3550308;1;Metropolitana de São Paulo;15;São Paulo;61;3;4;CETTAA - CENTRO DE EDUCACAO TECNICA E TECNOLOGICA ALVARES DE AZEVEDO LTDA;2744;1290;Faculdade Álvares de Azevedo;FAATESP;Avenida Paulista;302/306;Conjuntos 10,50,60,7;Bela Vista;1310000;15;0;0;0;0;8;0;6;0;1;0;0;0;0;0;0;0;0;0;0;0;0;1;0;0;12;12;7;5;0;0;5;5;2;1;0;1;5;6;0;1;3;2;2;2;1;1;8;0;0;0;0;4;12;0;1
2016;Sul;4;Paraná;PR;41;Santo Antônio da Platina;4124103;0;Norte Pioneiro Paranaense;4;Jacarezinho;16;3;4;CETEC - CENTRO EDUCACIONAL TECNOLOGICO DE ENSINO E CULTURALTDA;860;1291;FACULDADE DO NORTE PIONEIRO;FANORPI;Rodovia Br 153, Km 40;s/n;;Pq. de Exposições Dr. Alício Dias dos Reis;86430000;22;1;0;2;2;2;0;2;0;9;2;0;2;0;0;1;0;0;0;0;1;0;0;842;8659;35;34;12;22;0;0;17;15;2;6;0;6;10;18;1;7;9;5;6;2;3;1;33;0;0;1;0;0;33;1;0
2016;Sudeste;3;São Paulo;SP;35;Adamantina;3500105;0;Presidente Prudente;8;Adamantina;35;2;7;FACULDADES ADAMANTINENSES INTEGRADAS;15990;1292;Centro Universitário de Adamantina;FAI;Rua Nove de Julho;730/40;;CENTRO;17800000;195;0;1;2;3;42;32;57;44;5;4;1;2;1;1;0;1;0;0;0;0;0;1;0;0;247;225;88;137;0;17;50;94;64;84;0;84;47;94;17;29;32;37;30;26;22;32;213;1;1;1;0;9;225;0;1
2016;Sudeste;3;São Paulo;SP;35;São Paulo;3550308;1;Metropolitana de São Paulo;15;São Paulo;61;3;4;SOCIEDADE EDUCACIONAL DAS AMERICAS LTDA;862;1294;FACULDADE DAS AMÉRICAS;FAM;Rua Augusta;1520;1508 a;Consolação;1305100;117;0;0;0;0;7;12;29;24;16;10;10;3;4;2;1;1;0;1;1;1;0;1;4980;12588;175;175;63;112;0;0;14;93;68;37;15;22;132;6;4;15;37;32;33;27;9;18;116;1;8;4;1;45;174;1;2
2016;Sudeste;3;São Paulo;SP;35;São Paulo;3550308;1;Metropolitana de São Paulo;15;São Paulo;61;3;4;ORGANIZACAO EDUCACIONAL MORUMBI SUL LTDA - EPP;863;1295;FACULDADE DE EDUCAÇÃO E TECNOLOGIA IRACEMA;;Avenida Nossa Senhora do Bom Conselho;351;;Campo Limpo;5763470;11;0;0;1;1;3;1;1;1;1;1;1;0;0;0;0;0;0;0;1;0;1;0;0;0;15;15;3;12;0;0;2;9;4;1;0;1;14;0;1;0;5;1;3;4;1;0;7;2;4;0;0;2;15;0;0
2016;Nordeste;2;Pernambuco;PE;26;Recife;2611606;1;Metropolitana de Recife;5;Recife;17;3;5;SOCIEDADE RECIFENSE DE ESTUDOS DE CIENCIAS HUMANAS;864;1296;ESCOLA SUPERIOR DE MARKETING;ESM;Rua Benfica;126;;Madalena;50720001;13;0;3;0;1;1;1;5;2;0;0;0;0;0;0;0;0;0;0;0;1;0;1;0;326;29;28;12;16;0;0;14;11;3;7;0;7;8;13;0;6;5;9;2;1;2;3;9;0;18;0;0;1;28;0;0
2016;Nordeste;2;Alagoas;AL;27;Maceió;2704302;1;Leste Alagoano;3;Maceió;11;3;4;IREP SOCIEDADE DE ENSINO SUPERIOR, MEDIO E FUNDAMENTAL LTDA.;545;1298;Faculdade Estácio de Alagoas - Estácio FAL;ESTÁCIO FAL;Rua Pio XII;355;;Jatiúca;57035560;55;0;0;0;0;10;13;20;6;3;1;1;1;0;0;1;1;0;0;1;1;0;1;35000;4800;171;170;116;54;0;0;59;82;29;16;0;16;116;38;18;35;41;28;19;17;3;9;144;5;20;0;0;1;167;3;1
2016;Sudeste;3;São Paulo;SP;35;Fernandópolis;3515509;0;São José do Rio Preto;1;Fernandópolis;2;3;5;FUNDACAO EDUCACIONAL DE FERNANDOPOLIS;492;1299;FACULDADES INTEGRADAS DE FERNANDÓPOLIS;FIFE;Avenida Teotônio Vilela;s/n;;Campus Universitário;15600000;105;3;3;5;2;21;10;25;21;10;5;0;0;0;0;0;1;0;0;0;1;1;0;0;3680;182;176;101;75;0;0;66;88;22;27;0;27;67;82;14;36;33;28;30;17;13;5;49;0;2;1;0;124;176;0;1
2016;Sudeste;3;São Paulo;SP;35;Taquaritinga;3553708;0;Ribeirão Preto;2;Jaboticabal;13;3;5;FUNDACAO EDUCACIONAL DE TAQUARITINGA - FETAQ;867;1300;INSTITUTO TAQUARITINGUENSE DE ENSINO SUPERIOR DR. ARISTIDES DE CARVALHO SCHLOBACH;ITES;Praça Doutor Horacio Ramalho;159;e nº 187;Centro;15900000;4;0;0;0;0;4;0;0;0;0;0;0;0;0;0;0;0;0;0;0;1;0;0;0;3090;54;54;30;24;0;2;17;19;16;2;2;0;19;33;13;12;9;9;2;3;2;4;39;0;0;0;0;15;53;1;0
2016;Sudeste;3;São Paulo;SP;35;Matão;3529302;0;Araraquara;5;Araraquara;24;3;5;SOCIEDADE EDUCACIONAL DE JAU LTDA;2395;1301;INSTITUTO MATONENSE MUNICIPAL DE ENSINO SUPERIOR;IMMES;Avenida Tiradentes;629;;Centro;15990185;7;0;0;0;0;2;0;4;0;0;0;1;0;0;0;1;0;0;1;1;1;1;0;180;0;27;27;9;18;0;0;8;13;6;1;1;0;17;9;2;4;9;7;1;3;1;0;26;1;0;0;0;0;27;0;0
2016;Nordeste;2;Bahia;BA;29;Salvador;2927408;1;Metropolitana de Salvador;5;Salvador;21;3;5;CRUZADA MARANATA DE EVANGELIZACAO;869;1302;FACULDADE BATISTA BRASILEIRA;FBB;Rua Altino Serbeto de Barros;174;;Pituba;41830492;46;2;2;1;0;12;12;7;7;2;0;0;0;1;0;0;1;0;0;1;1;1;1;5000;20000;60;60;36;24;0;0;7;50;3;10;0;10;45;5;3;6;10;6;11;14;6;4;16;4;30;0;0;10;60;0;0
2016;Centro-Oeste;5;Goiás;GO;52;Goiânia;5208707;1;Centro Goiano;3;Goiânia;10;4;1;INSTITUTO FEDERAL DE EDUCACAO, CIENCIA E TECNOLOGIA GOIANO;16657;1303;INSTITUTO FEDERAL DE EDUCAÇÃO, CIÊNCIA E TECNOLOGIA GOIANO;IF Goiano;Rua 88, Esquina com a Rua 88 D, Quadra  F37, Lotes 32, 34  e 36;32, 34 e 3;;Setor Sul;75790000;651;0;4;0;2;29;64;86;77;150;133;58;45;3;0;1;1;0;0;1;1;1;1;100000;104000;359;346;138;208;0;1;20;138;187;345;329;16;0;1;36;90;94;53;32;28;10;3;211;10;96;2;1;26;345;1;1
2016;Sudeste;3;São Paulo;SP;35;Ribeirão Pires;3543303;0;Metropolitana de São Paulo;15;São Paulo;61;3;5;ORGANIZACAO EDUCACIONAL DE RIBEIRAO PIRES;124;1304;FACULDADES INTEGRADAS DE RIBEIRÃO PIRES;FIRP;Rua Coronel Oliveira Lima;3345;;Parque Aliança;9404100;44;8;0;4;4;9;6;5;3;2;0;1;2;0;0;0;0;0;0;1;1;0;1;156;3528;60;59;24;35;0;0;28;28;3;7;0;7;24;28;2;4;12;10;7;11;5;8;24;3;4;0;1;27;59;0;0
