2016;Nordeste;2;Paraíba;PB;25;João Pessoa;2507507;1;Mata Paraibana;4;João Pessoa;22;3;4;IDEZ EMPREENDIMENTOS EDUCACIONAIS LTDA.;3547;4094;Faculdade Estácio da Paraíba;ESTÁCIO PARAÍBA;Avenida Governador Flávio Ribeiro Coutinho;115;;Manaíra;58037000;8;0;0;0;0;5;1;0;0;1;1;0;0;0;0;1;1;0;0;1;1;0;1;35000;4800;35;35;14;21;0;0;9;23;3;3;0;3;18;14;3;10;9;7;3;1;1;1;19;0;12;0;0;4;35;0;0
2016;Centro-Oeste;5;Distrito Federal;DF;53;Brasília;5300108;1;Distrito Federal;1;Brasília;1;3;5;ASSOCIACAO DARWIN DE EDUCACAO E PESQUISA;2575;4095;FACULDADE DE TECNOLOGIA E CIÊNCIAS DO DISTRITO FEDERAL;FATECDF;QS 07, Rua 400, Lote 1;s/n;;-;71968720;10;0;0;0;0;3;2;0;1;3;0;0;0;0;1;1;0;0;0;0;1;0;1;0;0;10;10;2;8;0;0;7;3;0;0;0;0;0;10;2;1;3;1;0;1;0;2;1;1;0;0;0;8;10;0;0
2016;Sul;4;Rio Grande do Sul;RS;43;Porto Alegre;4314902;1;Metropolitana de Porto Alegre;5;Porto Alegre;26;3;4;SOCIEDADE EDUCACIONAL RIOGRANDENSE LTDA.;3488;4096;FACULDADE DE TECNOLOGIA TECBRASIL - UNIDADE PORTO ALEGRE;Ftec Porto Alegre;Rua Comendador Manuel Pereira;249;;Centro;9003030;80;1;1;2;1;24;11;11;8;4;4;4;8;0;1;0;1;0;1;0;1;0;1;464;5106;116;116;36;80;0;0;32;71;13;4;0;4;12;100;6;21;31;18;21;7;2;10;83;3;22;2;0;6;114;2;0
2016;Sul;4;Rio Grande do Sul;RS;43;Bento Gonçalves;4302105;0;Nordeste Rio-grandense;2;Caxias do Sul;16;3;4;CENTRO SUPERIOR DE TECNOLOGIA TECBRASIL LTDA;2107;4097;FACULDADE DE TECNOLOGIA TECBRASIL - UNIDADE BENTO GONÇALVES;Ftec Bento Gonçalves;Rua  Osvaldo Aranha;419;;Centro;95700000;43;2;1;1;1;8;2;12;1;2;4;2;5;1;1;0;1;0;0;1;1;0;1;5106;464;46;46;22;24;0;0;18;26;2;6;0;6;10;30;0;12;15;7;3;4;4;1;43;1;1;0;0;1;46;0;0
2016;Sul;4;Rio Grande do Sul;RS;43;Santa Maria;4316907;0;Centro Ocidental Rio-grandense;3;Santa Maria;18;4;1;INSTITUTO FEDERAL DE EDUCACAO, CIENCIA E TECNOLOGIA FARROUPILHA;8338;4098;INSTITUTO FEDERAL DE EDUCAÇÃO, CIÊNCIA E TECNOLOGIA FARROUPILHA;IFFarroupilha;Rua Esmeralda;430;Faixa Nova;Camobi;97110767;670;1;6;2;8;57;72;111;106;125;73;67;35;1;6;1;0;0;0;1;1;1;1;170;180;504;469;264;205;0;0;32;262;175;431;404;27;38;0;50;131;116;80;50;27;10;5;381;7;11;0;1;69;466;3;0
2016;Centro-Oeste;5;Goiás;GO;52;Goiânia;5208707;1;Centro Goiano;3;Goiânia;10;3;5;SERVICO NACIONAL DE APRENDIZAGEM INDUSTRIAL SENAI;2476;4100;FACULDADE DE TECNOLOGIA SENAI ÍTALO BOLOGNA;FATECIB;Armogaste J. Silveira;612;;Setor Centro Oeste;74560020;66;0;1;0;1;9;5;15;12;12;7;2;2;0;0;0;0;0;1;0;1;1;1;78;0;15;14;3;11;0;0;1;13;0;4;0;4;5;5;0;4;3;3;1;2;0;1;7;1;0;0;0;6;14;0;0
2016;Centro-Oeste;5;Goiás;GO;52;Goiânia;5208707;1;Centro Goiano;3;Goiânia;10;3;5;SERVICO NACIONAL DE APRENDIZAGEM INDUSTRIAL SENAI;2476;4101;FACULDADE DE TECNOLOGIA SENAI DE DESENVOLVIMENTO GERENCIAL;FATESG;Rua 227-A;95;;Setor Leste Universitário;74610060;45;0;0;0;2;7;3;12;1;11;8;0;1;0;0;1;1;0;1;1;1;1;1;4;0;23;23;6;17;0;0;8;14;1;1;0;1;17;5;2;3;8;6;3;1;0;0;8;0;1;0;0;14;23;0;0
2016;Sudeste;3;São Paulo;SP;35;São Paulo;3550308;1;Metropolitana de São Paulo;15;São Paulo;61;3;4;ETAPA EDUCACIONAL LTDA;2577;4104;ESCOLA SUPERIOR DE ENGENHARIA E GESTÃO DE SÃO PAULO - ESEG;ESEG;Rua Vergueiro;1951;;Vila Mariana;4101000;14;0;0;0;0;4;4;3;0;1;0;0;2;0;0;0;0;0;0;1;1;0;1;0;0;38;36;5;31;0;0;3;15;18;1;0;1;15;20;3;5;3;4;9;4;4;4;26;0;2;6;0;2;36;0;0
2016;Sul;4;Rio Grande do Sul;RS;43;Porto Alegre;4314902;1;Metropolitana de Porto Alegre;5;Porto Alegre;26;3;5;SERVICO NACIONAL DE APRENDIZAGEM INDUSTRIAL-SENAI;2579;4107;FACULDADE DE TECNOLOGIA SENAI PORTO ALEGRE;FATEC SENAI;Avenida Assis Brasil;8450;;Sarandi;91140000;22;1;1;3;1;4;3;4;2;3;0;0;0;0;0;0;0;0;0;0;1;0;1;28;4000;18;18;2;16;0;0;1;16;1;4;0;4;3;11;0;1;6;2;2;4;2;1;18;0;0;0;0;0;17;1;0
2016;Nordeste;2;Piauí;PI;22;Teresina;2211001;1;Centro-Norte Piauiense;2;Teresina;3;3;5;ASSOCIACAO PIAUIENSE DE CULTURA SUPERIOR (SOCULTURAS);2580;4108;INSTITUTO CATÓLICO DE ESTUDOS SUPERIORES DO PIAUÍ;ICESPI;Rodovia Palmeirais (Pi 130);s.n.;Caixa Postal 496;Km 8;64001970;5;0;0;0;0;2;0;2;0;1;0;0;0;0;0;0;0;0;0;0;0;0;0;0;0;13;11;2;9;0;0;2;8;1;0;0;0;5;6;0;0;1;3;2;1;3;1;4;1;4;1;0;1;11;0;0
2016;Centro-Oeste;5;Goiás;GO;52;Ceres;5205406;0;Centro Goiano;3;Ceres;6;3;4;CESUR - CENTRO DE ENSINO SUPERIOR DE RUBIATABA LTDA;689;4113;FACULDADE DE CERES;FACER;Avenida Brasil, Quadra 13;s/n;;Setor Morada Verde;76300000;20;3;0;0;1;8;4;2;0;1;0;1;0;0;0;1;1;0;1;0;1;1;1;2;8000;42;42;22;20;0;0;14;23;5;7;0;7;26;9;11;10;7;9;4;0;0;1;21;3;11;0;0;7;42;0;1
2016;Nordeste;2;Pernambuco;PE;26;Paulista;2610707;0;Metropolitana de Recife;5;Recife;17;3;4;SER EDUCACIONAL S.A.;1847;4118;FACULDADE JOAQUIM NABUCO - PAULISTA;FJN;Avenida Senador Salgado Filho;s/n;;Centro;53401440;65;0;0;2;3;11;8;15;9;7;6;2;1;1;0;1;1;0;0;0;1;0;0;16977;3389;125;125;63;62;0;0;50;53;22;44;0;44;46;35;19;23;34;24;13;6;3;3;5;2;116;0;0;2;125;0;0
2016;Nordeste;2;Sergipe;SE;28;Aracaju;2800308;1;Leste Sergipano;3;Aracaju;11;3;4;SOCIEDADE DE ENSINO SUPERIOR E DE PESQUISA DE SERGIPE LTDA - SESPS;2587;4121;FACULDADE MAURÍCIO DE NASSAU DE ARACAJU;;Rua de Riachuelo;1071;;São José;49015160;40;0;0;3;3;16;8;3;2;1;1;2;1;0;0;1;1;0;1;1;1;0;1;16977;3389;66;66;35;31;0;0;17;37;12;22;0;22;16;28;12;18;11;9;7;6;1;2;2;0;62;0;0;2;66;0;0
2016;Centro-Oeste;5;Goiás;GO;52;Jataí;5211909;0;Sul Goiano;5;Sudoeste de Goiás;13;3;4;SOCIEDADE MANTENEDORA DAS FACULDADES DE JATAI LTDA - ME;2589;4123;FACULDADE JATAIENSE;FAJA;Avenida Perimetral;1075;;Centro;75800001;6;0;0;2;1;2;0;0;0;1;0;0;0;0;0;0;0;0;0;1;1;1;0;0;0;13;13;5;8;0;0;11;2;0;0;0;0;1;12;1;4;2;2;4;0;0;0;8;0;4;0;0;1;13;0;0
2016;Centro-Oeste;5;Mato Grosso;MT;51;Água Boa;5100201;0;Nordeste Mato-grossense;2;Canarana;10;3;4;FACULDADES CATHEDRAL DE ENSINO SUPERIOR DO ARAGUAIA;2592;4126;FACULDADE DE CIÊNCIAS SOCIAIS APLICADAS E DE TECNOLOGIAS DE AGUA BOA;FACESA;Avenida Planalto;s/n;Esquina com a Avenid;Cidade Universitária;78365000;12;0;0;0;1;3;0;3;2;1;1;1;0;0;0;1;1;0;1;1;1;0;0;13;0;7;7;6;1;0;0;3;4;0;1;0;1;2;4;0;1;1;1;1;2;1;0;7;0;0;0;0;0;7;0;0
2016;Norte;1;Amazonas;AM;13;Manaus;1302603;1;Centro Amazonense;3;Manaus;7;3;5;SER EDUCACIONAL S.A.;1847;4135;Faculdade Maurício de Nassau Manaus;;Avenida Djalma Batista;377;- até 434/435;Nossa Senhora das Graças (Chapada);69053000;51;0;0;0;0;12;15;4;6;6;3;1;3;1;0;0;1;0;1;1;1;0;1;16977;3389;48;48;20;28;0;0;20;23;5;16;0;16;15;17;11;7;11;10;6;2;0;1;0;1;47;0;0;0;48;0;0
2016;Sudeste;3;São Paulo;SP;35;Santa Bárbara d'Oeste;3545803;0;Campinas;7;Campinas;32;3;4;ANHANGUERA EDUCACIONAL LTDA;2600;4138;FACULDADE ANHANGUERA DE SANTA BÁRBARA;;Rua Juscelino Kubitschek de Oliveira;1450;;2º Distrito Industrial;13450401;98;0;1;1;1;24;10;13;7;14;14;4;7;2;0;0;1;0;1;1;1;0;1;24951;7250;146;146;58;88;0;0;86;44;16;5;0;5;49;92;9;33;41;26;9;15;6;7;130;4;10;1;0;1;145;1;5
2016;Sudeste;3;São Paulo;SP;35;Taubaté;3554102;0;Vale do Paraíba Paulista;13;São José dos Campos;50;3;4;ANHANGUERA EDUCACIONAL LTDA;2600;4141;FACULDADE ANHANGUERA DE TAUBATÉ;;Avenida José Olegário de Barros;46/58;;Vila Nossa Senhora das Graças;12060400;102;0;0;2;4;25;14;22;2;12;4;10;5;0;2;0;1;0;1;1;1;0;1;24591;7250;126;126;47;79;0;0;66;50;10;9;0;9;74;43;3;23;27;24;22;11;9;7;112;1;9;3;0;1;126;0;1
2016;Sul;4;Santa Catarina;SC;42;São José;4216602;0;Grande Florianópolis;5;Florianópolis;16;3;5;SERVICO NACIONAL DE APRENDIZAGEM INDUSTRIAL;822;4148;FACULDADE DE TECNOLOGIA SENAI SÃO JOSÉ;SENAISC;Br 101 Km211;7235;;Aréa Industrial;88104800;143;0;0;0;1;6;12;29;40;14;26;3;8;2;2;0;0;0;1;0;1;1;0;0;0;5;1;1;0;0;0;0;1;0;1;0;1;0;0;0;1;0;0;0;0;0;0;1;0;0;0;0;0;1;0;0
2016;Sudeste;3;São Paulo;SP;35;Piracicaba;3538709;0;Piracicaba;6;Piracicaba;28;3;4;INSTITUTO DE DESENVOLVIMENTO TECNOLOGICO E EDUCACIONAL DE PIRACICABA LTDA;2605;4150;FACULDADE DE TECNOLOGIA DE PIRACICABA;FATEP;Rua Silva Jardim;1.763;;Cidade Alta;13419140;13;0;0;2;0;0;0;7;2;2;0;0;0;0;0;0;0;0;0;0;0;1;0;0;0;51;46;10;36;0;0;21;14;11;8;0;8;23;15;1;3;6;13;12;8;2;1;42;1;1;0;0;2;46;0;0
2016;Nordeste;2;Pernambuco;PE;26;Recife;2611606;1;Metropolitana de Recife;5;Recife;17;3;4;SER EDUCACIONAL S.A.;1847;4153;FACULDADE JOAQUIM NABUCO RECIFE;FJN;Av. Guararapes;203;;Santo Antônio;50010900;73;0;0;0;0;19;12;11;9;6;7;5;3;0;1;1;1;0;1;0;0;1;0;9564;5237;126;126;61;65;0;0;47;60;19;45;0;45;37;44;13;33;36;16;15;7;4;2;19;2;102;0;0;3;126;0;0
2016;Sul;4;Santa Catarina;SC;42;Rio do Sul;4214805;0;Vale do Itajaí;4;Rio do Sul;11;3;4;INSTITUTO EDUCACIONAL DO ALTO VALE DO ITAJAI LTDA;2608;4157;FACULDADE METROPOLITANA DE RIO DO SUL;FAMESUL;Rodovia Br 470 Km 140;5.253;;Itoupava;89160000;38;1;1;7;0;13;7;3;2;3;0;0;0;1;0;0;1;0;0;1;1;1;1;13543;12397;62;61;21;40;0;0;40;17;4;4;0;4;48;9;9;15;14;10;5;6;1;1;56;1;3;0;0;1;61;0;0
2016;Centro-Oeste;5;Goiás;GO;52;Goiânia;5208707;1;Centro Goiano;3;Goiânia;10;3;5;SERVICO NACIONAL DE APRENDIZAGEM COMERCIAL - SENAC;2612;4162;Faculdade SENAC Goiás;FacSenacGO;Avenida Caiapó;41/43/45/4;com a Rua Padova, Qu;Santa Genoveva;74672400;24;0;0;1;0;3;4;6;1;3;4;2;0;0;0;0;0;0;1;1;1;0;1;5;0;45;45;12;33;0;0;14;29;2;2;0;2;32;11;1;4;14;12;7;6;0;1;19;1;3;0;0;22;45;0;0
2016;Sul;4;Santa Catarina;SC;42;Orleans;4211702;0;Sul Catarinense;6;Tubarão;18;2;5;FUNDACAO EDUCACIONAL BARRIGA VERDE;1124;4163;CENTRO UNIVERSITÁRIO BARRIGA VERDE;UNIBAVE;Rua Miguel Couto;313;;Centro;88870000;233;15;7;12;5;23;21;40;13;33;19;19;13;6;7;0;0;0;0;0;1;1;1;0;1;191;191;73;118;0;0;74;88;29;52;0;52;64;75;9;42;47;32;27;16;12;6;185;1;0;0;0;5;191;0;0
2016;Sudeste;3;Minas Gerais;MG;31;Uberaba;3170107;0;Triângulo Mineiro/Alto Paranaíba;5;Uberaba;22;3;5;ASSOCIACAO COMERCIAL, INDUSTRIAL E DE SERVICOS DE UBERABA - ACIU;99;4166;CENTRO DE ENSINO SUPERIOR DE UBERABA;CESUBE;Avenida Randolfo Borges Junior;1250;;Univerdecidade;38066005;36;2;0;4;2;6;2;9;6;1;2;1;1;0;0;0;0;0;0;1;1;1;1;0;0;49;48;21;27;0;0;28;17;3;10;0;10;16;22;4;8;7;5;7;9;3;5;29;0;0;0;0;19;48;0;0
2016;Sudeste;3;São Paulo;SP;35;Carapicuíba;3510609;0;Metropolitana de São Paulo;15;Osasco;57;3;4;CENTRO EDUCACIONAL NOSSA CIDADE LTDA.;2617;4169;FACULDADE NOSSA CIDADE;FNC;AV. FRANCISCO PIGNATARI;630;;VILA GUSTAVO CORREIA;6310330;97;5;7;4;2;17;16;15;7;4;4;7;7;1;1;1;1;0;0;1;1;0;1;35000;4800;193;185;66;119;0;0;86;67;32;26;0;26;100;59;5;24;36;34;30;22;17;17;34;0;4;1;0;146;184;1;0
2016;Centro-Oeste;5;Distrito Federal;DF;53;Brasília;5300108;1;Distrito Federal;1;Brasília;1;3;5;AESJK - ASSOCIACAO DE ENSINO SUPERIOR JUSCELINO KUBITSCHEK;13385;4173;FACULDADE JK DE TECNOLOGIA;FACJK;Shin Ca2;21;Lote 21;Lago Norte;71503502;22;2;0;5;2;5;1;3;2;1;1;0;0;0;0;0;0;0;0;0;1;1;1;100;65;29;29;6;23;0;0;22;4;3;1;0;1;6;22;2;9;7;5;2;2;0;2;10;0;8;0;0;11;29;0;0
2016;Sudeste;3;São Paulo;SP;35;Campinas;3509502;0;Campinas;7;Campinas;32;3;5;ASSOCIACAO NAZARENA EDUCACIONAL DE CAMPINAS.;2626;4179;FACULDADE NAZARENA DO BRASIL;FNB;Estrada da Rhodia, Km 15;s/n;;Distrito Barão Geraldo;13085000;13;0;1;0;0;1;1;6;0;1;0;0;2;0;1;0;0;0;0;1;1;0;0;99;104;16;16;4;12;0;0;5;9;2;3;0;3;2;11;0;3;4;3;4;1;1;0;12;1;1;0;0;2;15;1;1
2016;Sudeste;3;São Paulo;SP;35;Peruíbe;3537602;0;Litoral Sul Paulista;14;Itanhaém;56;3;4;UNISEPE UNIAO DAS INSTITUICOES DE SERVICO, ENSINO E PESQUISA LTDA;715;4185;FACULDADE PERUIBE;FPBE;Avenida Darcy Fonseca;530;;Jardim dos Prados;11750000;9;0;0;0;0;3;0;4;2;0;0;0;0;0;0;0;0;0;0;1;1;0;0;183;0;40;39;20;19;0;0;10;26;3;6;0;6;8;25;1;6;4;11;5;4;4;4;26;1;1;0;0;11;39;0;0
2016;Nordeste;2;Piauí;PI;22;Teresina;2211001;1;Centro-Norte Piauiense;2;Teresina;3;3;4;CIESPI-CENTRO INTEGRADO DE EDUCACAO SUPERIOR DO PIAUI LTDA;2637;4197;FACULDADE ALIANÇA;FACE;Rua São Pedro;965;;Centro;64001260;62;1;0;6;3;23;8;12;6;1;1;0;1;0;0;1;0;0;0;0;1;0;1;123;25;98;98;55;43;0;0;26;55;17;35;0;35;17;46;22;31;24;11;3;3;3;1;8;0;87;1;0;2;98;0;0
2016;Centro-Oeste;5;Goiás;GO;52;Mineiros;5213103;0;Sul Goiano;5;Sudoeste de Goiás;13;3;4;CENTRO DE ENSINO SUPERIOR REZENDE & POTRICH LTDA - ME;2638;4198;FACULDADE MINEIRENSE;FAMA;Praça Deputado José Alves de Assis;58;;Centro;75830000;67;1;0;0;0;22;20;10;10;3;1;0;0;0;0;0;0;0;0;1;1;1;0;120;0;120;120;68;52;0;0;49;55;16;94;0;94;25;1;32;28;22;17;12;3;2;4;77;3;28;1;0;11;118;2;3
2016;Centro-Oeste;5;Distrito Federal;DF;53;Brasília;5300108;1;Distrito Federal;1;Brasília;1;3;5;ASSOCIACAO ROGACIONISTA DE EDUCACAO E ASSISTENCIA SOCIAL (AREAS);2639;4199;FACULDADE DE TECNOLOGIA ROGACIONISTA;ROGA;Ae 08 Módulo B;s/n;;Guará II;71065325;10;0;2;0;0;4;1;2;0;1;0;0;0;0;0;1;1;0;1;1;1;1;0;350;4658;9;9;1;8;0;0;4;2;3;0;0;0;0;9;0;1;2;1;2;3;0;0;2;1;2;0;0;4;9;0;0
2016;Nordeste;2;Paraíba;PB;25;João Pessoa;2507507;1;Mata Paraibana;4;João Pessoa;22;3;4;UNIFUTURO FACULDADE DE ENSINO SUPERIOR DO NORDESTE LTDA - EPP;2640;4201;FACULDADE DE ENSINO SUPERIOR DO NORDESTE;FAESNE;Avenida Odon Bezerra;184;Loja 256 2º andar  -;Tambiá;58020500;16;0;1;0;1;2;3;3;0;4;1;1;0;0;0;0;1;0;0;1;1;1;1;250;4279;28;28;13;15;0;0;7;16;5;11;7;4;11;6;4;4;4;2;5;4;2;3;9;2;5;0;0;12;25;3;0
2016;Sudeste;3;São Paulo;SP;35;Itu;3523909;0;Macro Metropolitana Paulista;12;Sorocaba;46;3;4;SOCIEDADE DE EDUCACAO, CIENCIA E TECNOLOGIA DE ITU LTDA - ME;2646;4209;FACULDADE DE TECNOLOGIA CÉSAR LATTES;;Rua Marco Aurélio Gatti;59;;Vila Santa Terezinha;13310343;51;0;1;6;2;6;2;7;10;5;9;1;1;0;1;0;0;0;0;1;1;1;1;842;8659;17;17;6;11;0;0;12;2;3;2;0;2;8;7;0;1;3;5;4;0;3;1;17;0;0;0;0;0;17;0;1
2016;Sudeste;3;São Paulo;SP;35;São Paulo;3550308;1;Metropolitana de São Paulo;15;São Paulo;61;3;4;CENTRO DE ESTUDOS DE ADMINISTRACAO E MARKETING CEAM LTDA;918;4211;Faculdade ESAMC São Paulo - ESAMC;ESAMC;Rua Caiubi;127;;Perdizes;5010000;16;0;0;0;0;0;0;9;6;1;0;0;0;0;0;0;0;0;0;1;1;0;0;53;0;26;26;11;15;0;0;8;15;3;1;0;1;8;17;4;1;5;7;1;2;2;4;2;0;0;0;0;24;26;0;0
2016;Sudeste;3;Minas Gerais;MG;31;Pedro Leopoldo;3149309;0;Metropolitana de Belo Horizonte;7;Belo Horizonte;30;3;5;FUNDACAO CULTURAL DR PEDRO LEOPOLDO;450;4218;FACULDADE PEDRO LEOPOLDO;FPL;Avenida Lincoln Viana;830;;Doutor Lund;33600000;80;0;0;12;4;13;18;17;10;0;0;1;1;2;2;1;1;0;1;1;1;1;1;10;0;95;92;34;58;0;0;13;51;28;19;0;19;7;66;0;8;18;12;11;15;11;17;40;0;9;0;0;43;92;0;0
2016;Sudeste;3;Minas Gerais;MG;31;Além Paraíba;3101508;0;Zona da Mata;12;Cataguases;66;3;5;FUNDACAO EDUCACIONAL DE ALEM PARAIBA;401;4219;INSTITUTO SUPERIOR DE EDUCAÇÃO PROFESSORA NAIR FORTES ABU-MERHY;ISEFOR;Rua Isabel Herdy Alves;305;PRÉDIO DO CAP;SAO JOSÉ;36660000;4;0;0;0;0;2;0;1;0;1;0;0;0;0;0;0;0;0;0;1;1;0;0;0;0;30;30;8;22;0;0;21;7;2;0;0;0;2;28;3;2;5;4;6;6;3;1;22;0;1;0;0;7;30;0;0
2016;Sudeste;3;Minas Gerais;MG;31;Belo Horizonte;3106200;1;Metropolitana de Belo Horizonte;7;Belo Horizonte;30;3;4;ORME SERVICOS EDUCACIONAIS LTDA;3167;4251;FACULDADE PITÁGORAS DE TECNOLOGIA DE BELO HORIZONTE;PIT-FATEC;Rua Santa Madalena Sofia;25;;Cidade Jardim;30380650;125;0;0;1;1;40;22;18;16;10;3;7;5;2;0;0;1;0;1;1;0;0;1;24951;7250;51;50;18;32;0;0;23;27;0;1;0;1;30;19;3;6;13;13;10;3;2;0;27;4;17;1;0;1;50;0;0
2016;Norte;1;Rondônia;RO;11;Cacoal;1100049;0;Leste Rondoniense;2;Cacoal;6;3;5;ASSOCIACAO EDUCACIONAL DE RONDONIA;525;4255;FACULDADES INTEGRADAS DE CACOAL;UNESC;Rua dos Esportes;1038;;Incra;78976215;85;8;8;7;2;5;17;19;15;2;1;1;0;0;0;0;0;0;0;1;1;1;1;476;17;104;104;40;64;0;0;45;51;8;53;0;53;4;47;13;25;22;12;15;10;6;1;62;1;19;0;0;22;104;0;0
2016;Sudeste;3;Minas Gerais;MG;31;Montes Claros;3143302;0;Norte de Minas;2;Montes Claros;7;3;4;SOCIEDADE PADRAO DE EDUCACAO SUPERIOR LTDA;1040;4256;FACULDADES INTEGRADAS PITÁGORAS;FIP-MOC;Avenida Professora Aida Mainartina Paraíso;80;;Ibituruna;39408007;379;6;3;2;1;84;118;46;19;29;38;14;15;2;2;0;1;0;1;1;1;1;1;118;4355;222;222;102;120;0;0;60;121;41;50;0;50;156;16;13;27;67;41;32;22;13;7;87;6;37;0;0;92;222;0;1
2016;Centro-Oeste;5;Goiás;GO;52;Goiânia;5208707;1;Centro Goiano;3;Goiânia;10;3;5;UNIAO BRASIL CENTRAL DE EDUCACAO E ASSISTENCIA;2664;4257;INSTITUTO DE FILOSOFIA E TEOLOGIA DE GOIÁS;IFITEG;7a Avenida;531;;Setor Leste Universitário;74603030;7;3;0;0;0;0;0;1;1;2;0;0;0;0;0;0;0;0;1;1;1;0;1;0;0;20;20;4;16;0;0;1;11;8;0;0;0;0;20;2;1;2;5;1;2;2;5;5;1;1;0;0;13;19;1;0
2016;Centro-Oeste;5;Goiás;GO;52;Inhumas;5210000;0;Centro Goiano;3;Anápolis;7;3;4;CENTRO DE EDUCACAO SUPERIOR DE INHUMAS - EPP;2666;4259;FACULDADE DE INHUMAS - FAC-MAIS;FACMAIS;Avenida Monte Alegre;100;Quadra 3, Lotes 11 a;Monte Alegre;75400000;27;2;0;1;2;2;7;2;3;7;0;1;0;0;0;1;1;0;1;1;1;1;1;31;0;74;74;42;32;0;0;27;27;20;14;0;14;59;1;16;11;13;6;18;5;3;2;44;2;14;11;0;3;72;2;0
2016;Sul;4;Rio Grande do Sul;RS;43;Porto Alegre;4314902;1;Metropolitana de Porto Alegre;5;Porto Alegre;26;3;4;QI ESCOLAS E FACULDADES LTDA;2164;4261;FACULDADE DE TECNOLOGIA DE PORTO ALEGRE;FAQI;Avenida Júlio de Castilhos;435;;Centro;90030131;15;0;0;1;0;5;3;3;0;1;0;2;0;0;0;0;1;0;0;1;1;1;1;545;5179;34;34;9;25;0;0;12;14;8;1;0;1;21;12;0;5;5;9;4;5;3;3;32;1;0;0;0;1;32;2;0
2016;Norte;1;Amazonas;AM;13;Manaus;1302603;1;Centro Amazonense;3;Manaus;7;3;4;SOCIEDADE DE ENSINO SUPERIOR ESTACIO AMAZONAS LTDA;2683;4277;FACULDADE ESTÁCIO DO AMAZONAS - ESTÁCIO AMAZONAS;ESTÁCIO AMAZONAS;Avenida Constantino Nery;3.693;;Chapada;69050001;68;0;0;0;1;21;12;18;10;2;2;1;1;0;0;0;1;0;0;1;1;0;1;35000;4800;136;136;71;65;0;0;52;48;36;19;0;19;39;78;8;30;27;19;20;17;11;4;38;1;95;0;2;0;136;0;0
2016;Sudeste;3;Minas Gerais;MG;31;Virginópolis;3171808;0;Vale do Rio Doce;8;Guanhães;35;3;4;SOCIEDADE DE ENSINO ELVIRA DAYRELL - SOED - EPP;1310;4289;FACULDADE DO VALE ELVIRA DAYRELL - FAVED;FAVED;Rodovia de Ligação da Br 259 À Br 120;s/n;KM 001;Centro;39730000;14;2;3;0;0;1;1;3;1;2;1;0;0;0;0;0;0;0;0;0;1;1;0;20;2;19;19;5;14;0;0;12;6;1;8;0;8;11;0;3;3;5;3;3;0;1;1;4;1;4;0;0;10;18;1;0
2016;Sudeste;3;São Paulo;SP;35;Tietê;3554508;0;Piracicaba;6;Piracicaba;28;3;4;SOCIEDADE EDUCACIONAL SANTO EXPEDITO LTDA. - EPP;2696;4293;FACULDADE INTEGRAÇÃO TIETE;FIT;Rua Santa Terezinha;425;;Belvedere;18530000;17;0;0;2;2;3;2;4;2;1;0;0;0;0;1;0;1;0;1;1;1;1;1;842;8659;34;33;16;17;0;0;13;14;6;9;0;9;23;1;2;4;9;4;6;6;0;2;32;1;0;0;0;0;33;0;1
2016;Sul;4;Santa Catarina;SC;42;Jaraguá do Sul;4208906;0;Norte Catarinense;2;Joinville;8;3;5;SERVICO NACIONAL DE APRENDIZAGEM COMERCIAL - SENAC;2084;4294;FACULDADE DE TECNOLOGIA SENAC JARAGUÁ DO SUL;;Rua dos Imigrantes;310;;Vila Rau;89254430;22;0;0;2;0;2;0;12;0;4;1;1;0;0;0;1;1;0;1;1;1;0;1;327;117;28;26;9;17;0;0;14;9;3;1;1;0;3;22;1;4;6;8;5;1;1;0;25;1;0;0;0;0;26;0;0
2016;Sudeste;3;Minas Gerais;MG;31;Belo Horizonte;3106200;1;Metropolitana de Belo Horizonte;7;Belo Horizonte;30;3;4;SOCIEDADE DE ENSINO SUPERIOR MINEIRO LTDA - SESM - ME;2728;4329;FACULDADE DO CENTRO EDUCACIONAL MINEIRO - FACEM;FACEM-BH;Rua Eufrates;30;;Alípio de Melo;30830000;12;1;1;0;0;2;2;2;0;0;0;2;2;0;0;1;0;0;0;0;1;0;1;0;0;32;29;11;18;0;0;10;19;0;0;0;0;8;21;2;2;1;8;8;5;2;1;12;2;4;0;0;11;29;0;0
2016;Sul;4;Paraná;PR;41;Maringá;4115200;0;Norte Central Paranaense;3;Maringá;9;3;4;CENTRO DE ENSINO SUPERIOR AMERICA DO SUL LTDA  - ME;2729;4330;FACULDADE DE TECNOLOGIA AMÉRICA DO SUL;;Rua Basílio Saltchuk;357;;Centro;87013190;28;2;1;0;0;4;2;8;4;4;3;0;0;0;0;0;1;0;0;1;1;1;0;80;2800;11;11;7;4;0;0;1;7;3;1;0;1;9;1;0;2;4;2;1;0;0;2;9;0;1;1;0;0;11;0;0
2016;Norte;1;Tocantins;TO;17;Palmas;1721000;1;Oriental do Tocantins;2;Porto Nacional;6;3;4;INSTITUTO DE EDUCACAO VERBO LTDA - ME;2743;4355;FACULDADE DE TECNOLOGIA DE PALMAS;FTP;Quadra 1401 Sul Avenida Joaquim Teotônio Segurado;S/N;Conjunto 01 Lote 02;Plano Diretor Sul;77019740;4;0;0;0;0;1;1;1;0;0;0;0;0;1;0;1;1;0;0;1;1;1;0;0;0;10;10;4;6;0;0;5;4;1;2;2;0;7;1;0;2;0;0;4;1;1;2;6;0;2;0;0;2;10;0;0
2016;Nordeste;2;Pernambuco;PE;26;Palmares;2610004;0;Mata Pernambucana;4;Mata Meridional Pernambucana;15;3;3;AUTARQUIA EDUCACIONAL DA MATA SUL;56;4356;FACULDADE DE CIÊNCIAS SOCIAIS DOS PALMARES;FACIP;Br 101 K 186 Sul;s/n;;Engenho São Manoel;55540000;4;0;0;0;0;1;1;1;1;0;0;0;0;0;0;0;0;0;0;0;0;1;0;0;0;23;21;11;10;0;0;14;6;1;0;0;0;21;0;4;2;3;4;3;2;0;3;5;2;13;0;0;1;21;0;0
2016;Sudeste;3;São Paulo;SP;35;São Paulo;3550308;1;Metropolitana de São Paulo;15;São Paulo;61;3;4;CETTAA - CENTRO DE EDUCACAO TECNICA E TECNOLOGICA ALVARES DE AZEVEDO LTDA;2744;4357;FACULDADE DE TECNOLOGIA ÁLVARES DE AZEVEDO;FAATESP;Avenida Paulista;302/306;Conjuntos 10,50,60,7;Bela Vista;1310000;29;0;0;0;0;8;5;6;2;1;5;0;2;0;0;0;0;0;0;0;0;0;1;0;0;32;32;5;27;0;15;9;7;1;0;0;0;23;9;1;6;7;5;7;3;3;0;20;0;1;0;0;11;32;0;1
2016;Sudeste;3;Minas Gerais;MG;31;Pouso Alegre;3152501;0;Sul/Sudoeste de Minas;10;Pouso Alegre;52;4;1;INSTITUTO FEDERAL DE EDUCACAO, CIENCIA E TECNOLOGIA DO SUL DE MINAS GERAIS;8622;4358;INSTITUTO FEDERAL DE EDUCAÇÃO, CIÊNCIA E TECNOLOGIA DO SUL DE MINAS GERAIS;IF SUL DE MINAS;Avenida Vicente Simões;1111;;Nova Pouso Alegre;37550000;545;2;7;1;7;27;37;41;65;134;127;45;49;2;1;1;1;0;0;1;1;1;1;0;6500;389;373;144;229;0;0;41;167;165;370;320;50;2;1;32;108;85;58;34;34;13;9;263;8;40;1;0;61;371;2;1
2016;Sudeste;3;Minas Gerais;MG;31;Betim;3106705;0;Metropolitana de Belo Horizonte;7;Belo Horizonte;30;3;4;PITAGORAS - SISTEMA DE EDUCACAO SUPERIOR SOCIEDADE LTDA;1204;4362;FACULDADE PITÁGORAS DE BETIM;PITÁGORAS-BETIM;Avenida Juscelino Kubitschek;229;;Betim;32553140;76;0;0;0;0;34;7;10;3;5;1;11;4;0;1;0;1;0;1;1;1;1;1;24951;7250;299;297;128;169;0;0;109;164;24;12;0;12;134;151;30;68;83;42;34;24;9;7;157;20;105;0;0;15;297;0;9
2016;Nordeste;2;Ceará;CE;23;Caucaia;2303709;0;Metropolitana de Fortaleza;3;Fortaleza;16;3;4;SOCIEDADE UNIVERSITARIA DE DESENVOLVIMENTO PROFISSIONALIZANTE S/S - SUDEP FATENE;1808;4367;FACULDADE TERRA NORDESTE;FATENE;Coronel Correia;1119;;Soledade;61600000;67;0;0;4;1;24;24;11;3;0;0;0;0;0;0;0;1;0;0;1;1;1;1;10;0;144;144;76;68;0;0;35;77;32;57;1;56;54;33;13;37;26;19;20;14;7;8;51;5;78;0;0;10;143;1;0
2016;Centro-Oeste;5;Goiás;GO;52;Mineiros;5213103;0;Sul Goiano;5;Sudoeste de Goiás;13;2;7;FUNDACAO INTEGRADA MUNICIPAL DE ENSINO SUPERIOR;565;4396;CENTRO UNIVERSITÁRIO DE MINEIROS;UNIFIMES;Rua 22;S/N;Esquina com Avenida;Setor Aeroporto;75830000;104;3;5;1;2;19;16;28;12;12;6;0;0;0;0;0;1;0;0;1;1;1;1;0;16;87;87;42;45;0;0;8;60;19;70;1;69;17;0;13;21;14;10;14;6;6;3;51;2;12;0;1;21;87;0;0
2016;Nordeste;2;Maranhão;MA;21;Balsas;2101400;0;Sul Maranhense;5;Gerais de Balsas;20;3;4;UNIBALSAS EDUCACIONAL LTDA;2776;4399;FACULDADE DE BALSAS;UNIBALSAS;Br 230 Km 5;s/n;;Fazenda Malidere 4;65800000;63;0;1;0;1;15;9;16;2;11;3;2;3;0;0;0;0;0;0;1;1;1;0;60;0;58;58;23;35;0;0;29;28;1;25;0;25;21;12;15;16;13;4;3;2;2;3;35;1;18;0;0;4;57;1;0
2016;Norte;1;Rondônia;RO;11;Ji-Paraná;1100122;0;Leste Rondoniense;2;Ji-Paraná;4;3;5;UNIAO DAS ESCOLAS SUPERIORES DE JI-PARANA;2786;4411;FACULDADE PANAMERICANA DE JI-PARANÁ;;Rua Arsênio Rodrigues;296;;Urupá;78961080;53;1;0;5;0;9;5;11;5;8;4;2;3;0;0;1;1;0;1;1;1;1;1;49;0;65;65;28;37;0;0;43;18;4;0;0;0;20;45;12;15;11;11;7;6;1;2;23;1;15;0;0;26;65;0;0
2016;Centro-Oeste;5;Distrito Federal;DF;53;Brasília;5300108;1;Distrito Federal;1;Brasília;1;3;4;IDEA - INSTITUTO DE DESENVOLVIMENTO EDUCACIONAL AVANCADO S/S LTDA;3425;4416;FACULDADE JK - UNIDADE I - GAMA;;Área Especial 16/17;s/n;Lado Leste / Região;Setor Central Gama;72405165;12;0;0;2;0;3;4;3;0;0;0;0;0;0;0;0;1;0;0;1;1;1;1;120;5000;46;46;29;17;0;0;23;18;5;3;0;3;24;19;0;7;11;9;5;10;2;2;15;3;13;0;0;15;46;0;0
2016;Nordeste;2;Pernambuco;PE;26;Olinda;2609600;0;Metropolitana de Recife;5;Recife;17;3;4;AESO-ENSINO SUPERIOR DE OLINDA LTDA;276;4420;FACULDADES INTEGRADAS BARROS MELO;FIBAM;Avenida Transamazônica;405;;Jardim Brasil II;53300240;65;3;4;2;5;14;19;10;6;2;0;0;0;0;0;0;1;0;1;1;1;1;1;11;5141;95;95;38;57;0;0;15;61;19;12;0;12;55;28;5;18;19;21;14;7;8;3;48;1;40;0;0;6;95;0;0
2016;Sudeste;3;Minas Gerais;MG;31;Belo Horizonte;3106200;1;Metropolitana de Belo Horizonte;7;Belo Horizonte;30;3;5;SERVICO NACIONAL DE APRENDIZAGEM INDUSTRIAL - SENAI;2495;4421;FACULDADE DE TECNOLOGIA SENAI BELO HORIZONTE;FATEC SENAI BH;Avenida Afonso Pena;1500;;Centro;30130007;15;0;0;0;0;4;1;4;3;2;1;0;0;0;0;0;1;0;0;1;0;1;0;0;0;7;7;2;5;0;0;3;3;1;0;0;0;0;7;0;1;1;0;2;1;2;0;4;0;2;0;0;1;7;0;0
2016;Sudeste;3;Rio de Janeiro;RJ;33;Macaé;3302403;0;Norte Fluminense;2;Macaé;4;3;3;FUNDACAO EDUCACIONAL DE MACAE;2799;4428;FACULDADE PROFESSOR MIGUEL ÂNGELO DA SILVA SANTOS;FEMASS;Rua Aloísio da Silva Gomes;50;;Granja dos Cavaleiros;27930560;16;0;0;0;0;2;1;5;0;4;1;0;1;1;1;1;1;0;1;1;1;1;1;37000;0;63;63;21;42;0;0;11;39;13;6;0;6;44;13;3;11;13;10;2;12;6;6;46;4;4;1;0;8;63;0;0
2016;Centro-Oeste;5;Mato Grosso do Sul;MS;50;Campo Grande;5002704;1;Centro Norte de Mato Grosso do Sul;2;Campo Grande;4;3;5;UNIGRAN EDUCACIONAL;445;4429;FACULDADE UNIGRAN CAPITAL;UNIGRAN CAPITAL;Rua Abrão Júlio Rahe;325;- até 1010/1011;Centro;79010010;106;9;3;5;7;14;18;18;6;8;1;7;6;2;2;0;0;0;0;1;1;1;1;0;12;108;108;63;45;0;0;17;47;44;27;0;27;59;22;11;21;25;15;12;11;7;6;72;3;15;1;0;17;108;0;0
2016;Nordeste;2;Rio Grande do Norte;RN;24;Mossoró;2408003;0;Oeste Potiguar;1;Mossoró;1;3;4;ESCOLA DE ENFERMAGEM NOVA ESPERANCA LTDA;1158;4431;FACULDADE DE ENFERMAGEM NOVA ESPERANÇA DE MOSSORÓ - FACENE/RN;FACENE/RN;Avenida Presidente Dutra;701;;Alto de São Manoel;59628000;69;0;5;2;6;17;12;12;1;4;4;0;4;2;0;0;1;0;0;1;1;0;0;1400;0;42;42;27;15;0;0;4;25;13;35;0;35;7;0;12;16;8;4;1;0;0;1;22;0;18;0;0;2;42;0;2
2016;Sudeste;3;São Paulo;SP;35;São Paulo;3550308;1;Metropolitana de São Paulo;15;São Paulo;61;3;4;SOCIEDADE SAO PAULO DE ENSINO SUPERIOR-SSPES-LTDA;2804;4435;FACULDADE SÃO PAULO;FACSP;Rua Irmãos Pilla;144;;Tucuruvi;2309000;14;0;0;2;1;3;3;2;2;0;1;0;0;0;0;0;0;0;0;1;1;1;1;842;8569;14;14;7;7;0;0;6;7;1;3;0;3;4;7;0;0;3;1;1;3;1;5;8;0;1;0;0;5;14;0;0
2016;Sudeste;3;São Paulo;SP;35;Guarulhos;3518800;0;Metropolitana de São Paulo;15;Guarulhos;59;3;4;ESCOLA SUPERIOR DE ENSINO DE GUARULHOS LTDA - ME;2810;4442;ESCOLA SUPERIOR PAULISTA DE ADMINISTRAÇÃO - ESPA;ESPA;Rua João Gonçalves;455/471;;Centro;7010010;34;0;0;3;3;6;3;12;5;2;0;0;0;0;0;1;0;0;0;0;1;1;1;63;6500;11;11;3;8;0;0;5;4;2;3;0;3;2;6;1;1;3;0;4;2;0;0;5;0;1;0;0;5;11;0;0
2016;Sul;4;Rio Grande do Sul;RS;43;Ijuí;4310207;0;Noroeste Rio-grandense;1;Ijuí;8;3;4;SOCIEDADE EDUCACIONAL RIO CLARO LTDA;2811;4443;FACULDADE RIO CLARO;;Rua 13 de maio;67;;Centro;98700000;10;0;0;1;0;1;1;1;0;3;2;1;0;0;0;0;1;0;1;1;1;1;0;793;2280;22;22;15;7;0;0;6;15;1;2;0;2;14;6;2;4;8;5;1;1;1;0;19;1;2;0;0;0;22;0;0
