2014;Sudeste;3;São Paulo;SP;35;São José do Rio Preto;3549805;0;São José do Rio Preto;1;São José do Rio Preto;4;3;5;ASSOCIACAO EDUCACIONAL DE ENSINO SUPERIOR;555;1046;UNIÃO DAS FACULDADES DOS GRANDES LAGOS;UNILAGO;Rua Eduardo Nielsen;960;;Jardim Aeroporto;15030070;88;5;6;8;10;14;8;6;15;7;5;2;1;0;1;1;1;0;0;0;0;0;0;0;0;260;260;142;118;0;0;98;105;57;42;0;42;214;4;43;84;55;36;21;12;5;4;189;0;4;2;0;27;260;0;0
2014;Sudeste;3;São Paulo;SP;35;São Paulo;3550308;1;Metropolitana de São Paulo;15;São Paulo;61;3;4;INSTITUTO PAULISTA DE CIENCIAS DA ADMINISTRACAO LTDA IPCA - EPP;731;1048;FACULDADE CAMPOS ELÍSEOS;FCE;Rua Vitorino Carmilo;644;casa;Campos Elísios;1153000;58;0;0;0;0;18;8;6;4;5;6;2;7;0;2;1;1;0;0;0;0;0;0;0;0;19;19;8;11;0;0;0;14;5;7;0;7;9;3;3;6;5;0;1;0;1;3;17;0;1;0;0;0;19;0;0
2014;Norte;1;Amazonas;AM;13;Manaus;1302603;1;Centro Amazonense;3;Manaus;7;3;5;FUCAPI FUND CENTRO DE ANALISE PESQ E INOV TECNOLOGICA;732;1049;INSTITUTO DE ENSINO SUPERIOR FUCAPI;CESF;Avenida Governador Danilo de Matos Areosa;381;;Distrito Industrial;69075351;83;0;0;0;2;31;15;10;4;10;3;3;1;0;4;0;0;0;0;0;0;0;0;0;0;103;82;28;54;0;0;24;40;18;35;0;35;32;15;6;15;22;13;8;10;4;4;25;4;46;0;0;2;80;2;0
2014;Nordeste;2;Alagoas;AL;27;Maceió;2704302;1;Leste Alagoano;3;Maceió;11;3;4;SEUNE - SOC DE ENSINO UNIVERSITARIO DO NORDESTE LTDA;734;1051;FACULDADE DA SEUNE;SEUNE;Avenida Dom Antônio Brandão;204;;FAROL;57051190;53;7;5;3;5;18;2;8;3;2;0;0;0;0;0;1;1;0;0;0;0;0;0;0;0;106;100;48;52;0;0;43;41;16;9;0;9;23;68;7;21;14;21;9;8;5;15;50;2;32;0;0;13;100;0;0
2014;Nordeste;2;Bahia;BA;29;Feira de Santana;2910800;0;Centro Norte Baiano;3;Feira de Santana;12;3;4;INSTITUTO MANTENEDOR DE ENSINO SUPERIOR DA BAHIA LTDA - ME;1564;1053;FACULDADE DE TECNOLOGIA E CIÊNCIAS DE FEIRA DE SANTANA;FTC;Rua Artemia Pires Freitas;S/N;;SIM;44043590;123;0;0;2;12;42;32;16;5;7;2;2;2;1;0;0;1;0;0;0;0;0;0;0;0;136;134;86;48;0;0;83;43;8;30;0;30;90;14;11;40;27;22;15;11;5;3;26;0;32;0;0;48;134;0;0
2014;Nordeste;2;Bahia;BA;29;Salvador;2927408;1;Metropolitana de Salvador;5;Salvador;21;3;4;ABES - SOCIEDADE BAIANA DE ENSINO SUPERIOR LTDA;737;1055;FACULDADE MAURÍCIO DE NASSAU DE SALVADOR;FMN SALVADOR;Avenida Tamburugy;88;;Patamares;41680440;120;0;3;4;4;42;30;12;7;6;6;5;0;1;0;1;0;0;0;0;0;0;0;0;0;256;256;141;115;0;0;117;110;29;41;0;41;32;183;29;51;65;44;24;22;9;12;13;2;216;0;1;11;256;0;0
2014;Nordeste;2;Bahia;BA;29;Salvador;2927408;1;Metropolitana de Salvador;5;Salvador;21;2;4;IREP SOCIEDADE DE ENSINO SUPERIOR, MEDIO E FUNDAMENTAL LTDA.;545;1058;Estácio FIB - Centro Universitário Estácio da Bahia;Estácio FIB;Rua Xingu;179;Jardim Atalaia;STIEP;41770130;118;0;0;2;2;36;40;21;10;4;2;0;0;1;0;1;1;0;0;0;0;0;0;0;0;341;329;175;154;0;0;98;170;61;86;0;86;44;199;19;60;64;66;37;35;21;27;209;12;73;1;0;12;326;3;1
2014;Nordeste;2;Ceará;CE;23;Fortaleza;2304400;1;Metropolitana de Fortaleza;3;Fortaleza;16;3;5;OCESU - ORGANIZACAO CEARENSE DE EDUCACAO SUPERIOR LTDA;15657;1059;FACULDADE LOURENÇO FILHO;FLF;Rua Barão do Rio Branco;2101;;Centro;60025062;28;0;0;0;0;20;2;3;3;0;0;0;0;0;0;1;1;0;0;0;0;0;0;0;0;69;69;24;45;0;0;11;54;4;4;0;4;31;34;16;13;13;5;8;2;8;4;13;0;48;1;0;5;69;0;0
2014;Centro-Oeste;5;Distrito Federal;DF;53;Brasília;5300108;1;Distrito Federal;1;Brasília;1;2;4;CESB - CENTRO DE EDUCACAO SUPERIOR DE BRASILIA LTDA;740;1060;CENTRO UNIVERSITÁRIO DO INSTITUTO DE EDUCAÇÃO SUPERIOR DE BRASÍLIA - IESB;IESB;SGAN Quadra 609 Modulo D Av. L2 Norte - Asa Norte;S/N;Bloco D - Avenida L2;Asa Norte;70850090;347;1;10;4;15;92;93;53;45;12;14;4;4;0;0;0;1;0;0;0;0;0;0;0;0;571;571;217;354;0;0;145;344;82;134;2;132;270;167;43;119;136;87;73;59;29;25;113;9;418;6;0;4;547;24;0
2014;Sudeste;3;Espírito Santo;ES;32;Vila Velha;3205200;0;Central Espírito-santense;3;Vitória;9;3;5;INSTITUTO ENSINAR BRASIL;218;1063;Faculdade Doctum de Vila Velha;DOCTUM;Rua Lúcio Bacelar;490;;Praia da Costa;29101030;18;1;1;1;0;8;2;2;0;2;1;0;0;0;0;0;0;0;0;0;0;0;0;0;0;22;22;4;18;0;0;7;10;5;0;0;0;22;0;0;3;5;4;4;2;1;3;16;0;4;1;0;1;22;0;0
2014;Sudeste;3;Espírito Santo;ES;32;Vitória;3205309;1;Central Espírito-santense;3;Vitória;9;3;5;INSTITUTO ENSINAR BRASIL;218;1064;Faculdade Doctum de Vitória;DOCTUM;Rua Joaquim Leopoldino Lopes;230;;Consolação;29045580;35;1;2;4;2;5;3;6;3;0;1;4;3;1;0;0;0;0;0;0;0;0;0;0;0;46;46;14;32;0;0;9;30;7;0;0;0;46;0;2;7;10;8;9;3;4;3;31;1;8;1;0;5;46;0;0
2014;Norte;1;Tocantins;TO;17;Palmas;1721000;1;Oriental do Tocantins;2;Porto Nacional;6;3;5;ASSOCIACAO OBJETIVO DE ENSINO SUPERIOR - ASSOBES;519;1066;INSTITUTO DE ENSINO E PESQUISA OBJETIVO;IEPO;Acsu-Se;40;Conjunto 02 - Lote 0;Centro;77103040;65;2;1;2;1;30;14;5;3;5;2;0;0;0;0;0;0;0;0;0;0;0;0;0;0;105;84;37;47;0;0;71;11;2;10;0;10;31;43;6;30;17;17;5;6;0;3;49;3;25;1;0;1;84;0;1
2014;Centro-Oeste;5;Goiás;GO;52;Jussara;5212204;0;Noroeste Goiano;1;Rio Vermelho;2;3;4;CENTRO DE CIENCIAS DE JUSSARA LTDA - EPP;744;1067;FACULDADE DE JUSSARA;FAJ;Rodovia Br 070, Km 24;s/n;SAÍDA P/ GOIÁS;Zona Rural;76270000;25;2;2;4;0;2;3;8;0;0;3;0;1;0;0;1;0;0;0;0;0;0;0;0;0;37;36;12;24;0;0;24;11;1;8;8;0;15;13;8;10;5;5;2;3;0;3;21;0;3;0;0;3;36;0;0
2014;Sudeste;3;Minas Gerais;MG;31;Iturama;3134400;0;Triângulo Mineiro/Alto Paranaíba;5;Frutal;21;3;5;INSTITUICAO ITURAMENSE DE ENSINO SUPERIOR;745;1068;FACULDADE ALDETE MARIA ALVES;FAMA;AV. DOMINGOS TEIXEIRA;664;;RESIDENCIAL RECANTO DOS LAGOS;38280000;51;0;0;4;1;7;5;8;2;12;4;5;3;0;0;1;1;0;0;0;0;0;0;0;0;34;34;16;18;0;0;8;21;5;12;0;12;21;1;1;5;13;2;5;4;3;1;21;0;1;0;0;10;34;0;0
2014;Sudeste;3;Minas Gerais;MG;31;Unaí;3170404;0;Noroeste de Minas;1;Unaí;1;3;5;CAMPANHA NACIONAL DE ESCOLAS DA COMUNIDADE;407;1070;INSTITUTO DE ENSINO SUPERIOR CENECISTA;INESC;Rua Celina Lisboa Frederico;142;;Centro;38610000;87;4;3;3;3;13;2;11;6;10;9;6;14;2;1;1;1;0;0;0;0;0;0;0;0;94;94;39;55;0;0;44;40;10;10;9;1;48;36;12;20;13;18;18;8;4;1;37;1;18;0;0;32;93;1;0
2014;Centro-Oeste;5;Mato Grosso do Sul;MS;50;Campo Grande;5002704;1;Centro Norte de Mato Grosso do Sul;2;Campo Grande;4;3;5;FUNDACAO LOWTONS DE EDUCACAO E CULTURA - FUNLEC;747;1071;INSTITUTO DE ENSINO SUPERIOR DA FUNLEC;IESF;Rua Cel. Cacildo Arantes;322;;Cachoeira II;79040450;12;0;1;3;1;2;1;1;0;0;0;1;2;0;0;1;0;0;0;0;0;0;0;0;0;40;40;26;14;0;2;15;19;4;0;0;0;0;40;2;7;7;6;7;8;2;1;21;6;9;0;0;4;40;0;1
2014;Centro-Oeste;5;Mato Grosso;MT;51;Cuiabá;5103403;1;Centro-Sul Mato-grossense;4;Cuiabá;17;3;4;INSTITUTO DE EDUCACAO BOM JESUS DE CUIABA - EPP;748;1072;FACULDADE AFIRMATIVO;FAFI;Rua Coronel Pimenta Bueno;534;;Dom Aquino;78015390;14;2;0;0;0;2;5;1;0;4;0;0;0;0;0;0;0;0;0;0;0;0;0;0;0;37;25;14;11;0;0;22;3;0;0;0;0;0;25;5;4;6;2;2;3;1;2;11;0;2;0;0;12;25;0;0
2014;Nordeste;2;Paraíba;PB;25;João Pessoa;2507507;1;Mata Paraibana;4;João Pessoa;22;3;4;SOCIEDADE DE ENSINO SUPERIOR DA PARAIBA SOCIEDADE SIMPLES LTDA;750;1075;INSTITUTO DE EDUCAÇÃO SUPERIOR DA PARAÍBA;IESP;Avenida João Maurício;1819;;BESSA;58037010;78;2;11;2;3;11;21;11;10;2;2;3;0;0;0;1;0;0;0;0;0;0;0;0;0;168;151;62;89;0;0;53;82;16;71;0;71;59;21;19;30;37;25;13;11;7;9;2;0;11;1;0;136;151;0;0
2014;Nordeste;2;Paraíba;PB;25;Cajazeiras;2503704;0;Sertão Paraibano;1;Cajazeiras;2;3;5;FUNDACAO DE ENSINO SUPERIOR DE CAJAZEIRAS;751;1076;FACULDADE DE FILOSOFIA, CIÊNCIAS E LETRAS DE CAJAZEIRAS;FAFIC;Rua Padre Ibiapina;s/n;;Centro;58900000;44;2;4;2;1;3;4;16;4;7;0;0;1;0;0;0;0;0;0;0;0;0;0;0;0;59;57;25;32;0;0;32;23;2;13;0;13;27;17;9;20;13;7;5;1;0;2;22;3;27;0;0;3;57;0;1
2014;Nordeste;2;Pernambuco;PE;26;Recife;2611606;1;Metropolitana de Recife;5;Recife;17;3;4;IREP SOCIEDADE DE ENSINO SUPERIOR, MEDIO E FUNDAMENTAL LTDA.;545;1077;Faculdade Estácio do Recife - Estácio FIR;Estácio FIR;Avenida Engenheiro Abdias de Carvalho;1678;;Madalena;50720635;98;0;0;0;2;46;31;10;7;0;1;1;0;0;0;1;1;0;0;0;0;0;0;0;0;279;273;153;120;0;0;81;151;41;69;0;69;104;100;31;68;70;27;23;20;15;19;215;4;4;0;0;1;272;1;0
2014;Sul;4;Paraná;PR;41;Campo Mourão;4104303;0;Centro Ocidental Paranaense;2;Campo Mourão;5;3;4;CEI - CENTRO EDUCACIONAL INTEGRADO LTDA;2944;1078;FACULDADE INTEGRADO DE CAMPO MOURÃO;CEI;Av. Irmãos Pereira;670;;CENTRO;87301010;180;13;5;24;15;27;34;27;11;15;8;0;1;0;0;1;1;0;0;0;0;0;0;0;0;166;166;110;56;0;0;71;70;25;47;6;41;57;62;32;53;30;23;12;11;4;1;149;0;5;2;0;6;166;0;0
2014;Sul;4;Paraná;PR;41;Maringá;4115200;0;Norte Central Paranaense;3;Maringá;9;3;5;CENTRO DE ENSINO SUPERIOR DO PARANA - CESPAR;754;1079;FACULDADE MARINGÁ;CESPAR;Avenida Prudente de Moraes;815;;ZONA 07;87010020;51;4;5;0;0;5;1;13;9;10;4;0;0;0;0;1;0;0;0;0;0;0;0;0;0;80;66;23;43;0;0;13;49;4;10;4;6;37;19;1;18;16;10;8;8;3;2;52;1;1;2;0;4;66;0;0
2014;Sudeste;3;Rio de Janeiro;RJ;33;Petrópolis;3303906;0;Metropolitana do Rio de Janeiro;6;Serrana;15;3;5;FUNDACAO OCTACILIO GUALBERTO;328;1080;FACULDADE ARTHUR SÁ EARP NETO;FASE;Avenida Barão do Rio Branco;905 a 1003;;Centro;25680120;228;9;30;10;3;46;32;33;13;30;14;6;2;0;0;0;1;0;0;0;0;0;0;0;0;253;242;150;92;0;0;62;124;56;58;0;58;169;15;8;27;33;36;35;39;33;31;216;1;5;2;0;6;240;2;3
2014;Sudeste;3;Rio de Janeiro;RJ;33;Resende;3304201;0;Sul Fluminense;5;Vale do Paraíba Fluminense;11;3;5;ASSOCIACAO EDUCACIONAL DOM BOSCO;327;1081;FACULDADE DE ENGENHARIA DE RESENDE;FER;Avenida Professor Antonio Esteves;1;;Morada da Colina;27523000;112;3;4;9;9;18;13;31;22;1;0;0;2;0;0;0;1;0;0;0;0;0;0;0;0;61;61;15;46;0;0;15;38;8;8;0;8;15;38;3;13;9;13;4;8;6;5;25;1;2;0;0;19;61;0;0
2014;Nordeste;2;Rio Grande do Norte;RN;24;Natal;2408102;1;Leste Potiguar;4;Natal;18;4;1;INSTITUTO FEDERAL DE EDUCACAO, CIENCIA E TECNOLOGIA DO RIO GRANDE DO NORTE;8982;1082;INSTITUTO FEDERAL DE EDUCAÇÃO, CIÊNCIA E TECNOLOGIA DO RIO GRANDE DO NORTE;IFRN;Avenida Senador Salgado Filho;1559;;Tirol;59015000;1096;1;3;0;10;42;190;176;228;207;187;23;21;8;0;1;1;0;0;0;0;0;0;0;0;576;553;183;370;0;54;83;279;137;517;478;39;15;21;106;136;92;70;60;46;26;17;180;11;107;2;0;131;551;2;0
2014;Sul;4;Rio Grande do Sul;RS;43;Bento Gonçalves;4302105;0;Nordeste Rio-grandense;2;Caxias do Sul;16;3;5;CAMPANHA NACIONAL DE ESCOLAS DA COMUNIDADE;407;1084;FACULDADE CENECISTA DE BENTO GONÇALVES;FACEBG;Rua Arlindo Franklin Barbosa;460;;São Roque;95700000;29;5;1;0;0;5;5;3;3;2;1;1;3;0;0;1;1;0;0;0;0;0;0;0;0;70;69;41;28;0;0;6;48;15;8;0;8;41;20;10;10;12;20;4;5;4;4;63;0;1;0;0;5;69;0;0
2014;Sul;4;Rio Grande do Sul;RS;43;Santa Maria;4316907;0;Centro Ocidental Rio-grandense;3;Santa Maria;18;3;5;INSTITUTO METODISTA CENTENARIO;755;1085;FACULDADE METODISTA DE SANTA MARIA;FAMES;RUA DOUTOR TURI;2003;;CENTRO;97050180;64;1;0;3;0;6;10;31;7;0;0;2;2;2;0;0;1;0;0;0;0;0;0;0;0;50;50;26;24;0;0;3;42;5;7;0;7;19;24;3;12;10;13;2;5;1;4;47;1;1;0;0;1;50;0;2
2014;Norte;1;Rondônia;RO;11;Colorado do Oeste;1100064;0;Leste Rondoniense;2;Colorado do Oeste;8;3;5;CENTRO DE ENSINO SUPERIOR DE COLORADO D''OESTE CESUC;756;1086;FACULDADE DE EDUCAÇÃO DE COLORADO DO OESTE;FAEC;Avenida Paulo de Assis Ribeiro;5.681;Caixa Postal 21;Centro;78996000;4;0;0;0;0;2;1;0;0;1;0;0;0;0;0;1;0;0;0;0;0;0;0;0;0;33;33;17;16;0;0;23;8;2;5;0;5;25;3;4;4;3;7;5;4;3;3;17;2;1;0;0;13;33;0;0
2014;Norte;1;Rondônia;RO;11;Porto Velho;1100205;1;Madeira-Guaporé;1;Porto Velho;1;3;5;SOCIEDADE DE PESQUISA EDUCACAO E CULTURA, DR. APARICIO CARVALHO DE MORAES LTDA;757;1087;FACULDADES INTEGRADAS APARÍCIO CARVALHO;FIMCA;Rua Araras;241;;Jardim Eldorado;78912640;290;10;7;10;5;92;36;29;22;21;36;3;4;6;9;1;1;0;0;0;0;0;0;0;0;303;301;181;120;0;0;160;114;27;120;0;120;181;0;56;72;50;40;40;22;11;10;160;21;93;4;0;13;301;0;3
2014;Nordeste;2;Sergipe;SE;28;Aracaju;2800308;1;Leste Sergipano;3;Aracaju;11;3;4;SOCIEDADE EDUCACIONAL E CULTURAL SERGIPE DEL REY LTDA;759;1090;FACULDADE SÃO LUÍS DE FRANÇA;FSLF;Rua Laranjeiras;1.838;;Getúlio Vargas;49055380;30;1;3;1;1;2;4;5;2;10;1;0;0;0;0;1;1;0;0;0;0;0;0;0;0;22;22;12;10;0;0;3;12;7;11;9;2;11;0;1;1;1;6;6;1;2;4;8;2;10;0;1;1;22;0;0
2014;Sudeste;3;São Paulo;SP;35;Bauru;3506003;0;Bauru;4;Bauru;20;3;4;ASSOCIACAO RANIERI DE EDUCACAO E CULTURA LTDA;760;1092;FACULDADES INTEGRADAS DE BAURU;FIB;Rua Rodolfina Dias Domingues;11;Quinta Ranieri;Jardim Ferraz;17056100;59;0;2;3;4;17;7;16;6;1;2;1;0;0;0;1;1;0;0;0;0;0;0;0;0;166;162;76;86;0;0;43;75;44;24;0;24;136;2;16;23;27;40;21;14;11;10;26;1;0;1;0;92;161;1;0
2014;Sudeste;3;São Paulo;SP;35;Presidente Epitácio;3541307;0;Presidente Prudente;8;Presidente Prudente;36;3;5;INSTITUTO EDUCACIONAL DO ESTADO DE SAO PAULO - IESP;289;1096;FACULDADE DE PRESIDENTE EPITÁCIO - FAPE;FAPE;Rua Pernambuco;17/mai;;Centro;19470000;43;1;0;3;5;9;10;11;2;2;0;0;0;0;0;1;0;0;0;0;0;0;0;0;0;76;76;33;43;0;0;50;22;4;26;0;26;32;18;5;24;11;6;12;4;7;7;59;1;11;0;0;4;76;0;0
2014;Sudeste;3;São Paulo;SP;35;São Paulo;3550308;1;Metropolitana de São Paulo;15;São Paulo;61;3;5;UNIAO EDUCACIONAL DE SAO PAULO;765;1097;FACULDADES INTEGRADAS DE SÃO PAULO;FISP;Rua Tagua;150;;Liberdade;1508010;15;0;0;0;0;1;1;3;5;2;3;0;0;0;0;1;1;0;0;0;0;0;0;0;0;93;92;24;68;0;0;26;51;15;16;0;16;34;42;2;14;16;11;12;12;12;13;53;1;2;2;0;23;91;1;0
2014;Sudeste;3;São Paulo;SP;35;São Paulo;3550308;1;Metropolitana de São Paulo;15;São Paulo;61;3;5;ORGANIZACAO PAULISTANA EDUCACIONAL E CULTURAL;636;1099;FACULDADE DE EDUCAÇÃO E CIÊNCIAS GERENCIAIS DE SÃO PAULO;FECG-SP;Rua Santa Crescência;443;;Ferreira/Butantã;5524020;34;3;1;2;1;10;7;5;5;0;0;0;0;0;0;0;0;0;0;0;0;0;0;0;0;23;23;7;16;0;0;6;14;3;2;0;2;9;12;1;2;0;1;2;7;4;6;21;0;1;0;0;0;23;0;0
2014;Sudeste;3;São Paulo;SP;35;São Paulo;3550308;1;Metropolitana de São Paulo;15;São Paulo;61;3;5;ESCOLA DE EDUCACAO SUPERIOR SAO JORGE;905;1100;FACULDADE CARLOS DRUMMOND DE ANDRADE;FCDA;Rua Prof. Pedreira de Freitas;415;;Tatuapé;3312050;173;0;0;11;6;82;40;18;7;1;1;4;1;2;0;1;0;0;0;0;0;0;0;0;0;106;106;33;73;0;0;18;62;26;17;0;17;84;5;0;11;21;11;12;23;11;17;61;4;6;1;0;24;103;3;0
2014;Nordeste;2;Ceará;CE;23;Fortaleza;2304400;1;Metropolitana de Fortaleza;3;Fortaleza;16;2;4;IREP SOCIEDADE DE ENSINO SUPERIOR, MEDIO E FUNDAMENTAL LTDA.;545;1107;Centro Universitário Estácio do Ceará;Estácio FIC;Rua Vicente Linhares;308;;Aldeota;60135270;268;0;1;3;18;90;102;27;14;5;3;2;3;0;0;1;1;0;0;0;0;0;0;0;0;478;466;266;200;0;0;133;290;43;117;0;117;92;257;21;104;81;80;60;51;36;33;258;3;189;2;0;0;463;3;1
2014;Centro-Oeste;5;Distrito Federal;DF;53;Brasília;5300108;1;Distrito Federal;1;Brasília;1;2;5;INSTITUTO EURO AMERICANO DE EDUCACAO CIENCIA TECNOLOGIA;770;1113;CENTRO UNIVERSITÁRIO EURO-AMERICANO;UNIEURO;SCES Trecho 0 - Conjunto 5;s/n;Avenida das Nações S;Asa Sul;70200001;139;0;0;5;3;63;39;14;6;4;2;1;2;0;0;1;1;0;0;0;0;0;0;0;0;263;255;111;144;0;0;54;145;56;90;0;90;165;0;13;50;57;51;25;26;14;19;148;3;67;0;0;12;251;4;1
2014;Nordeste;2;Maranhão;MA;21;São Luís;2111300;1;Norte Maranhense;1;Aglomeração Urbana de São Luís;2;3;5;ASSOCIACAO DE PAIS E AMIGOS DOS EXCEPCIONAIS DE S LUIZ;772;1115;FACULDADE SANTA TEREZINHA;CEST;Avenida Casemiro Júnior;12;;Anil;65045180;143;1;13;3;8;43;36;31;5;1;2;0;0;0;0;1;1;0;0;0;0;0;0;0;0;184;176;119;57;0;0;110;56;10;23;0;23;153;0;22;35;32;27;29;19;5;7;48;3;60;0;0;65;176;0;0
2014;Sudeste;3;São Paulo;SP;35;Mirassol;3530300;0;São José do Rio Preto;1;São José do Rio Preto;4;3;4;SOCIEDADE MANTENEDORA DE ENSINO SUPERIOR DE MIRASSOL LTDA. - SOMESMI;775;1118;UNIÃO DAS ESCOLAS DO GRUPO FAIMI DE EDUCAÇÃO;FAIMI;Avenida Luis Fernando Moreira;1005;;Jardim São José;15130000;43;7;2;1;2;14;8;5;2;2;0;0;0;0;0;1;0;0;0;0;0;0;0;0;0;82;80;32;48;0;0;41;31;8;5;0;5;43;32;7;16;17;15;11;9;4;1;65;2;1;1;0;1;80;0;1
2014;Sudeste;3;Rio de Janeiro;RJ;33;Campos dos Goytacazes;3301009;0;Norte Fluminense;2;Campos dos Goytacazes;3;4;1;INSTITUTO FEDERAL DE EDUCACAO, CIENCIA E TECNOLOGIA FLUMINENSE.;9068;1120;INSTITUTO FEDERAL DE EDUCAÇÃO, CIÊNCIA E TECNOLOGIA FLUMINENSE;IF Fluminense;Rua Doutor Siqueira;273;;Parque Dom Bosco;28030130;697;0;0;0;0;65;115;99;92;151;95;49;26;4;1;1;0;0;0;0;0;0;0;0;0;424;424;170;254;0;50;49;200;125;391;278;113;33;0;55;91;70;65;60;42;28;13;65;6;8;0;0;327;423;1;0
2014;Sudeste;3;São Paulo;SP;35;Osvaldo Cruz;3534609;0;Presidente Prudente;8;Adamantina;35;3;5;REDE GONZAGA DE ENSINO SUPERIOR - REGES;2454;1122;FACULDADE REGES DE OSVALDO CRUZ;;Rua Chile;501;;Jardim das Bandeiras;17700000;7;0;0;0;0;0;0;4;0;2;0;0;1;0;0;1;1;0;0;0;0;0;0;0;0;25;25;16;9;0;0;4;16;5;4;2;2;18;3;2;3;6;2;2;2;2;6;22;0;1;1;0;1;25;0;0
2014;Nordeste;2;Bahia;BA;29;Salvador;2927408;1;Metropolitana de Salvador;5;Salvador;21;3;4;ASSOCIACAO EDUCACIONAL UNYAHNA S/C;736;1123;INSTITUTO DE EDUCAÇÃO SUPERIOR UNYAHNA DE SALVADOR;IESUS;Rua Bicuiba;S/N;Alameda Patamares;Patamares;41680440;54;1;1;3;6;11;11;10;7;2;1;1;0;0;0;0;1;0;0;0;0;0;0;0;0;26;26;12;14;0;0;13;11;2;2;0;2;13;11;1;5;2;7;5;3;1;2;6;0;10;0;0;7;25;1;0
2014;Nordeste;2;Bahia;BA;29;Barreiras;2903201;0;Extremo Oeste Baiano;1;Barreiras;1;3;4;ASSOCIACAO EDUCACIONAL UNYAHNA S/C;736;1124;INSTITUTO DE EDUCAÇÃO SUPERIOR UNYAHNA DE BARREIRAS;IESUB;Rua Dom Pedro II;63;Prédio Unyahna;Centro;47805336;41;2;0;1;0;10;8;9;4;7;0;0;0;0;0;0;0;0;0;0;0;0;0;0;0;64;64;32;32;0;0;51;12;1;1;0;1;62;1;11;16;14;4;6;6;4;3;20;2;12;0;0;29;63;1;0
2014;Sul;4;Paraná;PR;41;Curitiba;4106902;1;Metropolitana de Curitiba;10;Curitiba;37;3;5;INSTITUTO DE CULTURA ESPIRITA DO PARANA;662;1125;FACULDADES INTEGRADAS ESPÍRITA;FIES;Rua Tobias de Macedo Júnior;246;;Santo Inácio;82010340;15;0;0;2;4;2;2;3;1;0;1;0;0;0;0;0;0;0;0;0;0;0;0;0;0;41;41;16;25;0;0;18;18;5;0;0;0;0;41;1;7;11;5;8;1;2;6;3;0;0;0;0;35;41;0;2
2014;Sul;4;Paraná;PR;41;Guarapuava;4109401;0;Centro-Sul Paranaense;8;Guarapuava;29;1;2;UNIVERSIDADE ESTADUAL DO PARANA;37;1126;UNIVERSIDADE ESTADUAL DO CENTRO OESTE;UNICENTRO;Rua Salvatore Renna;875;;Santa Cruz;85015430;239;6;1;2;6;6;29;23;41;49;34;17;23;1;1;1;1;0;0;0;0;0;0;0;0;948;807;457;350;0;19;87;318;383;732;665;67;1;74;127;153;146;146;96;82;31;26;687;1;0;1;0;117;807;0;0
2014;Sudeste;3;Minas Gerais;MG;31;Itaúna;3133808;0;Oeste de Minas;9;Divinópolis;43;1;5;FUNDACAO UNIVERSIDADE DE ITAUNA;227;1128;UNIVERSIDADE DE ITAÚNA;UI;Rodovia Mg 431 Km 45;s/n;;Campus Verde;35680142;375;34;56;22;29;42;45;56;31;18;40;1;1;0;0;1;1;0;0;0;0;0;0;0;0;430;425;155;270;0;0;80;245;100;149;0;149;132;144;15;33;72;64;54;59;52;76;364;5;45;2;0;8;421;4;3
2014;Sudeste;3;São Paulo;SP;35;São José do Rio Preto;3549805;0;São José do Rio Preto;1;São José do Rio Preto;4;2;5;SOCIEDADE ASSISTENCIAL DE EDUCACAO E CULTURA;107;1129;CENTRO UNIVERSITÁRIO DO NORTE PAULISTA;UNORP;Rua Ipiranga;3460;;Jardim Alto Rio Preto;15020040;103;3;3;13;11;23;13;22;10;0;1;0;2;0;2;0;1;0;0;0;0;0;0;0;0;199;192;79;113;0;0;71;90;31;39;0;39;100;53;14;41;30;24;29;16;14;24;119;1;5;1;0;31;191;1;1
2014;Sudeste;3;São Paulo;SP;35;Birigui;3506508;0;Araçatuba;3;Birigui;18;3;5;INSTITUTO METODISTA DE EDUCACAO - IMED;238;1130;FACULDADE METODISTA DE CIÊNCIAS HUMANAS E EXATAS;METODISTA;Rua 9 de Julho;175;;Centro;16200060;10;0;0;0;0;2;1;4;1;0;1;1;0;0;0;0;0;0;0;0;0;0;0;0;0;24;24;6;18;0;0;13;10;1;0;0;0;10;14;3;3;7;4;4;2;0;1;21;1;0;0;0;0;24;0;0
2014;Nordeste;2;Piauí;PI;22;Teresina;2211001;1;Centro-Norte Piauiense;2;Teresina;3;3;4;ASSOCIACAO TERESINENSE DE ENSINO S/C LTDA;781;1131;FACULDADE SANTO AGOSTINHO;FSA;Avenida Valter Alencar;665;Sul;Sao Pedro;64019625;220;2;5;5;16;54;41;17;12;54;9;4;1;0;0;0;1;0;0;0;0;0;0;0;0;258;258;135;123;0;0;84;160;14;37;0;37;221;0;35;45;61;44;28;21;10;14;99;5;128;0;0;23;258;0;2
2014;Nordeste;2;Pernambuco;PE;26;Igarassu;2606804;0;Metropolitana de Recife;5;Itamaracá;16;3;5;ASSOCIACAO IGARASSUENSE DE EDUCACAO E CULTURA;783;1136;FACULDADE DE CIÊNCIAS HUMANAS E SOCIAIS DE IGARASSU;FACIG;RODOVIA BR 101-NORTE, KM 25;S/N;;CENTRO;53600000;46;0;0;1;3;14;14;7;2;4;1;0;0;0;0;1;1;0;0;0;0;0;0;0;0;42;42;18;24;0;0;5;30;7;7;2;5;33;2;3;7;5;3;6;10;5;3;12;6;10;0;0;12;42;0;0
2014;Sudeste;3;Minas Gerais;MG;31;Belo Horizonte;3106200;1;Metropolitana de Belo Horizonte;7;Belo Horizonte;30;3;4;SIEMG SISTEMA INTEGRADO DE ENSINO DE MINAS GERAIS LTDA;785;1139;FACULDADE DE ESTUDOS ADMINISTRATIVOS DE MINAS GERAIS - FEAD-MG;FEAD - MG;Rua Cláudio Manoel;1162;;Funcionários;30140100;177;14;8;28;10;39;25;20;11;8;3;6;2;0;3;0;1;0;0;0;0;0;0;0;0;175;163;83;80;0;0;21;99;43;7;1;6;72;84;6;20;44;29;25;20;7;12;56;1;20;1;0;75;163;0;1
2014;Sudeste;3;Rio de Janeiro;RJ;33;Rio de Janeiro;3304557;1;Metropolitana do Rio de Janeiro;6;Rio de Janeiro;18;3;5;ASSOCIACAO DE CULTURA E EDUCACAO SANTA TERESA;787;1141;FACULDADE GAMA E SOUZA;FGS;Rua Leopoldina Rego;502;;Olaria;21021521;36;0;1;0;0;15;6;4;8;1;1;0;0;0;0;0;1;0;0;0;0;0;0;0;0;103;103;58;45;0;0;6;72;25;47;0;47;56;0;3;10;18;18;16;16;7;15;46;3;8;0;0;37;100;3;0
2014;Sudeste;3;Espírito Santo;ES;32;Vitória;3205309;1;Central Espírito-santense;3;Vitória;9;3;4;SOCIEDADE DE ENSINO SUPERIOR DE VITORIA LTDA;658;1142;FACULDADES INTEGRADAS DE VITÓRIA;FDV;Rua Dr. João Carlos de Sousa;779;;SANTA LÚCIA;29056919;49;1;0;2;2;12;5;17;3;5;0;1;1;0;0;1;0;0;0;0;0;0;0;0;0;60;60;18;42;0;0;0;36;24;30;0;30;30;0;1;8;21;14;8;2;3;3;41;0;19;0;0;0;59;1;0
2014;Nordeste;2;Pernambuco;PE;26;Timbaúba;2615300;0;Mata Pernambucana;4;Mata Setentrional Pernambucana;13;3;5;ASSOCIACAO DE ENSINO SUPERIOR SANTA TEREZINHA;718;1143;Faculdade de Ciências de Timbaúba;FACET;Av Antonio Xavier de Morais;5;;Sapucaia;55870000;23;1;6;0;0;7;3;2;1;3;0;0;0;0;0;1;0;0;0;0;0;0;0;0;0;29;29;14;15;0;0;16;11;2;13;2;11;16;0;1;7;4;2;5;4;2;4;18;0;10;0;0;0;29;0;0
2014;Sudeste;3;São Paulo;SP;35;Mairiporã;3528502;0;Metropolitana de São Paulo;15;Franco da Rocha;58;3;5;INSTITUTO MAIRIPORA DE ENSINO SUPERIOR;788;1144;FACULDADE DE CIÊNCIAS HUMANAS;IMENSU;AV. THOMAZ RODRIGUES DA CRUZ;1113;;BARREIRO;7600000;9;0;0;0;0;5;1;1;1;1;0;0;0;0;0;1;1;0;0;0;0;0;0;0;0;23;23;9;14;0;0;3;18;2;1;0;1;9;13;0;1;3;4;6;3;0;6;20;0;2;0;0;0;23;0;0
2014;Sudeste;3;São Paulo;SP;35;Salto;3545209;0;Macro Metropolitana Paulista;12;Sorocaba;46;2;4;SOCIEDADE DE EDUCACAO NOSSA SENHORA DO PATROCINIO S/S LTDA;120;1149;CENTRO UNIVERSITÁRIO NOSSA SENHORA DO PATROCÍNIO;CEUNSP;Praça Antônio Vieira Tavares;73;Campus V;Centro;13320000;389;4;2;6;6;216;67;43;32;7;3;0;3;0;0;1;0;0;0;0;0;0;0;0;0;426;411;208;203;0;0;262;119;30;105;0;105;27;279;22;70;88;62;65;58;25;21;376;0;14;2;0;4;410;1;0
2014;Sudeste;3;São Paulo;SP;35;São Paulo;3550308;1;Metropolitana de São Paulo;15;São Paulo;61;3;5;SERVICO NACIONAL DE APRENDIZAGEM INDUSTRIAL;796;1150;FACULDADE SENAI DE TECNOLOGIA GRÁFICA;SP SENAI;Rua Bresser;2315;;Mooca;3162030;10;0;0;0;0;3;1;2;3;1;0;0;0;0;0;0;1;0;0;0;0;0;0;0;0;29;29;6;23;0;4;17;7;1;11;0;11;9;9;0;2;3;6;5;4;5;4;22;4;1;0;0;2;29;0;0
2014;Nordeste;2;Sergipe;SE;28;Aracaju;2800308;1;Leste Sergipano;3;Aracaju;11;3;4;ASSOCIACAO DE ENSINO E PESQUISA GRACCHO CARDOSO S/C LTDA - ME;790;1151;FACULDADE DE ADMINISTRAÇÃO E NEGÓCIOS DE SERGIPE;FANESE;Avenida Delmiro Gouveia;s/n;Shopping Riomar 2o p;Coroa do Meio;49035800;89;2;0;5;2;32;20;8;3;2;5;5;4;0;1;0;0;0;0;0;0;0;0;0;0;113;100;26;74;0;0;23;51;26;10;0;10;88;2;1;10;30;21;16;7;5;10;13;4;62;0;0;20;99;1;0
2014;Sudeste;3;Rio de Janeiro;RJ;33;Rio de Janeiro;3304557;1;Metropolitana do Rio de Janeiro;6;Rio de Janeiro;18;1;5;ASSOCIACAO SOCIEDADE BRASILEIRA DE INSTRUCAO;134;1153;UNIVERSIDADE CÂNDIDO MENDES;UCAM;Rua da Assembléia;10;Sala 4208;Centro;20011901;895;21;49;44;62;245;231;115;80;19;24;2;2;1;0;1;1;0;0;0;0;0;0;0;0;590;574;215;359;0;0;78;300;196;212;0;212;112;250;16;55;82;95;82;84;62;98;437;17;92;8;3;11;572;2;0
2014;Centro-Oeste;5;Mato Grosso do Sul;MS;50;Corumbá;5003207;0;Pantanais Sul Mato-grossense;1;Baixo Pantanal;1;3;5;MISSAO SALESIANA DE MATO GROSSO;270;1155;FACULDADE SALESIANA DE SANTA TERESA;FSST;Rua Dom Aquino;1.119;;Centro;79301970;52;1;1;1;0;8;6;5;3;7;11;4;4;1;0;0;0;0;0;0;0;0;0;0;0;25;25;7;18;0;0;18;6;1;7;0;7;5;13;2;9;5;5;2;2;0;0;6;1;4;0;0;13;25;0;0
2014;Sudeste;3;Rio de Janeiro;RJ;33;Itaboraí;3301900;0;Metropolitana do Rio de Janeiro;6;Rio de Janeiro;18;3;5;CAMPANHA NACIONAL DE ESCOLAS DA COMUNIDADE;407;1156;FACULDADE CENECISTA DE ITABORAÍ;FACNEC;Rua Presidente Costa e Silva;212;;Centro;24800000;16;3;1;1;1;4;1;4;0;0;1;0;0;0;0;1;1;0;0;0;0;0;0;0;0;30;30;16;14;0;0;4;22;4;3;0;3;11;16;1;5;6;8;5;3;2;0;13;0;2;0;0;4;30;0;0
2014;Sudeste;3;Espírito Santo;ES;32;Santa Teresa;3204609;0;Central Espírito-santense;3;Santa Teresa;8;3;5;SERVICO SOCIAL EDUCACIONAL BENEFICENTE SESEBE;793;1157;ESCOLA SUPERIOR SÃO FRANCISCO DE ASSIS;ESFA;Rua Bernardino Monteiro;700;;Dois Pinheiros;29650000;69;7;9;4;1;18;7;4;7;9;2;1;0;0;0;0;1;0;0;0;0;0;0;0;0;81;81;35;46;0;0;29;38;14;4;0;4;14;63;9;26;17;11;6;7;2;3;70;1;9;0;0;1;81;0;0
2014;Sudeste;3;Espírito Santo;ES;32;Vitória;3205309;1;Central Espírito-santense;3;Vitória;9;3;4;UNIAO CAPIXABA DE ENSINO SUPERIOR LTDA - UCES;794;1159;CENTRO DE ENSINO SUPERIOR DE VITÓRIA;CESV;Rua Wellington de Freitas;265;;Jardim Camburi;29090240;11;0;0;0;1;4;1;2;1;1;0;1;0;0;0;1;1;0;0;0;0;0;0;0;0;23;23;15;8;0;0;8;9;6;2;0;2;12;9;0;3;9;1;2;2;3;3;12;0;7;0;0;2;23;0;2
2014;Centro-Oeste;5;Goiás;GO;52;Goiânia;5208707;1;Centro Goiano;3;Goiânia;10;3;4;CENTRO TECNOLOGICO CAMBURY LTDA;795;1160;FACULDADE CAMBURY;CAMBURY;Avenida C 07;1094;Quadra 08 Lote 01 E;Setor Sol Nascente;74410220;163;6;13;49;38;0;0;20;18;14;5;0;0;0;0;1;1;0;0;0;0;0;0;0;0;163;147;67;80;0;0;89;51;7;22;0;22;69;56;18;32;30;24;20;13;7;3;60;1;23;3;0;49;147;0;1
2014;Sudeste;3;São Paulo;SP;35;São Paulo;3550308;1;Metropolitana de São Paulo;15;São Paulo;61;3;5;INSPER - INSTITUTO DE ENSINO E PESQUISA;2553;1161;INSPER INSTITUTO DE ENSINO E PESQUISA;INSPER;Rua Quatá;300;;Vila Olímpia;4546042;257;1;0;0;1;28;20;100;53;23;11;7;8;3;2;1;1;0;0;0;0;0;0;0;0;114;114;30;84;0;1;2;19;92;54;0;54;26;34;1;9;29;35;19;12;6;3;104;0;1;3;0;4;111;3;0
2014;Centro-Oeste;5;Mato Grosso;MT;51;Alta Floresta;5100250;0;Norte Mato-grossense;1;Alta Floresta;2;3;5;UNIFLOR-UNIAO DAS FACULDADES DE ALTA FLORESTA;683;1162;FACULDADE DE ALTA FLORESTA;FAF;Avenida Leandro Adorno;s/n;Setor Esportivo;Alta Floresta;78580000;18;0;0;0;0;1;2;6;2;4;3;0;0;0;0;1;0;0;0;0;0;0;0;0;0;28;27;14;13;0;0;12;9;6;6;2;4;7;14;2;5;4;5;4;2;3;2;20;0;6;0;0;1;27;0;0
2014;Nordeste;2;Paraíba;PB;25;João Pessoa;2507507;1;Mata Paraibana;4;João Pessoa;22;4;1;INSTITUTO FEDERAL DE EDUCACAO, CIENCIA E TECNOLOGIA DA PARAIBA;9062;1166;INSTITUTO FEDERAL DE EDUCAÇÃO, CIÊNCIA E TECNOLOGIA  DA PARAÍBA;IFPB;Avenida Primeiro de Maio;720;;Jaguaribe;58015430;834;1;7;0;5;43;131;109;173;174;138;19;34;0;0;1;1;0;0;0;0;0;0;0;0;693;624;232;392;0;16;103;332;173;600;468;132;16;8;98;152;104;77;86;60;31;16;249;11;270;2;1;71;622;2;0
